stock_code,stock_name,stock_name_chi
77136,"SHENZHEN SUNWAY COMMUNICATION CO., LTD. (A #300136)",信維通信
77137,"HEBEI SAILHERO ENVIRONMENTAL PROTECTION HIGH-TECH CO., LTD. (A #300137)",先河環保
77138,"CHENGUANG BIOTECH GROUP CO.,LTD. (A #300138)",晨光生物
77142,"WALVAX BIOTECHNOLOGY CO.,LTD. (A #300142)",沃森生物
77143,"INKON LIFE TECHNOLOGY CO., LTD. (A #300143)",盈康生命
77144,"SONGCHENG PERFORMANCE DEVELOPMENT CO., LTD. (A #300144)",宋城演藝
77145,"NANFANG ZHONGJIN ENVIRONMENT CO., LTD. (A #300145)",中金環境
77146,"BY-HEALTH CO.,LTD (A #300146)",湯臣倍健
77147,"XIANGXUE PHARMACEUTICAL CO., LTD. (A #300147)",香雪製藥
77148,"TANGEL PUBLISHING CO.,LTD. (A #300148)",天舟文化
77149,"CHEMPARTNER PHARMATECH CO., LTD. (A #300149)",量子生物
77150,"BEIJING CENTURY REAL TECHNOLOGY CO.,LTD. (A #300150)",世紀瑞爾
77151,"SHENZHEN CHANGHONG TECHNOLOGY CO.,LTD. (A #300151)",昌紅科技
77152,"XIONGAN KERONG ENVIRONMENT TECHNOLOGY CO.,LTD. (A #300152)",科融環境
77153,"SHANGHAI COOLTECH POWER CO.,LTD. (A #300153)",科泰電源
77155,"GUANGDONG ANJUBAO DIGITAL TECHNOLOGY CO.,LTD. (A #300155)",安居寶
77157,"LANDOCEAN ENERGY SERVICES CO., LTD. (A #300157)",恆泰艾普
77158,"SHANXI ZHENDONG PHARMACEUTICAL CO.,LTD (A #300158)",振東製藥
77159,"XINJIANG MACHINERY RESEARCH INSTITUTE CO.,LTD (A #300159)",新研股份
77160,"JIANGSU XIUQIANG GLASSWORK CO., LTD. (A #300160)",秀強股份
77166,BUSINESS-INTELLIGENCE OF ORIENTAL NATIONS CORPORATION LTD. (A #300166),東方國信
77168,"WONDERS INFORMATION CO.,LTD. (A #300168)",萬達信息
77170,"HAND ENTERPRISE SOLUTIONS CO.,LTD (A #300170)",漢得信息
77171,"TOFFLON SCIENCE AND TECHNOLOGY GROUP CO.,LTD. (A #300171)",東富龍
77175,"LONTRUE CO.,LIMITED (A #300175)",朗源股份
77177,"GUANGZHOU HI-TARGET NAVIGATION TECH CO.,LTD. (A #300177)",中海達
77178,TEMPUS GLOBAL BUSINESS SERVICE GROUP HOLDING LTD. (A #300178),*ST騰邦
77180,"HUAFON MICROFIBRE (SHANGHAI) CO.,LTD. (A #300180)",華峰超纖
77181,"ZHEJIANG JOLLY PHARMACEUTICAL CO.,LTD (A #300181)",佐力藥業
77182,"BEIJING JETSEN TECHNOLOGY CO.,LTD. (A #300182)",捷成股份
77183,"QINGDAO EASTSOFT COMMUNICATION TECHNOLOGY CO.,LTD. (A #300183)",東軟載波
77184,"WUHAN P&S INFORMATION TECHNOLOGY CO.,LTD (A #300184)",力源信息
77185,"TONGYU HEAVY INDUSTRY CO.,LTD. (A #300185)",通裕重工
77187,"YONKER ENVIRONMENTAL PROTECTION CO.,LTD. (A #300187)",永清環保
77188,"XIAMEN MEIYA PICO INFORMATION CO.,LTD. (A #300188)",美亞柏科
77189,"HAINAN SHENNONG GENE TECHNOLOGY CO.,LTD (A #300189)",神農科技
77190,"WELLE ENVIRONMENTAL GROUP CO.,LTD (A #300190)",維爾利
77191,"SINO GEOPHYSICAL CO.,LTD (A #300191)",潛能恆信
77194,"FUAN PHARMACEUTICAL (GROUP)CO.,LTD (A #300194)",福安藥業
77197,"CECEP TECHAND ECOLOGY & ENVIRONMENT CO.,LTD. (A #300197)",節能鐵漢
77199,"HYBIO PHARMACEUTICAL CO., LTD. (A #300199)",翰宇藥業
77202,"JULONG CO.,LTD. (A #300202)",*ST聚龍
77203,"FOCUSED PHOTONICS (HANGZHOU),INC. (A #300203)",聚光科技
77204,"STAIDSON (BEIJING) BIOPHARMACEUTICALS CO.,LTD. (A #300204)",舒泰神
77205,"WUHAN TIANYU INFORMATION INDUSTRY CO., LTD. (A #300205)",天喻信息
77206,"EDAN INSTRUMENTS,INC, (A #300206)",理邦儀器
77207,"SUNWODA ELECTRONIC CO.,LTD (A #300207)",欣旺達
77209,TIZA INFORMATION INDUSTRY CORPORATION INC. (A #300209),天澤信息
77212,"BEIJING E-HUALU INFORMATION TECHNOLOGY CO.,LTD (A #300212)",易華錄
77215,"SUZHOU ELECTRICAL APPARATUS SCIENCE ACADEMY CO., LTD. (A #300215)",電科院
77219,"HONGLI ZHIHUI GROUP CO.,LTD. (A #300219)",鴻利智匯
77221,"GUANGDONG SILVER AGE SCI&TECH CO.,LTD. (A #300221)",銀禧科技
77222,"CSG SMART SCIENCE&TECHNOLOGY CO.,LTD. (A #300222)",科大智能
77223,"INGENIC SEMICONDUCTOR CO., LTD (A #300223)",北京君正
77224,"YANTAI ZHENGHAI MAGNETIC MATERIAL CO., LTD. (A #300224)",正海磁材
77225,"SHANGHAI KINLITA CHEMICAL CO.,LTD. (A #300225)",金力泰
77226,"SHANGHAI GANGLIAN E-COMMERCE HOLDINGS CO.,LTD. (A #300226)",上海鋼聯
77228,"ZHANGJIAGANG FURUI SPECIAL EQUIPMENT CO.,LTD (A #300228)",富瑞特裝
77229,"TRS INFORMATION TECHNOLOGY CO.,LTD. (A #300229)",拓爾思
77231,"BEIJING TRUST&FAR TECHNOLOGY CO.,LTD (A #300231)",銀信科技
77232,"UNILUMIN GROUP CO., LTD. (A #300232)",洲明科技
77233,"SHANDONG JINCHENG PHARMACEUTICAL GROUP CO.,LTD. (A #300233)",金城醫藥
77236,"SHANGHAI SINYANG SEMICONDUCTOR MATERIALS CO.,LTD. (A #300236)",上海新陽
77237,"SHANDONG MEICHEN ECOLOGY & ENVIRONMENT CO.,LTD. (A #300237)",美晨生態
77238,"GUANHAO BIOTECH CO., LTD (A #300238)",冠昊生物
77244,"DIAN DIAGNOSTICS GROUP CO.,LTD. (A #300244)",迪安診斷
77245,"SHANGHAI DRAGONNET TECHNOLOGY CO., LTD. (A #300245)",天璣科技
77247,"YOUNGY HEALTH CO., LTD. (A #300247)",融捷健康
77248,"NEWCAPEC ELECTRONICS CO., LTD. (A #300248)",新開普
77251,"BEIJING ENLIGHT MEDIA CO., LTD. (A #300251)",光線傳媒
77252,"KINGSIGNAL TECHNOLOGY CO.,LTD. (A #300252)",金信諾
77253,"WINNING HEALTH TECHNOLOGY GROUP CO.,LTD. (A #300253)",衛寧健康
77255,"HEBEI CHANGSHAN BIOCHEMICAL PHARMACEUTICAL CO., LTD. (A #300255)",常山藥業
77256,"ZHEJIANG FIRSTAR PANEL TECHNOLOGY CO.,LTD. (A #300256)",星星科技
77257,"ZHEJIANG KAISHAN COMPRESSOR CO.,LTD. (A #300257)",開山股份
77262,"SAFBON WATER SERVICE (HOLDING) INC., SHANGHAI (A #300262)",巴安水務
77263,"LONGHUA TECHNOLOGY GROUP (LUOYANG) CO., LTD. (A #300263)",隆華科技
77266,"XINGYUAN ENVIRONMENT TECHNOLOGY CO., LTD. (A #300266)",興源環境
77267,"HUNAN ER-KANG PHARMACEUTICAL CO.,LTD. (A #300267)",爾康製藥
77269,"SHENZHEN LIANTRONICS CO.,LTD. (A #300269)",ST聯建
77271,BEIJING THUNISOFT CORPORATION LIMITED (A #300271),華宇軟件
77272,"CANATURE HEALTH TECHNOLOGY GROUP CO.,LTD (A #300272)",開能健康
77273,"ZHUHAI HOKAI MEDICAL INSTRUMENTS CO., LTD. (A #300273)",和佳醫療
77274,"SUNGROW POWER SUPPLY CO.,LTD. (A #300274)",陽光電源
77276,"SANFENG INTELLIGENT EQUIPMENT GROUP CO., LTD. (A #300276)",三豐智能
77284,JSTI GROUP (A #300284),蘇交科
77285,"SHANDONG SINOCERA FUNCTIONAL MATERIAL CO.,LTD. (A #300285)",國瓷材料
77287,"BEIJING PHILISENSE TECHNOLOGY CO.,LTD. (A #300287)",飛利信
77288,"GUIYANG LONGMASTER INFORMATION & TECHNOLOGY CO.,LTD. (A #300288)",朗瑪信息
77289,"BEIJING LEADMAN BIOCHEMISTRY CO.,LTD. (A #300289)",利德曼
77291,"BEIJING HUALUBAINA FILM&TV CO.,LTD. (A #300291)",華錄百納
77292,"WUTONG HOLDING GROUP CO.,LTD (A #300292)",吳通控股
77294,"BOYA BIO-PHARMACEUTICAL GROUP CO., LTD (A #300294)",博雅生物
77295,"EVERYDAY NETWORK CO.,LTD. (A #300295)",三六五網
77296,"LEYARD OPTOELECTRONIC CO.,LTD. (A #300296)",利亞德
77297,"BLUEDON INFORMATION SECURITY TECHNOLOGIES CO.,LTD (A #300297)",藍盾股份
77298,SINOCARE INC. (A #300298),三諾生物
77299,"FUCHUN TECHNOLOGY CO.,LTD (A #300299)",富春股份
77300,"STRAIT INNOVATION INTERNET CO., LTD. (A #300300)",海峽創新
77302,"TOYOU FEIJI ELECTRONICS CO.,LTD. (A #300302)",同有科技
77303,"SHENZHEN JUFEI OPTOELECTRONICS CO.,LTD (A #300303)",聚飛光電
77304,"JIANGSU YUNYI ELECTRIC CO.,LTD. (A #300304)",雲意電氣
77307,"NINGBO CIXING CO.,LTD. (A #300307)",慈星股份
77308,"ZHONGJI INNOLIGHT CO., LTD. (A #300308)",中際旭創
77310,"EASTONE CENTURY TECHNOLOGY CO.,LTD. (A #300310)",宜通世紀
77311,"SURFILTER NETWORK TECHNOLOGY CO.,LTD. (A #300311)",任子行
77314,"NINGBO DAVID MEDICAL DEVICE CO.,LTD. (A #300314)",戴維醫療
77315,"OURPALM CO.,LTD. (A #300315)",掌趣科技
77316,"ZHEJIANG JINGSHENG MECHANICAL & ELECTRICAL CO.,LTD. (A #300316)",晶盛機電
77317,"JIAWEI RENEWABLE ENERGY CO., LTD. (A #300317)",珈偉新能
77318,"BEIJING BOHUI INNOVATION BIOTECHNOLOGY CO.,LTD. (A #300318)",博暉創新
77319,"SHENZHEN MICROGATE TECHNOLOGY CO.,LTD (A #300319)",麥捷科技
77322,"HUIZHOU SPEED WIRELESS TECHNOLOGY CO.,LTD. (A #300322)",碩貝德
77323,HC SEMITEK CORPORATION (A #300323),華燦光電
77324,"BEIJING WATERTEK INFORMATION TECHNOLOGY CO.,LTD. (A #300324)",旋極信息
77326,"SHANGHAI KINETIC MEDICAL CO.,LTD. (A #300326)",凱利泰
77327,SINO WEALTH ELECTRONIC LTD. (A #300327),中穎電子
77328,"DONGGUAN EONTEC CO.,LTD. (A #300328)",宜安科技
77329,"HAILUN PIANO CO.,LTD. (A #300329)",海倫鋼琴
77332,TOP RESOURCE CONSERVATION & ENVIRONMENT CORP. (A #300332),天壕環境
77333,"SINOSUN TECHNOLOGY CO.,LTD. (A #300333)",兆日科技
77334,"TIANJIN MOTIMO MEMBRANE TECHNOLOGY CO.,LTD. (A #300334)",津膜科技
77335,"GUANGZHOU DEVOTION THERMAL TECHNOLOGY CO.,LTD. (A #300335)",迪森股份
77336,"SHANGHAI NEW CULTURE MEDIA GROUP CO.,LTD. (A #300336)",新文化
77337,"YINBANG CLAD MATERIAL CO.,LTD. (A #300337)",銀邦股份
77339,"JIANGSU HOPERUN SOFTWARE CO., LTD. (A #300339)",潤和軟件
77340,"JIANGMEN KANHOO INDUSTRY CO.,LTD (A #300340)",科恆股份
77342,"CHANGSHU TIANYIN ELECTROMECHANICAL CO.,LTD. (A #300342)",天銀機電
77343,"LECRON INDUSTRIAL DEVELOPMENT GROUP CO., LTD. (A #300343)",聯創股份
77346,"JIANGSU NATA OPTO-ELECTRONIC MATERIAL CO.,LTD (A #300346)",南大光電
77347,"HANGZHOU TIGERMED CONSULTING CO.,LTD. (A #300347)",泰格醫藥
77348,"SHENZHEN SUNLINE TECH CO.,LTD. (A #300348)",長亮科技
77349,"GOLDCARD SMART GROUP CO.,LTD. (A #300349)",金卡智能
77351,"ZHEJIANG YONGGUI ELECTRIC EQUIPMENT CO.,LTD. (A #300351)",永貴電器
77352,BEIJING VRV SOFTWARE CORPORATION LIMITED. (A #300352),北信源
77353,"KYLAND TECHNOLOGY CO.,LTD. (A #300353)",東土科技
77355,"INNER MONGOLIA M-GRASS ECOLOGY AND ENVIRONMENT (GP) CO.,LTD. (A #300355)",蒙草生態
77357,"ZHEJIANG WOLWO BIO-PHARMACEUTICAL CO., LTD. (A #300357)",我武生物
77359,"QTONE EDUCATION GROUP (GUANGDONG).,LTD. (A #300359)",全通教育
77363,PORTON PHARMA SOLUTIONS LTD. (A #300363),博騰股份
77364,"COL DIGITAL PUBLISHING GROUP CO.,LTD. (A #300364)",中文在線
77365,"BEIJING FOREVER TECHNOLOGY CO., LTD (A #300365)",恆華科技
77366,"TROY INFORMATION TECHNOLOGY CO.,LTD. (A #300366)",創意信息
77367,"NETPOSA TECHNOLOGIES,LTD. (A #300367)",ST網力
77368,"HEBEI HUIJIN GROUP CO., LTD. (A #300368)",匯金股份
77369,"NSFOCUS TECHNOLOGIES GROUP CO., LTD. (A #300369)",綠盟科技
77373,"YANGZHOU YANGJIE ELECTRONIC TECHNOLOGY CO.,LTD. (A #300373)",揚傑科技
77376,"EAST GROUP CO., LTD (A #300376)",易事特
77377,"SHENZHEN YSSTECH INFO-TECH CO.,LTD (A #300377)",贏時勝
77378,"DIGIWIN SOFTWARE CO.,LTD. (A #300378)",鼎捷軟件
77379,"BEIJING TONGTECH CO,. LTD. (A #300379)",東方通
77383,"BEIJING SINNET TECHNOLOGY CO.,LTD. (A #300383)",光環新網
77386,"FEITIAN TECHNOLOGIES CO.,LTD. (A #300386)",飛天誠信
77388,"CECEP GUOZHEN ENVIRONMENTAL PROTECTION TECHNOLOGY CO., LTD. (A #300388)",節能國禎
77390,"SUZHOU TA&A ULTRA CLEAN TECHNOLOGY CO.,LTD. (A #300390)",天華超淨
77392,BEIJING TENSYN DIGITAL MARKETING TECH JOINT STOCK COMPANY (A #300392),騰信股份
77394,"SUZHOU TFC OPTICAL COMMUNICATION CO., LTD. (A #300394)",天孚通信
77395,HUBEI FEILIHUA QUARTZ GLASS CO.LTD (A #300395),菲利華
77396,"DIRUI INDUSTRIAL CO.,LTD. (A #300396)",迪瑞醫療
77397,"XI'AN TIANHE DEFENSE TECHNOLOGY CO.,LTD. (A #300397)",天和防務
77398,"SHANGHAI PHICHEM MATERIAL CO., LTD. (A #300398)",飛凱材料
77401,"ZHEJIANG GARDEN BIO-CHEMICAL HIGH-TECH CO., LTD (A #300401)",花園生物
77406,"BEIJING STRONG BIOTECHNOLOGIES, INC (A #300406)",九強生物
77408,"CHAOZHOU THREE-CIRCLE (GROUP) CO.,LTD. (A #300408)",三環集團
77409,"GUANGDONG DOWSTONE TECHNOLOGY CO.,LTD. (A #300409)",道氏技術
77413,"MANGO EXCELLENT MEDIA CO., LTD. (A #300413)",芒果超媒
77418,"KUNLUN TECH CO., LTD. (A #300418)",昆侖萬維
77422,"GUANGXI BOSSCO ENVIRONMENTAL PROTECTION TECHNOLOGY CO.,LTD. (A #300422)",博世科
77423,"SUNFLY INTELLIGENT TECHNOLOGY CO., LTD (A #300423)",魯億通
77427,RED PHASE INC. (A #300427),紅相股份
77428,"LIZHONG SITONG LIGHT ALLOYS GROUP CO., LTD. (A #300428)",立中集團
77429,"CHANGZHOU TRONLY NEW ELECTRONIC MATERIALS CO.,LTD. (A #300429)",強力新材
77432,"MIANYANG FULIN PRECISION CO.,LTD. (A #300432)",富臨精工
77433,"LENS TECHNOLOGY CO., LTD. (A #300433)",藍思科技
77438,"GUANGZHOU GREAT POWER ENERGY&TECHNOLOGY CO., LTD. (A #300438)",鵬輝能源
77439,"MEDICALSYSTEM BIOTECHNOLOGY CO., LTD (A #300439)",美康生物
77441,"NINGBO BAOSI ENERGY EQUIPMENT CO., LTD. (A #300441)",鮑斯股份
77443,"JINLEI TECHNOLOGY CO., LTD. (A #300443)",金雷股份
77448,"HAOYUN TECHNOLOGIES CO.,LTD (A #300448)",浩雲科技
77450,"WUXI LEAD INTELLIGENT EQUIPMENT CO.,LTD (A #300450)",先導智能
77451,"B-SOFT CO.,LTD (A #300451)",創業慧康
77454,SANGFOR TECHNOLOGIES INC. (A #300454),深信服
77455,BEIJING CTROWELL TECHNOLOGY CORPORATION LIMITED (A #300455),康拓紅外
77456,SAI MICROELECTRONICS INC. (A #300456),賽微電子
77457,"SHENZHEN YINGHE TECHNOLOGY CO.,LTD (A #300457)",贏合科技
77458,"ALLWINNER TECHNOLOGY CO., LTD. (A #300458)",全志科技
77459,"ZHEJIANG JINKE CULTURE INDUSTRY CO., LTD. (A #300459)",金科文化
77463,"MACCURA BIOTECHNOLOGY CO., LTD. (A #300463)",邁克生物
77465,"GLOBAL INFOTECH CO.,LTD. (A #300465)",高偉達
77467,"SICHUAN XUNYOU NETWORK TECHNOLOGY CO.,LTD (A #300467)",迅游科技
77468,"SHENZHEN FORMS SYNTRON INFORMAITON CO., LTD (A #300468)",四方精創
77470,"SINOSEAL HOLDING CO.,LTD. (A #300470)",中密控股
77474,"CHANGSHA JINGJIA MICROELECTRONICS CO.,LTD. (A #300474)",景嘉微
77476,"VICTORY GIANT TECHNOLOGY (HUIZHOU) CO., LTD. (A #300476)",勝宏科技
77477,"BEIJING HEZONG SCIENCE&TECHNOLOGY CO., LTD. (A #300477)",合縱科技
77481,"PUYANG HUICHENG ELECTRONIC MATERIAL CO., LTD. (A #300481)",濮陽惠成
77482,"GUANGZHOU WONDFO BIOTECH CO.,LTD (A #300482)",萬孚生物
77484,"SHENZHEN V&T TECHNOLOGIES CO., LTD. (A #300484)",藍海華騰
77485,"BEIJING SCIENCE SUN PHARMACEUTICAL CO.,LTD. (A #300485)",賽升藥業
77487,"SUNRESIN NEW MATERIALS CO.,LTD, XI""AN (A #300487)",藍曉科技
77494,"HUBEI CENTURY NETWORK TECHNOLOGY CO., LTD. (A #300494)",盛天網絡
77495,"MISHO ECOLOGY & LANDSCAPE CO., LTD. (A #300495)",*ST美尚
77496,"THUNDER SOFTWARE TECHNOLOGY CO., LTD. (A #300496)",中科創達
77497,"JIANGXI FUSHINE PHARMACEUTICAL CO.,LTD. (A #300497)","JIANGXI FUSHINE PHARMACEUTICAL CO.,LTD. (A #300497)"
77498,"WENS FOODSTUFF GROUP CO., LTD. (A #300498)",溫氏股份
77502,"EOPTOLINK TECHNOLOGY INC., LTD (A #300502)",新易盛
77503,"GUANGZHOU HAOZHI INDUSTRIAL CO.,LTD. (A #300503)",昊志機電
77504,"SICHUAN TIANYI COMHEART TELECOM CO., LTD. (A #300504)",天邑股份
77506,"SHENZHEN MINKAVE TECHNOLOGY CO., LTD. (A #300506)",名家匯
77507,"JIANGSU OLIVE SENSORS HIGH-TECH CO.,LTD (A #300507)",蘇奧傳感
77508,"SHANGHAI WEIHONG ELECTRONIC TECHNOLOGY CO., LTD. (A #300508)",維宏股份
77511,"SHANGHAI XUERONG BIOTECHNOLOGY CO.,LTD. (A #300511)",雪榕生物
77512,"HANGZHOU ZHONGYA MACHINERY CO., LTD. (A #300512)",中亞股份
77516,"HUBEI JIUZHIYANG INFRARED SYSTEM CO., LTD (A #300516)",久之洋
77518,"SHENZHEN SHENGXUNDA TECHNOLOGY CO.,LTD. (A #300518)",盛訊達
77523,"BEIJING GLOBAL SAFETY TECHNOLOGY CO., LTD. (A #300523)",辰安科技
77525,FUJIAN BOSS SOFTWARE CORP. (A #300525),博思軟件
77526,CHINA DIVE COMPANY LIMITED (A #300526),中潛股份
77527,"CHINA HARZONE INDUSTRY CORP., LTD (A #300527)",中船應急
77529,"JAFRON BIOMEDICAL CO.,LTD. (A #300529)",健帆生物
77531,"UROVO TECHNOLOGY CO., LTD. (A #300531)",優博訊
77548,"BROADEX TECHNOLOGIES CO.,LTD. (A #300548)",博創科技
77552,"VANJEE TECHNOLOGY CO., LTD. (A #300552)",萬集科技
77558,"BETTA PHARMACEUTICALS CO.,LTD (A #300558)",貝達藥業
77559,"CHENGDU JIAFAANTAI EDUCATION TECHNOLOGY CO.,LTD. (A #300559)",佳發教育
77567,"WUHAN JINGCE ELECTRONIC GROUP CO.,LTD (A #300567)",精測電子
77568,"SHENZHEN SENIOR TECHNOLOGY MATERIAL CO., LTD. (A #300568)",星源材質
77570,"T&S COMMUNICATIONS CO.,LTD (A #300570)",太辰光
77571,"HANGZHOU ANYSOFT INFORMATION TECHNOLOGY CO., LTD. (A #300571)",平治信息
77572,"SHENZHEN ANCHE TECHNOLOGIES CO., LTD. (A #300572)",安車檢測
77573,"SHENYANG XINGQI PHARMACEUTICAL CO., LTD. (A #300573)",興齊眼藥
77576,"SHENZHEN RONGDA PHOTOSENSITIVE & TECHNOLOGY CO., LTD. (A #300576)",容大感光
77577,"ANHUI KORRUN CO.,LTD (A #300577)",開潤股份
77579,"BEIJING CERTIFICATE AUTHORITY CO., LTD. (A #300579)",數字認證
77590,"QUECLINK WIRELESS SOLUTIONS CO., LTD. (A #300590)",移為通信
77595,OVCTEK CHINA INC (A #300595),歐普康視
77596,RIANLON CORPORATION (A #300596),利安隆
77598,"ARCHERMIND TECHNOLOGY (NANJING) CO., LTD. (A #300598)",誠邁科技
77601,"SHENZHEN KANGTAI BIOLOGICAL PRODUCTS CO.,LTD. (A #300601)",康泰生物
77602,"SHENZHEN FRD SCIENCE & TECHNOLOGY CO., LTD. (A #300602)",飛榮達
77603,"LEON TECHNOLOGY CO.,LTD. (A #300603)",立昂技術
77604,"HANGZHOU CHANG CHUAN TECHNOLOGY CO.,LTD. (A #300604)",長川科技
77607,"GUANGDONG TOPSTAR TECHNOLOGY CO.,LTD (A #300607)",拓斯達
77613,"SHANGHAI FULLHAN MICROELECTRONICS CO., LTD. (A #300613)",富瀚微
77616,"GUANGZHOU SHANGPIN HOME COLLECTION CO., LTD (A #300616)",尚品宅配
77618,"NANJING HANRUI COBALT CO.,LTD. (A #300618)",寒銳鈷業
77623,"JIANGSU JIEJIE MICROELECTRONICS CO.,LTD. (A #300623)",捷捷微電
77624,"WONDERSHARE TECHNOLOGY GROUP CO.,LTD (A #300624)",萬興科技
77627,SHANGHAI HUACE NAVIGATION TECHNOLOGY LTD. (A #300627),華測導航
77628,YEALINK NETWORK TECHNOLOGY CORPORATION LIMITED (A #300628),億聯網絡
77630,"HAINAN POLY PHARM. CO., LTD. (A #300630)",普利製藥
77633,SONOSCAPE MEDICAL CORP. (A #300633),開立醫療
77634,"RICHINFO TECHNOLOGY CO., LTD. (A #300634)",彩訊股份
77638,FIBOCOM WIRELESS INC. (A #300638),廣和通
77639,"GUANGDONG HYBRIBIO BIOTECH CO.,LTD. (A #300639)",凱普生物
77653,"YANTAI ZHENGHAI BIO-TECH CO., LTD. (A #300653)",正海生物
77655,"SUZHOU CRYSTAL CLEAR CHEMICAL CO.,LTD (A #300655)",晶瑞股份
77657,XIAMEN HONGXIN ELECTRONICS TECHNOLOGY GROUP INC. (A #300657),弘信電子
77659,ZHONGFU INFORMATION INC. (A #300659),中孚信息
77661,SG MICRO CORP (A #300661),聖邦股份
77662,"BEIJING CAREER INTERNATIONAL CO., LTD. (A #300662)",科銳國際
77663,"CLIENT SERVICE INTERNATIONAL, INC. (A #300663)",科藍軟件
77664,"PENYAO ENVIRONMENTAL PROTECTION CO., LTD. (A #300664)",鵬鷂環保
77666,"KONFOONG MATERIALS INTERNATIONAL CO., LTD. (A #300666)",江豐電子
77672,"HUNAN GOKE MICROELECTRONICS CO., LTD. (A #300672)",國科微
77673,"PETPAL PET NUTRITION TECHNOLOGY CO., LTD. (A #300673)",佩蒂股份
77674,"YUSYS TECHNOLOGIES CO., LTD. (A #300674)",宇信科技
77676,"BGI GENOMICS CO., LTD. (A #300676)",華大基因
77677,"INTCO MEDICAL TECHNOLOGY CO., LTD. (A #300677)",英科醫療
77679,"ELECTRIC CONNECTOR TECHNOLOGY CO., LTD. (A #300679)",電連技術
77682,"LONGSHINE TECHNOLOGY GROUP CO., LTD. (A #300682)",朗新科技
77684,JONES TECH PLC (A #300684),中石科技
77685,"AMOY DIAGNOSTICS CO.,LTD. (A #300685)",艾德生物
77696,CHENGDU ALD AVIATION MANUFACTURING CORPORATION. (A #300696),愛樂達
77699,"WEIHAI GUANGWEI COMPOSITES CO., LTD. (A #300699)",光威複材
77702,"ZHEJIANG TIANYU PHARMACEUTICAL CO., LTD. (A #300702)",天宇股份
77706,"FUJIAN ACETRON NEW MATERIALS CO., LTD. (A #300706)",阿石創
77708,"FOCUS LIGHTINGS TECH CO.,LTD. (A #300708)",聚燦光電
77709,"JIANGSU GIAN TECHNOLOGY CO., LTD. (A #300709)",精研科技
77715,"JIANGSU CANLON BUILDING MATERIALS CO., LTD. (A #300715)",凱倫股份
77722,"JIANGXI XINYU GUOKE TECHNOLOGY CO., LTD. (A #300722)",新余國科
77723,"YIPINHONG PHARMACEUTICAL CO., LTD. (A #300723)",一品紅
77724,SHENZHEN S.C NEW ENERGY TECHNOLOGY CORPORATION (A #300724),捷佳偉創
77725,"PHARMABLOCK SCIENCES (NANJING), INC. (A #300725)",藥石科技
77726,"ZHUZHOU HONGDA ELECTRONICS CORP., LTD. (A #300726)",宏達電子
77735,"DBG TECHNOLOGY CO., LTD. (A #300735)",光弘科技
77737,"KESHUN WATERPROOF TECHNOLGIES CO., LTD. (A #300737)",科順股份
77738,"GUANGDONG AOFEI DATA TECHNOLOGY CO., LTD. (A #300738)",奧飛數據
77739,"SUNSHINE GLOBAL CIRCUITS CO., LTD. (A #300739)",明陽電路
77740,"SYOUNG GROUP CO., LTD. (A #300740)",水羊股份
77741,"HUABAO FLAVOURS & FRAGRANCES CO., LTD (A #300741)",華寶股份
77745,"SHINRY TECHNOLOGIES CO.,LTD. (A #300745)",欣銳科技
77747,"WUHAN RAYCUS FIBER LASER TECHNOLOGIES CO., LTD. (A #300747)",銳科激光
77748,"JL MAG RARE-EARTH CO., LTD. (A #300748)",金力永磁
77750,"CONTEMPORARY AMPEREX TECHNOLOGY CO., LIMITED (A #300750)",寧德時代
77751,"SUZHOU MAXWELL TECHNOLOGIES CO., LTD. (A #300751)",邁為股份
77755,"VATS LIQUOR CHAIN STORE MANAGEMENT JOINT STOCK CO.,LTD. (A #300755)",華致酒行
77759,"PHARMARON BEIJING CO., LTD. (A #300759)",康龍化成
77760,"SHENZHEN MINDRAY BIO-MEDICAL ELECTRONICS CO., LTD. (A #300760)",邁瑞醫療
77761,"JIANGSU LIHUA ANIMAL HUSBANDRY CO., LTD. (A #300761)",立華股份
77762,"JUSHRI TECHNOLOGIES, INC. (A #300762)",上海瀚訊
77763,"GINLONG TECHNOLOGIES CO., LTD. (A #300763)",錦浪科技
77765,"CSPC INNOVATION PHARMACEUTICAL CO.,LTD. (A #300765)",新諾威
77766,"MERIT INTERACTIVE CO.,LTD. (A #300766)",每日互動
77767,"QUAKESAFE TECHNOLOGIES CO.,LTD. (A #300767)",震安科技
77768,"HANGZHOU DPTECH TECHNOLOGIES CO.,LTD. (A #300768)",迪普科技
77770,"GUANGDONG SOUTH NEW MEDIA CO.,LTD (A #300770)",新媒股份
77771,"SHENZHEN ZHILAI SCI AND TECH CO., LTD. (A #300771)",智萊科技
77773,"LAKALA PAYMENT CO., LTD. (A #300773)",拉卡拉
77775,"XI'AN TRIANGLE DEFENSE CO.,LTD. (A #300775)",三角防務
77776,"WUHAN DR LASER TECHNOLOGY CORP.,LTD (A #300776)",帝爾激光
77777,"SINOFIBERS TECHNOLOGY CO.,LTD. (A #300777)",中簡科技
77782,MAXSCEND MICROELECTRONICS COMPANY LIMITED (A #300782),卓勝微
77783,THREE SQUIRRELS INC. (A #300783),三只松鼠
77785,"BEIJING ZHIDEMAI TECHNOLOGY CO., LTD. (A #300785)",值得買
77788,CITIC PRESS CORPORATION (A #300788),中信出版
77791,"SIRIO PHARMA CO., LTD. (A #300791)",仙樂健康
77792,HANGZHOU ONECHANCE TECH CORP. (A #300792),壹網壹創
77793,"COSONIC INTELLIGENT TECHNOLOGIES CO., LTD. (A #300793)",佳禾智能
77799,"BEIJING ZUOJIANG TECHNOLOGY CO., LTD. (A #300799)",左江科技
77803,"BEIJING COMPASS TECHNOLOGY DEVELOPMENT CO., LTD. (A #300803)",指南針
77805,"GUANGDONG BRANDMAX MARKETING CO.,LTD. (A #300805)",電聲股份
77815,"EIT ENVIRONMENTAL DEVELOPMENT GROUP CO.,LTD (A #300815)",玉禾田
77821,"SHANDONG DONGYUE ORGANOSILICON MATERIALS CO., LTD. (A #300821)",東岳矽材
77829,"HENAN JINDAN LACTIC ACID TECHNOLOGY CO., LTD (A #300829)",金丹科技
77832,"SHENZHEN NEW INDUSTRIES BIOMEDICAL ENGINEERING CO., LTD. (A #300832)",新產業
77841,"CHENGDU KANGHUA BIOLOGICAL PRODUCTS CO., LTD. (A #300841)",康華生物
77846,"CAPITALONLINE DATA SERVICE CO.,LTD. (A #300846)",首都在線
77850,"LUOYANG XINQIANGLIAN SLEWING BEARING CO.,LTD. (A #300850)",新強聯
77855,"JIANGSU TOLAND ALLOY CO.,LTD (A #300855)",圖南股份
77860,"BEIJING FENGSHANGSHIJI CULTURE MEDIA CO., LTD. (A #300860)",鋒尚文化
77861,"YANGLING METRON NEW MATERIAL CO., LTD. (A #300861)",美暢股份
77866,"ANKER INNOVATIONS TECHNOLOGY CO., LTD (A #300866)",安克創新
77867,"SHENGYUAN ENVIRONMENTAL PROTECTION CO.,LTD. (A #300867)",聖元環保
77869,"CONTEC MEDICAL SYSTEMS CO., LTD. (A #300869)",康泰醫學
77872,"TANSUN TECHNOLOGY CO.,LTD. (A #300872)",天陽科技
77888,"WINNER MEDICAL CO., LTD. (A #300888)",穩健醫療
77891,"GUANGDONG HUIYUN TITANIUM INDUSTRY CO., LTD. (A #300891)",惠雲鈦業
77896,"IMEIK TECHNOLOGY DEVELOPMENT CO.,LTD. (A #300896)",愛美客
77900,"GUANGLIAN AVIATION INDUSTRY CO., LTD. (A #300900)",廣聯航空
77999,"YIHAI KERRY ARAWANA HOLDINGS CO., LTD (A #300999)",金龍魚
78039,"CIMC VEHICLES (GROUP) CO., LTD. (A #301039)",中集車輛
80737,SZ INVESTMENT HLDGS BAY AREA DEV CO LTD -RMB TRADED SHARES,灣區發展-R
82805,VANGUARD FTSE ASIA EX JAPAN INDEX ETF -RMB TRADED UNITS,領航亞洲-R
82811,HAITONG CSI300 INDEX ETF -RMB TRADED UNITS,海通滬深三百-R
82813,CHINAAMC BLOOMBERG BARCLAYS CHI TREASURY +POLICY BK BD IND ETF-RMB TRADED UNITS,華夏政銀國債－Ｒ
82817,PREMIA CHINA TREASURY AND POLICY BANK BOND LONG DURATION ETF-RMB TRADED UNITS,PP長期國債-R
82822,CSOP FTSE CHINA A50 ETF-RMB TRADED UNITS,南方A50-R
82823,ISHARES FTSE CHINA A50 ETF -RMB COUNTER,安碩Ａ５０－Ｒ
82828,HANG SENG CHINA ENTERPRISES INDEX ETF -RMB TRADED UNITS,恆生中國企業－R
82832,BOSERA STAR 50 INDEX ETF -RMB TRADED UNITS,博時科創50-R
82833,HANG SENG INDEX ETF -RMB TRADED UNITS,恆指ＥＴＦ-R
82834,ISHARES NASDAQ 100 ETF - RMB TRADED UNITS,安碩納指一百－Ｒ
82836,ISHARES CORE S&P BSE SENSEX INDIA ETF -RMB COUNTER,安碩印度-R
82843,AMUNDI FTSE CHINA A50 INDEX ETF -RMB TRADED UNITS,東匯A50-R
82846,ISHARES CORE CSI 300 ETF -RMB COUNTER,安碩滬深三百-R
83001,PREMIA CHINA USD PROPERTY BOND ETF -RMB TRADED UNITS,PP中地美債-R
83005,CSOP CSI 500 ETF-RMB TRADED UNITS,南方中證五百-R
83010,ISHARES CORE MSCI ASIA EX JAPAN ETF -RMB COUNTER,安碩亞洲除日-R
83012,AMUNDI HANG SENG HK 35 INDEX ETF -RMB TRADED UNITS,東匯香港３５－Ｒ
83031,HAITONG MSCI CHINA A ESG ETF - RMB TRADED UNITS,海通AESG-R
83053,CSOP HONG KONG DOLLAR MONEY MARKET ETF - RMB TRADED UNITS,南方港元貨幣－Ｒ
83074,ISHARES CORE MSCI TAIWAN ETF - RMB TRADED UNITS,安碩ＭＳ台灣－Ｒ
83079,CICC BLOOMBERG BARCLAYS CHINA TREASURY 1-10 YEARS ETF-RMB TRADED UNITS,中金中國國債-R
83081,VALUE GOLD ETF -RMB TRADED UNITS,價值黃金-R
83085,VANGUARD FTSE ASIA EX JAPAN HIGH DIV YIELD INDEX ETF-RMB TRADED UNITS,領航亞洲高息-R
83093,CICC CSI SELECT 100 ETF-RMB TRADED UNITS,中金優選一百-R
