stock_code,stock_name,stock_name_chi
1758,BOJUN EDUCATION COMPANY LIMITED,博駿教育
1759,SINO GAS HOLDINGS GROUP LIMITED,中油潔能控股
1760,INTRON TECHNOLOGY HOLDINGS LIMITED,英恆科技
1761,BABYTREE GROUP,寶寶樹集團
1762,WANKA ONLINE INC.,萬咖壹聯
1763,CHINA ISOTOPE & RADIATION CORPORATION,中國同輻
1765,"HOPE EDUCATION GROUP CO., LTD.",希望教育
1766,CRRC CORPORATION LIMITED,中國中車
1767,TS WONDERS HOLDING LIMITED,TS WONDERS HOLDING LIMITED
1769,SCHOLAR EDUCATION GROUP,思考樂教育
1771,SUNFONDA GROUP HOLDINGS LIMITED,新豐泰集團
1772,"GANFENG LITHIUM CO., LTD.",贛鋒鋰業
1773,TIANLI EDUCATION INTERNATIONAL HOLDINGS LIMITED,天立教育
1775,BEXCELLENT GROUP HOLDINGS LIMITED,精英匯集團
1776,"GF SECURITIES CO., LTD.",廣發証券
1777,"FANTASIA HOLDINGS GROUP CO., LIMITED",花樣年控股
1778,"COLOUR LIFE SERVICES GROUP CO., LIMITED",彩生活
1780,B & D STRATEGIC HOLDINGS LIMITED,B & D STRATEGIC HOLDINGS LIMITED
1781,SUN CHEONG CREATIVE DEVELOPMENT HOLDINGS LIMITED,新昌創展控股
1782,VIXTEL TECHNOLOGIES HOLDINGS LIMITED,飛思達科技
1783,GOLDEN PONDER HOLDINGS LIMITED,金侖控股有限公司
1785,"CHENGDU EXPRESSWAY CO., LTD",成都高速
1786,CRCC HIGH-TECH EQUIPMENT CORPORATION LIMITED,鐵建裝備
1787,"SHANDONG GOLD MINING CO., LTD.",山東黃金
1788,GUOTAI JUNAN INTERNATIONAL HOLDINGS LIMITED,國泰君安國際
1789,AK MEDICAL HOLDINGS LIMITED,愛康醫療
1790,TIL ENVIRO LIMITED,達力環保
1792,CMON LIMITED,CMON LIMITED
1793,WECON HOLDINGS LIMITED,偉工控股
1795,YADONG GROUP HOLDINGS LIMITED,亞東集團
1796,YIELD GO HOLDINGS LTD.,耀高控股
1797,KOOLEARN TECHNOLOGY HOLDING LIMITED,新東方在線
1798,"CHINA DATANG CORPORATION RENEWABLE POWER CO., LIMITED",大唐新能源
1799,"XINTE ENERGY CO., LTD.",新特能源
1800,CHINA COMMUNICATIONS CONSTRUCTION COMPANY LIMITED,中國交通建設
1801,"INNOVENT BIOLOGICS, INC.",信達生物
1802,WENYE GROUP HOLDINGS LIMITED,文業集團
1803,BEIJING SPORTS AND ENTERTAINMENT INDUSTRY GROUP LIMITED,北京體育文化
1808,ENTERPRISE DEVELOPMENT HOLDINGS LIMITED,企展控股
1809,PRINX CHENGSHAN HOLDINGS LIMITED,浦林成山
1810,XIAOMI CORPORATION,小米集團－Ｗ
1811,"CGN NEW ENERGY HOLDINGS CO., LTD.",中廣核新能源
1812,SHANDONG CHENMING PAPER HOLDINGS LIMITED,晨鳴紙業
1813,KWG GROUP HOLDINGS LIMITED,合景泰富集團
1815,CSMALL GROUP LIMITED,金貓銀貓
1816,"CGN POWER CO., LTD",中廣核電力
1817,MULSANNE GROUP HOLDING LIMITED,慕尚集團控股
1818,ZHAOJIN MINING INDUSTRY COMPANY LIMITED,招金礦業
1820,PACIFIC MILLENNIUM PACKAGING GROUP CORPORATION,濟豐包裝
1821,ESR CAYMAN LIMITED,ESR CAYMAN LIMITED
1822,"CHINA WOOD INTERNATIONAL HOLDING CO., LIMITED",中木國際
1823,HUAYU EXPRESSWAY GROUP LIMITED,華昱高速
1825,STERLING GROUP HOLDINGS LIMITED-NEW,STERLING GROUP HOLDINGS LIMITED-NEW
1826,STEERING HOLDINGS LIMITED,旭通控股
1827,MIRICOR ENTERPRISES HOLDINGS LIMITED,卓珈控股
1829,CHINA MACHINERY ENGINEERING CORPORATION,中國機械工程
1830,PERFECT MEDICAL HEALTH MANAGEMENT LTD-1K,完美醫療(一千)
1831,SHIFANG HOLDING LIMITED,十方控股
1832,S.A.I. LEISURE GROUP COMPANY LIMITED,海天地悅旅
1833,PING AN HEALTHCARE AND TECHNOLOGY COMPANY LIMITED,平安好醫生
1835,"SHANGHAI REALWAY CAPITAL ASSETS MANAGEMENT CO., LTD.",瑞威資管
1836,STELLA INTERNATIONAL HOLDINGS LIMITED,九興控股
1837,NATURAL FOOD INTERNATIONAL HOLDING LIMITED,五谷磨房
1838,CHINA PROPERTIES GROUP LIMITED,CHINA PROPERTIES GROUP LIMITED
1839,"CIMC VEHICLES (GROUP) CO., LTD.",中集車輛
1841,A.PLUS GROUP HOLDINGS LIMITED,優越集團控股
1842,GROWN UP GROUP INVESTMENT HOLDINGS LIMITED,植華集團
1843,SNACK EMPIRE HOLDINGS LIMITED,快餐帝國
1845,WEIGANG ENVIRONMENTAL TECHNOLOGY HOLDING GROUP LIMITED,維港環保科技
1846,EUROEYES INTERNATIONAL EYE CLINIC LIMITED,德視佳
1847,YCIH GREEN HIGH-PERFORMANCE CONCRETE COMPANY LIMITED,雲南建投混凝土
1848,CHINA AIRCRAFT LEASING GROUP HOLDINGS LIMITED,中國飛機租賃
1849,AM GROUP HOLDINGS LIMITED,秀商時代控股
1850,WINDMILL GROUP LIMITED,海鑫集團
1851,CHINA GINGKO EDUCATION GROUP COMPANY LIMITED,銀杏教育
1853,JILIN PROVINCE CHUNCHENG HEATING COMPANY LIMITED,春城熱力
1854,GOAL FORWARD HOLDINGS LIMITED,展程控股
1855,ZONBONG LANDSCAPE ENVIRONMENTAL LIMITED,中邦環境
1856,ERNEST BOREL HOLDINGS LIMITED,依波路
1857,CHINA EVERBRIGHT WATER LIMITED,中國光大水務
1858,"BEIJING CHUNLIZHENGDA MEDICAL INSTRUMENTS CO., LTD.",春立醫療
1859,CHINA BRIGHT CULTURE GROUP,煜盛文化
1860,MOBVISTA INC.,匯量科技
1861,PRECIOUS DRAGON TECHNOLOGY HOLDINGS LIMITED,保寶龍科技
1862,JINGRUI HOLDINGS LIMITED,景瑞控股
1863,CHINA LONGEVITY GROUP COMPANY LIMITED,中國龍天集團
1865,TRENDZON HOLDINGS GROUP LIMITED,卓航控股
1866,CHINA XLX FERTILISER LTD,中國心連心化肥
1867,LKS HOLDING GROUP LIMITED,樂嘉思控股
1868,NEO-NEON HOLDINGS LIMITED,同方友友
1869,LI BAO GE GROUP LIMITED,利寶閣集團
1870,ACME INTERNATIONAL HOLDINGS LIMITED,益美國際控股
1871,CHINA ORIENTED INTERNATIONAL HOLDINGS LIMITED,向中國際
1872,GUAN CHAO HOLDINGS LIMITED,GUAN CHAO HOLDINGS LIMITED
1873,VIVA BIOTECH HOLDINGS,維亞生物
1875,TOT BIOPHARM INTERNATIONAL COMPANY LIMITED,東曜藥業-B
1876,BUDWEISER BREWING COMPANY APAC LIMITED,百威亞太
1877,"SHANGHAI JUNSHI BIOSCIENCES CO., LTD.",君實生物
1878,SOUTHGOBI RESOURCES LIMITED,南戈壁-S
1881,REGAL REAL ESTATE INVESTMENT TRUST,富豪產業信託
1882,HAITIAN INTERNATIONAL HOLDINGS LIMITED,海天國際
1883,CITIC TELECOM INTERNATIONAL HOLDINGS LIMITED,中信國際電訊
1884,EPRINT GROUP LIMITED,EPRINT集團
1885,CHINA WOOD OPTIMIZATION (HOLDING) LIMITED,中國優材
1888,KINGBOARD LAMINATES HOLDINGS LIMITED,建滔積層板
1889,SANAI HEALTH INDUSTRY GROUP COMPANY LIMITED,三愛健康集團
1890,CHINA KEPEI EDUCATION GROUP LIMITED,中國科培
1891,HENG HUP HOLDINGS LIMITED,興合控股
1894,HANG YICK HOLDINGS COMPANY LIMITED,恆益控股
1895,XINYUAN PROPERTY MANAGEMENT SERVICE (CAYMAN) LTD.,鑫苑服務
1896,MAOYAN ENTERTAINMENT,貓眼娛樂
1897,MILLION HOPE INDUSTRIES HOLDINGS LIMITED,美亨實業
1898,CHINA COAL ENERGY COMPANY LIMITED,中煤能源
1899,XINGDA INTERNATIONAL HOLDINGS LIMITED,興達國際
1900,"CHINA ITS (HOLDINGS) CO., LTD.",中國智能交通
1901,FEIYANG INTERNATIONAL HOLDINGS GROUP LIMITED,飛揚集團
1902,"YINCHENG INTERNATIONAL HOLDING CO., LTD.",銀城國際控股
1903,JBB BUILDERS INTERNATIONAL LIMITED,JBB BUILDERS INTERNATIONAL LIMITED
1905,"HAITONG UNITRUST INTERNATIONAL FINANCIAL LEASING CO., LTD.",海通恆信
1906,BONNY INTERNATIONAL HOLDING LIMITED,博尼控股
1907,CHINA RISUN GROUP LIMITED,中國旭陽集團
1908,C&D INTERNATIONAL INVESTMENT GROUP LIMITED,建發國際集團
1909,FIRE ROCK HOLDINGS LIMITED,火岩控股
1910,SAMSONITE INTERNATIONAL S.A.,新秀麗
1911,CHINA RENAISSANCE HOLDINGS LIMITED,華興資本控股
1912,CONTEL TECHNOLOGY COMPANY LIMITED,康特隆
1913,PRADA S.P.A.,普拉達
1915,YANGZHOU GUANGLING DISTRICT TAIHE RURAL MICRO-FINANCE COMPANY LIMITED,泰和小貸
1916,"JIANGXI BANK CO., LTD.",江西銀行
1917,DOUMOB,豆盟科技
1918,SUNAC CHINA HOLDINGS LIMITED,融創中國
1919,"COSCO SHIPPING HOLDINGS CO., LTD.",中遠海控
1920,HANDS FORM HOLDINGS LIMITED,恆新豐控股
1921,DALIPAL HOLDINGS LIMITED,達力普控股
1922,"YINCHENG LIFE SERVICE CO., LTD.",銀城生活服務
1925,KWUNG'S HOLDINGS LIMITED,曠世控股
1927,JIUJIUWANG FOOD INTERNATIONAL LIMITED,久久王
1928,SANDS CHINA LTD.,金沙中國有限公司
1929,CHOW TAI FOOK JEWELLERY GROUP LIMITED,周大福
1930,SHINELONG AUTOMOTIVE LIGHTWEIGHT APPLICATION LIMITED,勛龍
1931,IVD MEDICAL HOLDING LIMITED,華檢醫療
1932,CPM GROUP LIMITED,中漆集團
1933,ONEFORCE HOLDINGS LIMITED,元力控股
1935,JH EDUCATIONAL TECHNOLOGY INC.,嘉宏教育
1936,RITAMIX GLOBAL LIMITED,利特米
1937,JIACHEN HOLDING GROUP LIMITED,佳辰控股
1938,CHU KONG PETROLEUM AND NATURAL GAS STEEL PIPE HOLDINGS LIMITED,珠江鋼管
1939,TOKYO CHUO AUCTION HOLDINGS LIMITED,東京中央拍賣
1940,CHINA GAS INDUSTRY INVESTMENT HOLDINGS CO. LTD.,CHINA GAS INDUSTRY INVESTMENT HOLDINGS CO. LTD.
1941,YE XING GROUP HOLDINGS LIMITED,燁星集團
1942,MOG HOLDINGS LIMITED,MOG HOLDINGS LIMITED
1943,SILVER TIDE HOLDINGS LIMITED,銀濤控股
1945,ZERO2IPO HOLDINGS INC.,清科創業
1949,PLATT NERA INTERNATIONAL LIMITED,PLATT NERA INTERNATIONAL LIMITED
1950,SUNLIGHT TECHNOLOGY HOLDINGS LIMITED,深藍科技控股
1951,JINXIN FERTILITY GROUP LIMITED,錦欣生殖
1952,EVEREST MEDICINES LIMITED,雲頂新耀-Ｂ
1953,RIMBACO GROUP GLOBAL LIMITED,RIMBACO GROUP GLOBAL LIMITED
1955,"HONG KONG JOHNSON HOLDINGS CO., LTD.",莊臣控股
1957,MBV INTERNATIONAL LIMITED,MBV INTERNATIONAL LIMITED
1958,BAIC MOTOR CORPORATION LIMITED,北京汽車
1959,CENTENARY UNITED HOLDINGS LIMITED,世紀聯合控股
1960,TBK & SONS HOLDINGS LIMITED,TBK & SONS HOLDINGS LIMITED
1961,JIU ZUN DIGITAL INTERACTIVE ENTERTAINMENT GROUP HOLDINGS LIMITED,九尊數字互娛
1962,EVERGREEN PRODUCTS GROUP LIMITED,訓修實業
1963,"BANK OF CHONGQING CO., LTD.",重慶銀行
1965,LANDSEA GREEN LIFE SERVICE COMPANY LIMITED,朗詩綠色生活
1966,CHINA SCE GROUP HOLDINGS LIMITED,中駿集團控股
1967,CONFIDENCE INTELLIGENCE HOLDINGS LIMITED,信懇智能
1968,HINGTEX HOLDINGS LIMITED,興紡控股
1969,"CHINA CHUNLAI EDUCATION GROUP CO., LTD.",中國春來
1970,"IMAX CHINA HOLDING, INC.","IMAX CHINA HOLDING, INC."
1971,REDSUN SERVICES GROUP LIMITED,弘陽服務
1972,SWIRE PROPERTIES LIMITED,太古地產
1975,SUN HING PRINTING HOLDINGS LIMITED,新興印刷
1977,ANALOGUE HOLDINGS LIMITED,安樂工程
1978,LH GROUP LIMITED,敘福樓集團
1979,TEN PAO GROUP HOLDINGS LIMITED,天寶集團
1980,TIAN GE INTERACTIVE HOLDINGS LIMITED,天鴿互動
1981,CATHAY MEDIA AND EDUCATION GROUP INC.,華夏視聽教育
1982,NAMESON HOLDINGS LIMITED,南旋控股
1983,"LUZHOU BANK CO., LTD.",瀘州銀行
1985,MICROWARE GROUP LIMITED,美高域
1986,TSAKER CHEMICAL GROUP LIMITED,彩客化學
1987,BENG SOON MACHINERY HOLDINGS LIMITED,BENG SOON MACHINERY HOLDINGS LIMITED
1988,"CHINA MINSHENG BANKING CORP., LTD.",民生銀行
1989,PINE CARE GROUP LIMITED,松齡護老集團
1991,TA YANG GROUP HOLDINGS LIMITED,大洋集團
1992,FOSUN TOURISM GROUP,復星旅遊文化
1993,ASIARAY MEDIA GROUP LIMITED,雅仕維
1995,CIFI EVER SUNSHINE SERVICES GROUP LIMITED,旭輝永升服務
1996,REDSUN PROPERTIES GROUP LIMITED,弘陽地產
1997,WHARF REAL ESTATE INVESTMENT COMPANY LIMITED,九龍倉置業
1999,MAN WAH HOLDINGS LIMITED,敏華控股
2000,SIM TECHNOLOGY GROUP LIMITED,晨訊科技
2001,CHINA NEW HIGHER EDUCATION GROUP LIMITED,新高教集團
2002,CHINA SUNSHINE PAPER HOLDINGS COMPANY LIMITED,陽光紙業
2003,VCREDIT HOLDINGS LIMITED,維信金科
2005,SSY GROUP LIMITED,石四藥集團
2006,SHANGHAI JIN JIANG CAPITAL COMPANY LIMITED,錦江資本
2007,COUNTRY GARDEN HOLDINGS COMPANY LIMITED,碧桂園
2008,PHOENIX MEDIA INVESTMENT (HOLDINGS) LIMITED,鳳凰衛視
2009,BBMG CORPORATION,金隅集團
2011,CHINA APEX GROUP LIMITED,中國恆泰集團
2012,SUNSHINE OILSANDS LTD.,陽光油砂
2013,WEIMOB INC.,微盟集團
2014,OZNER WATER INTERNATIONAL HOLDING LIMITED,浩澤淨水
2016,"CHINA ZHESHANG BANK CO., LTD.",浙商銀行
2017,CHANHIGH HOLDINGS LIMITED,滄海控股
2018,AAC TECHNOLOGIES HOLDINGS INC.,瑞聲科技
2019,DEXIN CHINA HOLDINGS COMPANY LIMITED,德信中國
2020,ANTA SPORTS PRODUCTS LIMITED,安踏體育
2022,DIGITAL HOLLYWOOD INTERACTIVE LIMITED,遊萊互動
2023,CHINA LUDAO TECHNOLOGY COMPANY LIMITED,中國綠島科技
2025,RUIFENG POWER GROUP COMPANY LIMITED,瑞豐動力
2028,JOLIMARK HOLDINGS LIMITED,映美控股
2030,CABBEEN FASHION LIMITED,卡賓
2031,AUSUPREME INTERNATIONAL HOLDINGS LIMITED,澳至尊
2033,TIME WATCH INVESTMENTS LIMITED,時計寶
2038,FIH MOBILE LIMITED,富智康集團
2039,"CHINA INTERNATIONAL MARINE CONTAINERS (GROUP) CO., LTD.",中集集團
2048,E-HOUSE (CHINA) ENTERPRISE HOLDINGS LIMITED,易居企業控股
2051,51 CREDIT CARD INC.,５１信用卡
2057,ZTO EXPRESS (CAYMAN) INC.,中通快遞-SW
2060,PUJIANG INTERNATIONAL GROUP LIMITED,浦江國際
2066,"SHENGJING BANK CO., LTD.",盛京銀行
2068,CHINA ALUMINUM INTERNATIONAL ENGINEERING CORPORATION LIMITED,中鋁國際
2078,PANASIALUM HOLDINGS COMPANY LIMITED,榮陽實業
2080,AUX INTERNATIONAL HOLDINGS LIMITED,奧克斯國際
2083,NATURE HOME HOLDING COMPANY LIMITED,大自然家居
2086,HNA TECHNOLOGY INVESTMENTS HOLDINGS LIMITED,海航科技投資
2088,XIWANG PROPERTY HOLDINGS COMPANY LIMITED,西王置業
2096,SIMCERE PHARMACEUTICAL GROUP LIMITED,先聲藥業
2098,ZALL SMART COMMERCE GROUP LTD.,卓爾智聯
2099,CHINA GOLD INTERNATIONAL RESOURCES CORP. LTD.,中國黃金國際
2100,BAIOO FAMILY INTERACTIVE LIMITED,百奧家庭互動
2101,FULU HOLDINGS LIMITED,福祿控股
2102,TAK LEE MACHINERY HOLDINGS LIMITED,德利機械
2103,SINIC HOLDINGS (GROUP) COMPANY LIMITED,新力控股集團
2107,FIRST SERVICE HOLDING LIMITED,第一服務控股
2108,K2 F&B HOLDINGS LIMITED,K2 F&B HOLDINGS LIMITED
2110,YUE KAN HOLDINGS LIMITED,裕勤控股
2111,BEST PACIFIC INTERNATIONAL HOLDINGS LIMITED,超盈國際控股
2112,CAA RESOURCES LIMITED,優庫資源
2113,CENTURY GROUP INTERNATIONAL HOLDINGS LIMITED,世紀集團國際
2115,CHANNEL MICRON HOLDINGS COMPANY LIMITED,捷心隆
2116,JIANGSU INNOVATIVE ECOLOGICAL NEW MATERIALS LIMITED,江蘇創新
2117,DATANG GROUP HOLDINGS LIMITED,大唐集團控股
2118,TIAN SHAN DEVELOPMENT (HOLDING) LIMITED,天山發展控股
2119,TSIT WING INTERNATIONAL HOLDINGS LIMITED,捷榮國際控股
2120,"WENZHOU KANGNING HOSPITAL CO., LTD.",康寧醫院
2122,KIDSLAND INTERNATIONAL HOLDINGS LIMITED,凱知樂國際
2123,GOLDEN SHIELD HOLDINGS (INDUSTRIAL) LIMITED,金盾控股
2125,STRAWBEAR ENTERTAINMENT GROUP,稻草熊娛樂
2126,JW (CAYMAN) THERAPEUTICS CO. LTD,藥明巨諾-B
2127,HUISEN HOUSEHOLD INTERNATIONAL GROUP LIMITED,匯森家居
2128,CHINA LESSO GROUP HOLDINGS LIMITED,中國聯塑
2129,LEGION CONSORTIUM LIMITED,LEGION CONSORTIUM LIMITED
2130,CN LOGISTICS INTERNATIONAL HOLDINGS LIMITED,嘉泓物流
2131,NETJOY HOLDINGS LIMITED,云想科技
2132,LANDRICH HOLDING LIMITED,LANDRICH HOLDING LIMITED
2133,GREENWAY MINING GROUP LIMITED,信盛礦業
2135,RAILY AESTHETIC MEDICINE INTERNATIONAL HOLDINGS LIMITED,瑞麗醫美
2136,LIFESTYLE CHINA GROUP LIMITED,利福中國
2137,BRII BIOSCIENCES LIMITED,騰盛博藥-B
2138,EC HEALTHCARE,醫思健康
2139,"BANK OF GANSU CO., LTD.",甘肅銀行
2142,HBM HOLDINGS LIMITED,和鉑醫藥-B
2146,"ROISERV LIFESTYLE SERVICES CO., LTD.",榮萬家
2148,"VESYNC CO., LTD","VESYNC CO., LTD"
2150,NAYUKI HOLDINGS LIMITED,奈雪的茶
2153,"TAT HONG EQUIPMENT SERVICE CO., LTD.",達豐設備
2155,MORIMATSU INTERNATIONAL HOLDINGS COMPANY LIMITED,森松國際
2156,"C&D PROPERTY MANAGEMENT GROUP CO., LTD",建發物業
2158,YIDU TECH INC.,醫渡科技
2159,MEDIWELCOME HEALTHCARE MANAGEMENT & TECHNOLOGY INC.,麥迪衛康
2160,MICROPORT CARDIOFLOW MEDTECH CORPORATION,心通醫療-B
2161,JBM (HEALTHCARE) LIMITED,健倍苗苗
2162,KEYMED BIOSCIENCES INC.,康諾亞-B
2163,"CHANGSHA BROAD HOMES INDUSTRIAL GROUP CO., LTD.",遠大住工
2165,LING YUE SERVICES GROUP LIMITED,領悅服務集團
2166,SMART-CORE HOLDINGS LIMITED,芯智控股
2168,KAISA PROSPERITY HOLDINGS LIMITED,佳兆業美好
2169,CANGGANG RAILWAY LIMITED,滄港鐵路
2170,SUZHOU BASECARE MEDICAL CORPORATION LIMITED,貝康醫療-B
2171,CARSGEN THERAPEUTICS HOLDINGS LIMITED,科濟藥業-B
2175,CHINA GENERAL EDUCATION GROUP LIMITED,中國通才教育
2176,CCID CONSULTING COMPANY LIMITED,賽迪顧問
2177,UNQ HOLDINGS LIMITED,優趣匯控股
2178,PETRO-KING OILFIELD SERVICES LIMITED,百勤油服
2180,MANPOWERGROUP GREATER CHINA LIMITED,萬寶盛華
2181,MABPHARM LIMITED,邁博藥業-B
2182,TIAN CHANG GROUP HOLDINGS LTD.,天長集團
2183,SANSHENG HOLDINGS (GROUP) CO. LTD.,三盛控股
2186,LUYE PHARMA GROUP LTD.,綠葉製藥
2187,ZHIXIN GROUP HOLDING LIMITED,智欣集團控股
2188,CHINA TITANS ENERGY TECHNOLOGY GROUP CO LIMITED,泰坦能源技術
2189,KATO (HONG KONG) HOLDINGS LIMITED,嘉濤（香港）控股
2190,"ZYLOX-TONBRIDGE MEDICAL TECHNOLOGY CO., LTD.",歸創通橋-B
2191,SF REAL ESTATE INVESTMENT TRUST,順豐房託
2192,"MEDLIVE TECHNOLOGY CO., LTD.",醫脈通
2193,MAN KING HOLDINGS LIMITED,萬景控股
2195,UNITY ENTERPRISE HOLDINGS LIMITED,盈匯企業控股
2196,"SHANGHAI FOSUN PHARMACEUTICAL (GROUP) CO., LTD.",復星醫藥
2198,CHINA SANJIANG FINE CHEMICALS COMPANY LIMITED,中國三江化工
2199,REGINA MIRACLE INTERNATIONAL (HOLDINGS) LIMITED,維珍妮
2202,"CHINA VANKE CO., LTD.",萬科企業
2203,BRAINHOLE TECHNOLOGY LIMITED,腦洞科技
2205,KANGQIAO SERVICE GROUP LIMITED,康橋悅生活
2207,"RONSHINE SERVICE HOLDING CO., LTD",融信服務
2208,"XINJIANG GOLDWIND SCIENCE & TECHNOLOGY CO., LTD.",金風科技
2209,YESASIA HOLDINGS LIMITED,YESASIA HOLDINGS LIMITED
2211,UNIVERSAL HEALTH INTERNATIONAL GROUP HOLDING LIMITED,大健康國際
2212,FUTURE BRIGHT MINING HOLDINGS LIMITED,高鵬礦業
2213,YI HUA HOLDINGS LIMITED,益華控股
2215,DEXIN SERVICES GROUP LIMITED,德信服務集團
2218,"YANTAI NORTH ANDRE JUICE CO., LTD.",安德利果汁
2219,CHAOJU EYE CARE HOLDINGS LIMITED,朝聚眼科
2221,NEW CONCEPTS HOLDINGS LIMITED,創業集團控股
2222,NVC INTERNATIONAL HOLDINGS LIMITED,雷士國際
2223,CASABLANCA GROUP LIMITED,卡撒天嬌
2225,JINHAI INTERNATIONAL GROUP HOLDINGS LIMITED,今海國際
2226,HONWORLD GROUP LIMITED,老恆和釀造
2227,SOLIS HOLDINGS LIMITED,守益控股
2228,CECEP COSTIN NEW MATERIALS GROUP LIMITED,中國節能海東青
2230,MEDIALINK GROUP LIMITED,羚邦集團
2231,JY GRANDMARK HOLDINGS LIMITED,景業名邦集團
2232,CRYSTAL INTERNATIONAL GROUP LIMITED,晶苑國際
2233,WEST CHINA CEMENT LIMITED,西部水泥
2236,WISON ENGINEERING SERVICES CO. LTD.,惠生工程
2238,"GUANGZHOU AUTOMOBILE GROUP CO., LTD.",廣汽集團
2239,SMIT HOLDINGS LIMITED,國微控股
2255,HAICHANG OCEAN PARK HOLDINGS LTD.,海昌海洋公園
2258,WATTS INTERNATIONAL MARITIME ENGINEERING LIMITED,華滋國際海洋
2262,STEVE LEUNG DESIGN GROUP LIMITED,梁志天設計集團
2263,FU SHEK FINANCIAL HOLDINGS LIMITED,富石金融
2266,LAI SI ENTERPRISE HOLDING LIMITED,黎氏企業
2269,WUXI BIOLOGICS (CAYMAN) INC.,藥明生物
2278,HAILAN HOLDINGS LIMITED,海藍控股
2280,HC GROUP INC.,慧聰集團
2281,"LUZHOU XINGLU WATER (GROUP) CO., LTD.",興瀘水務
2282,MGM CHINA HOLDINGS LIMITED,美高梅中國
2283,TK GROUP (HOLDINGS) LIMITED,東江集團控股
2286,CHEN XING DEVELOPMENT HOLDINGS LIMITED,辰興發展
2288,RYKADAN CAPITAL LIMITED,宏基資本
2289,"CHARMACY PHARMACEUTICAL CO., LTD.",創美藥業
2292,THING ON ENTERPRISE LIMITED,晉安實業
2293,BAMBOOS HEALTH CARE HOLDINGS LIMITED,百本醫護
2296,HUARCHI GLOBAL GROUP HOLDINGS LIMITED,華記環球集團
2298,COSMO LADY (CHINA) HOLDINGS COMPANY LIMITED,都市麗人
2299,BILLION INDUSTRIAL HOLDINGS LIMITED,百宏實業
2302,CNNC INTERNATIONAL LIMITED,中核國際
2307,KAM HING INTERNATIONAL HOLDINGS LIMITED,錦興國際控股
2308,EVOC INTELLIGENT TECHNOLOGY COMPANY LIMITED,研祥智能
2309,BIRMINGHAM SPORTS HOLDINGS LIMITED,伯明翰體育
2310,TIMES UNIVERSAL GROUP HOLDINGS LIMITED,時代環球集團
2312,CHINA FINANCIAL LEASING GROUP LIMITED,中國金融租賃
2313,SHENZHOU INTERNATIONAL GROUP HOLDINGS LIMITED,申洲國際
2314,LEE & MAN PAPER MANUFACTURING LIMITED,理文造紙
2317,VEDAN INTERNATIONAL (HOLDINGS) LIMITED,味丹國際
2318,"PING AN INSURANCE (GROUP) COMPANY OF CHINA, LTD.",中國平安
2319,CHINA MENGNIU DAIRY COMPANY LIMITED,蒙牛乳業
2320,HOP FUNG GROUP HOLDINGS LIMITED,合豐集團
2322,HONG KONG CHAOSHANG GROUP LIMITED,香港潮商集團
2323,RENCO HOLDINGS GROUP LIMITED,融科控股
2324,CAPITAL VC LIMITED,首都創投
2326,NEW PROVENANCE EVERLASTING HOLDINGS LIMITED,新源萬恆控股
2327,MEILLEURE HEALTH INTERNATIONAL INDUSTRY GROUP LIMITED,美瑞健康國際
2328,PICC PROPERTY AND CASUALTY COMPANY LIMITED,中國財險
2329,GUORUI PROPERTIES LIMITED,國瑞置業
2330,CHINA UPTOWN GROUP COMPANY LIMITED,中國上城
2331,LI NING COMPANY LIMITED,李寧
2333,GREAT WALL MOTOR COMPANY LIMITED,長城汽車
2336,HAILIANG INTERNATIONAL HOLDINGS LIMITED,海亮國際
2337,UNITED STRENGTH POWER HOLDINGS LIMITED,眾誠能源
2338,"WEICHAI POWER CO., LTD.",濰柴動力
2339,BEIJINGWEST INDUSTRIES INTERNATIONAL LIMITED,京西國際
2340,SYNERGIS HOLDINGS LIMITED,昇捷控股
2341,ECOGREEN INTERNATIONAL GROUP LIMITED,中怡國際
2342,COMBA TELECOM SYSTEMS HOLDINGS LIMITED,京信通信
2343,PACIFIC BASIN SHIPPING LIMITED,太平洋航運
2346,UNIVERSAL STAR (HOLDINGS) LIMITED,星宇控股
2348,DAWNRAYS PHARMACEUTICAL (HOLDINGS) LIMITED,東瑞製葯
2349,CHINA CITY INFRASTRUCTURE GROUP LIMITED,中國城市基礎設施
2355,BAOYE GROUP COMPANY LIMITED,寶業集團
2356,DAH SING BANKING GROUP LIMITED,大新銀行集團
2357,AVICHINA INDUSTRY & TECHNOLOGY COMPANY LIMITED,中航科工
2358,JIU RONG HOLDINGS LIMITED,久融控股
2359,"WUXI APPTEC CO., LTD.",藥明康德
2360,BEST MART 360 HOLDINGS LIMITED,優品360
2362,JINCHUAN GROUP INTERNATIONAL RESOURCES CO. LTD.,金川國際
2363,TONGDA HONG TAI HOLDINGS LIMITED,通達宏泰
2366,SMI CULTURE & TRAVEL GROUP HOLDINGS LIMITED,星美文化旅遊
2368,EAGLE NICE (INTERNATIONAL) HOLDINGS LIMITED,鷹美
2369,COOLPAD GROUP LIMITED,酷派集團
2371,CHINA CHUANGLIAN EDUCATION FINANCIAL GROUP LIMITED,創聯教育金融
2377,"CHINA BOQI ENVIRONMENTAL (HOLDING) CO., LTD.",博奇環保
2378,PRUDENTIAL PLC,保誠
2379,ZHONGTIAN INTERNATIONAL LIMITED,中天國際
2380,CHINA POWER INTERNATIONAL DEVELOPMENT LIMITED,中國電力
2381,SMC ELECTRIC LIMITED,蜆殼電業
2382,SUNNY OPTICAL TECHNOLOGY (GROUP) COMPANY LIMITED,舜宇光學科技
2383,TOM GROUP LIMITED,TOM集團
2386,"SINOPEC ENGINEERING (GROUP) CO., LTD.",中石化煉化工程
2388,BOC HONG KONG (HOLDINGS) LIMITED,中銀香港
2389,BEIJING HEALTH (HOLDINGS) LIMITED,北京健康
2393,YESTAR HEALTHCARE HOLDINGS COMPANY LIMITED,巨星醫療控股
2398,GOOD FRIEND INTERNATIONAL HOLDINGS INC.,友佳國際
2399,CHINA FORDOO HOLDINGS LIMITED,虎都
2400,XD INC.,心動公司
2448,SPACE GROUP HOLDINGS LIMITED,恆宇集團
2488,LAUNCH TECH COMPANY LIMITED,元征科技
2500,VENUS MEDTECH (HANGZHOU) INC.,啟明醫療-B
2518,AUTOHOME INC.,汽車之家-S
2528,FORWARD FASHION (INTERNATIONAL) HOLDINGS COMPANY LIMITED,尚晉國際控股
2552,HUA MEDICINE,華領醫藥-B
2558,"JINSHANG BANK CO., LTD.",晉商銀行
2588,BOC AVIATION LIMITED,中銀航空租賃
2599,"SHINSUN HOLDINGS (GROUP) CO., LTD.",祥生控股集團
2600,ALUMINUM CORPORATION OF CHINA LIMITED,中國鋁業
2601,CHINA PACIFIC INSURANCE (GROUP) CO. LTD.,中國太保
2606,"SICHUAN LANGUANG JUSTBON SERVICES GROUP CO., LTD.",藍光嘉寶服務
2607,"SHANGHAI PHARMACEUTICALS HOLDING CO., LTD.",上海醫藥
2608,SUNSHINE 100 CHINA HOLDINGS LTD,陽光100中國
2611,"GUOTAI JUNAN SECURITIES CO., LTD.",國泰君安
2616,CSTONE PHARMACEUTICALS,基石藥業-B
2618,"JD LOGISTICS, INC.",京東物流
2623,ADD NEW ENERGY INVESTMENT HOLDINGS GROUP LIMITED,愛德新能源
2628,CHINA LIFE INSURANCE COMPANY LIMITED,中國人壽
2633,JACOBSON PHARMA CORPORATION LIMITED,雅各臣科研製藥
2638,HK ELECTRIC INVESTMENTS AND HK ELECTRIC INVESTMENTS LIMITED,港燈-SS
2660,ZENGAME TECHNOLOGY HOLDING LIMITED,禪遊科技
2662,MH DEVELOPMENT LIMITED,美好發展
2663,KPA-BM HOLDINGS LIMITED,應力控股
2666,GENERTEC UNIVERSAL MEDICAL GROUP COMPANY LIMITED,環球醫療
2668,PAK TAK INTERNATIONAL LIMITED,百德國際
2669,CHINA OVERSEAS PROPERTY HOLDINGS LIMITED,中海物業
2678,TEXHONG TEXTILE GROUP LIMITED,天虹紡織
2680,INNOVAX HOLDINGS LIMITED,INNOVAX HOLDINGS LIMITED
2682,YUN LEE MARINE GROUP HOLDINGS LIMITED,潤利海事
2683,WAH SUN HANDBAGS INTERNATIONAL HOLDINGS LIMITED,華新手袋國際控股
2686,AAG ENERGY HOLDINGS LIMITED,亞美能源
2688,ENN ENERGY HOLDINGS LIMITED,新奧能源
2689,NINE DRAGONS PAPER (HOLDINGS) LIMITED,玖龍紙業
2696,"SHANGHAI HENLIUS BIOTECH, INC.",復宏漢霖
2698,WEIQIAO TEXTILE COMPANY LIMITED,魏橋紡織
2699,XINMING CHINA HOLDINGS LIMITED,新明中國
2700,GREEN INTERNATIONAL HOLDINGS LIMITED,格林國際控股
2708,IBO TECHNOLOGY COMPANY LIMITED,艾伯科技
2718,"SHANGHAI DONGZHENG AUTOMOTIVE FINANCE CO., LTD.",東正金融
2722,"CHONGQING MACHINERY & ELECTRIC CO., LTD.",重慶機電
2727,SHANGHAI ELECTRIC GROUP COMPANY LIMITED,上海電氣
2728,JINTAI ENERGY HOLDINGS LIMITED,金泰能源控股
2738,HUAJIN INTERNATIONAL HOLDINGS LIMITED,華津國際控股
2768,JIAYUAN INTERNATIONAL GROUP LIMITED,佳源國際控股
2772,ZHONGLIANG HOLDINGS GROUP COMPANY LIMITED,中梁控股
2777,"GUANGZHOU R&F PROPERTIES CO., LTD.",富力地產
2778,CHAMPION REAL ESTATE INVESTMENT TRUST,冠君產業信託
2779,CHINA XINHUA EDUCATION GROUP LIMITED,中國新華教育
2788,YORKEY OPTICAL INTERNATIONAL (CAYMAN) LTD.,精熙國際
2789,YUANDA CHINA HOLDINGS LIMITED,遠大中國
2798,PERENNIAL ENERGY HOLDINGS LIMITED,久泰邦達能源
2799,"CHINA HUARONG ASSET MANAGEMENT CO., LTD.",中國華融
2800,TRACKER FUND OF HONG KONG,盈富基金
2801,ISHARES CORE MSCI CHINA ETF,安碩中國ETF
2802,ISHARES MSCI EMERGING ASIA ETF,安碩亞洲新興
2803,PREMIA CSI CAIXIN CHINA BEDROCK ECONOMY ETF-HKD TRADED UNITS,PP中國基石
2804,PREMIA MSCI VIETNAM ETF-HKD TRADED UNITS,PP越南
2805,VANGUARD FTSE ASIA EX JAPAN INDEX ETF -HKD TRADED UNITS,領航亞洲
