stock_code,stock_name
77299,"FUCHUN TECHNOLOGY CO.,LTD (A #300299)"
77300,"STRAIT INNOVATION INTERNET CO., LTD. (A #300300)"
77302,"TOYOU FEIJI ELECTRONICS CO.,LTD. (A #300302)"
77303,"SHENZHEN JUFEI OPTOELECTRONICS CO.,LTD (A #300303)"
77304,"JIANGSU YUNYI ELECTRIC CO.,LTD. (A #300304)"
77307,"NINGBO CIXING CO.,LTD. (A #300307)"
77308,"ZHONGJI INNOLIGHT CO., LTD. (A #300308)"
77310,"EASTONE CENTURY TECHNOLOGY CO.,LTD. (A #300310)"
77311,"SURFILTER NETWORK TECHNOLOGY CO.,LTD. (A #300311)"
77314,"NINGBO DAVID MEDICAL DEVICE CO.,LTD. (A #300314)"
77315,"OURPALM CO.,LTD. (A #300315)"
77316,"ZHEJIANG JINGSHENG MECHANICAL & ELECTRICAL CO.,LTD. (A #300316)"
77317,"JIAWEI RENEWABLE ENERGY CO., LTD. (A #300317)"
77318,"BEIJING BOHUI INNOVATION BIOTECHNOLOGY CO.,LTD. (A #300318)"
77319,"SHENZHEN MICROGATE TECHNOLOGY CO.,LTD (A #300319)"
77322,"HUIZHOU SPEED WIRELESS TECHNOLOGY CO.,LTD. (A #300322)"
77323,HC SEMITEK CORPORATION (A #300323)
77324,"BEIJING WATERTEK INFORMATION TECHNOLOGY CO.,LTD. (A #300324)"
77326,"SHANGHAI KINETIC MEDICAL CO.,LTD. (A #300326)"
77327,SINO WEALTH ELECTRONIC LTD. (A #300327)
77328,"DONGGUAN EONTEC CO.,LTD. (A #300328)"
77329,"HAILUN PIANO CO.,LTD. (A #300329)"
77332,TOP RESOURCE CONSERVATION & ENVIRONMENT CORP. (A #300332)
77333,"SINOSUN TECHNOLOGY CO.,LTD. (A #300333)"
77334,"TIANJIN MOTIMO MEMBRANE TECHNOLOGY CO.,LTD. (A #300334)"
77335,"GUANGZHOU DEVOTION THERMAL TECHNOLOGY CO.,LTD. (A #300335)"
77336,"SHANGHAI NEW CULTURE MEDIA GROUP CO.,LTD. (A #300336)"
77337,"YINBANG CLAD MATERIAL CO.,LTD. (A #300337)"
77339,"JIANGSU HOPERUN SOFTWARE CO., LTD. (A #300339)"
77340,"JIANGMEN KANHOO INDUSTRY CO.,LTD (A #300340)"
77342,"CHANGSHU TIANYIN ELECTROMECHANICAL CO.,LTD. (A #300342)"
77343,"LECRON INDUSTRIAL DEVELOPMENT GROUP CO., LTD. (A #300343)"
77346,"JIANGSU NATA OPTO-ELECTRONIC MATERIAL CO.,LTD (A #300346)"
77347,"HANGZHOU TIGERMED CONSULTING CO.,LTD. (A #300347)"
77348,"SHENZHEN SUNLINE TECH CO.,LTD. (A #300348)"
77349,"GOLDCARD SMART GROUP CO.,LTD. (A #300349)"
77351,"ZHEJIANG YONGGUI ELECTRIC EQUIPMENT CO.,LTD. (A #300351)"
77352,BEIJING VRV SOFTWARE CORPORATION LIMITED. (A #300352)
77353,"KYLAND TECHNOLOGY CO.,LTD. (A #300353)"
77355,"INNER MONGOLIA M-GRASS ECOLOGY AND ENVIRONMENT (GP) CO.,LTD. (A #300355)"
77357,"ZHEJIANG WOLWO BIO-PHARMACEUTICAL CO., LTD. (A #300357)"
77359,"QTONE EDUCATION GROUP (GUANGDONG).,LTD. (A #300359)"
77363,PORTON PHARMA SOLUTIONS LTD. (A #300363)
77364,"COL DIGITAL PUBLISHING GROUP CO.,LTD. (A #300364)"
77365,"BEIJING FOREVER TECHNOLOGY CO., LTD (A #300365)"
77366,"TROY INFORMATION TECHNOLOGY CO.,LTD. (A #300366)"
77367,"NETPOSA TECHNOLOGIES,LTD. (A #300367)"
77368,"HEBEI HUIJIN GROUP CO., LTD. (A #300368)"
77369,"NSFOCUS TECHNOLOGIES GROUP CO., LTD. (A #300369)"
77373,"YANGZHOU YANGJIE ELECTRONIC TECHNOLOGY CO.,LTD. (A #300373)"
77376,"EAST GROUP CO., LTD (A #300376)"
77377,"SHENZHEN YSSTECH INFO-TECH CO.,LTD (A #300377)"
77378,"DIGIWIN SOFTWARE CO.,LTD. (A #300378)"
77379,"BEIJING TONGTECH CO,. LTD. (A #300379)"
77383,"BEIJING SINNET TECHNOLOGY CO.,LTD. (A #300383)"
77386,"FEITIAN TECHNOLOGIES CO.,LTD. (A #300386)"
77388,"CECEP GUOZHEN ENVIRONMENTAL PROTECTION TECHNOLOGY CO., LTD. (A #300388)"
77390,"SUZHOU TA&A ULTRA CLEAN TECHNOLOGY CO.,LTD. (A #300390)"
77392,BEIJING TENSYN DIGITAL MARKETING TECH JOINT STOCK COMPANY (A #300392)
77394,"SUZHOU TFC OPTICAL COMMUNICATION CO., LTD. (A #300394)"
77395,HUBEI FEILIHUA QUARTZ GLASS CO.LTD (A #300395)
77396,"DIRUI INDUSTRIAL CO.,LTD. (A #300396)"
77397,"XI'AN TIANHE DEFENSE TECHNOLOGY CO.,LTD. (A #300397)"
77398,"SHANGHAI PHICHEM MATERIAL CO., LTD. (A #300398)"
77401,"ZHEJIANG GARDEN BIO-CHEMICAL HIGH-TECH CO., LTD (A #300401)"
77406,"BEIJING STRONG BIOTECHNOLOGIES, INC (A #300406)"
77408,"CHAOZHOU THREE-CIRCLE (GROUP) CO.,LTD. (A #300408)"
77409,"GUANGDONG DOWSTONE TECHNOLOGY CO.,LTD. (A #300409)"
77413,"MANGO EXCELLENT MEDIA CO., LTD. (A #300413)"
77418,"KUNLUN TECH CO., LTD. (A #300418)"
77422,"GUANGXI BOSSCO ENVIRONMENTAL PROTECTION TECHNOLOGY CO.,LTD. (A #300422)"
77423,"SUNFLY INTELLIGENT TECHNOLOGY CO., LTD (A #300423)"
77427,RED PHASE INC. (A #300427)
77428,"LIZHONG SITONG LIGHT ALLOYS GROUP CO., LTD. (A #300428)"
77429,"CHANGZHOU TRONLY NEW ELECTRONIC MATERIALS CO.,LTD. (A #300429)"
77432,"MIANYANG FULIN PRECISION CO.,LTD. (A #300432)"
77433,"LENS TECHNOLOGY CO., LTD. (A #300433)"
77438,"GUANGZHOU GREAT POWER ENERGY&TECHNOLOGY CO., LTD. (A #300438)"
77439,"MEDICALSYSTEM BIOTECHNOLOGY CO., LTD (A #300439)"
77441,"NINGBO BAOSI ENERGY EQUIPMENT CO., LTD. (A #300441)"
77443,"JINLEI TECHNOLOGY CO., LTD. (A #300443)"
77448,"HAOYUN TECHNOLOGIES CO.,LTD (A #300448)"
77450,"WUXI LEAD INTELLIGENT EQUIPMENT CO.,LTD (A #300450)"
77451,"B-SOFT CO.,LTD (A #300451)"
77454,SANGFOR TECHNOLOGIES INC. (A #300454)
77455,BEIJING CTROWELL TECHNOLOGY CORPORATION LIMITED (A #300455)
77456,SAI MICROELECTRONICS INC. (A #300456)
77457,"SHENZHEN YINGHE TECHNOLOGY CO.,LTD (A #300457)"
77458,"ALLWINNER TECHNOLOGY CO., LTD. (A #300458)"
77459,"ZHEJIANG JINKE CULTURE INDUSTRY CO., LTD. (A #300459)"
77463,"MACCURA BIOTECHNOLOGY CO., LTD. (A #300463)"
77465,"GLOBAL INFOTECH CO.,LTD. (A #300465)"
77467,"SICHUAN XUNYOU NETWORK TECHNOLOGY CO.,LTD (A #300467)"
77468,"SHENZHEN FORMS SYNTRON INFORMAITON CO., LTD (A #300468)"
77470,"SINOSEAL HOLDING CO.,LTD. (A #300470)"
77474,"CHANGSHA JINGJIA MICROELECTRONICS CO.,LTD. (A #300474)"
77476,"VICTORY GIANT TECHNOLOGY (HUIZHOU) CO., LTD. (A #300476)"
77477,"BEIJING HEZONG SCIENCE&TECHNOLOGY CO., LTD. (A #300477)"
77481,"PUYANG HUICHENG ELECTRONIC MATERIAL CO., LTD. (A #300481)"
77482,"GUANGZHOU WONDFO BIOTECH CO.,LTD (A #300482)"
77484,"SHENZHEN V&T TECHNOLOGIES CO., LTD. (A #300484)"
77485,"BEIJING SCIENCE SUN PHARMACEUTICAL CO.,LTD. (A #300485)"
77487,"SUNRESIN NEW MATERIALS CO.,LTD, XI""AN (A #300487)"
77494,"HUBEI CENTURY NETWORK TECHNOLOGY CO., LTD. (A #300494)"
77495,"MISHO ECOLOGY & LANDSCAPE CO., LTD. (A #300495)"
77496,"THUNDER SOFTWARE TECHNOLOGY CO., LTD. (A #300496)"
77497,"JIANGXI FUSHINE PHARMACEUTICAL CO.,LTD. (A #300497)"
77498,"WENS FOODSTUFF GROUP CO., LTD. (A #300498)"
77502,"EOPTOLINK TECHNOLOGY INC., LTD (A #300502)"
77503,"GUANGZHOU HAOZHI INDUSTRIAL CO.,LTD. (A #300503)"
77504,"SICHUAN TIANYI COMHEART TELECOM CO., LTD. (A #300504)"
77506,"SHENZHEN MINKAVE TECHNOLOGY CO., LTD. (A #300506)"
77507,"JIANGSU OLIVE SENSORS HIGH-TECH CO.,LTD (A #300507)"
77508,"SHANGHAI WEIHONG ELECTRONIC TECHNOLOGY CO., LTD. (A #300508)"
77511,"SHANGHAI XUERONG BIOTECHNOLOGY CO.,LTD. (A #300511)"
77512,"HANGZHOU ZHONGYA MACHINERY CO., LTD. (A #300512)"
77516,"HUBEI JIUZHIYANG INFRARED SYSTEM CO., LTD (A #300516)"
77518,"SHENZHEN SHENGXUNDA TECHNOLOGY CO.,LTD. (A #300518)"
77523,"BEIJING GLOBAL SAFETY TECHNOLOGY CO., LTD. (A #300523)"
77525,FUJIAN BOSS SOFTWARE CORP. (A #300525)
77526,CHINA DIVE COMPANY LIMITED (A #300526)
77527,"CHINA HARZONE INDUSTRY CORP., LTD (A #300527)"
77529,"JAFRON BIOMEDICAL CO.,LTD. (A #300529)"
77531,"UROVO TECHNOLOGY CO., LTD. (A #300531)"
77548,"BROADEX TECHNOLOGIES CO.,LTD. (A #300548)"
77552,"VANJEE TECHNOLOGY CO., LTD. (A #300552)"
77558,"BETTA PHARMACEUTICALS CO.,LTD (A #300558)"
77559,"CHENGDU JIAFAANTAI EDUCATION TECHNOLOGY CO.,LTD. (A #300559)"
77567,"WUHAN JINGCE ELECTRONIC GROUP CO.,LTD (A #300567)"
77568,"SHENZHEN SENIOR TECHNOLOGY MATERIAL CO., LTD. (A #300568)"
77570,"T&S COMMUNICATIONS CO.,LTD (A #300570)"
77571,"HANGZHOU ANYSOFT INFORMATION TECHNOLOGY CO., LTD. (A #300571)"
77572,"SHENZHEN ANCHE TECHNOLOGIES CO., LTD. (A #300572)"
77573,"SHENYANG XINGQI PHARMACEUTICAL CO., LTD. (A #300573)"
77576,"SHENZHEN RONGDA PHOTOSENSITIVE & TECHNOLOGY CO., LTD. (A #300576)"
77577,"ANHUI KORRUN CO.,LTD (A #300577)"
77579,"BEIJING CERTIFICATE AUTHORITY CO., LTD. (A #300579)"
77590,"QUECLINK WIRELESS SOLUTIONS CO., LTD. (A #300590)"
77595,OVCTEK CHINA INC (A #300595)
77596,RIANLON CORPORATION (A #300596)
77598,"ARCHERMIND TECHNOLOGY (NANJING) CO., LTD. (A #300598)"
77601,"SHENZHEN KANGTAI BIOLOGICAL PRODUCTS CO.,LTD. (A #300601)"
77602,"SHENZHEN FRD SCIENCE & TECHNOLOGY CO., LTD. (A #300602)"
77603,"LEON TECHNOLOGY CO.,LTD. (A #300603)"
77604,"HANGZHOU CHANG CHUAN TECHNOLOGY CO.,LTD. (A #300604)"
77607,"GUANGDONG TOPSTAR TECHNOLOGY CO.,LTD (A #300607)"
77613,"SHANGHAI FULLHAN MICROELECTRONICS CO., LTD. (A #300613)"
77616,"GUANGZHOU SHANGPIN HOME COLLECTION CO., LTD (A #300616)"
77618,"NANJING HANRUI COBALT CO.,LTD. (A #300618)"
77623,"JIANGSU JIEJIE MICROELECTRONICS CO.,LTD. (A #300623)"
77624,"WONDERSHARE TECHNOLOGY GROUP CO.,LTD (A #300624)"
77627,SHANGHAI HUACE NAVIGATION TECHNOLOGY LTD. (A #300627)
77628,YEALINK NETWORK TECHNOLOGY CORPORATION LIMITED (A #300628)
77630,"HAINAN POLY PHARM. CO., LTD. (A #300630)"
77633,SONOSCAPE MEDICAL CORP. (A #300633)
77634,"RICHINFO TECHNOLOGY CO., LTD. (A #300634)"
77638,FIBOCOM WIRELESS INC. (A #300638)
77639,"GUANGDONG HYBRIBIO BIOTECH CO.,LTD. (A #300639)"
77653,"YANTAI ZHENGHAI BIO-TECH CO., LTD. (A #300653)"
77655,"SUZHOU CRYSTAL CLEAR CHEMICAL CO.,LTD (A #300655)"
77657,XIAMEN HONGXIN ELECTRONICS TECHNOLOGY GROUP INC. (A #300657)
77659,ZHONGFU INFORMATION INC. (A #300659)
77661,SG MICRO CORP (A #300661)
77662,"BEIJING CAREER INTERNATIONAL CO., LTD. (A #300662)"
77663,"CLIENT SERVICE INTERNATIONAL, INC. (A #300663)"
77664,"PENYAO ENVIRONMENTAL PROTECTION CO., LTD. (A #300664)"
77666,"KONFOONG MATERIALS INTERNATIONAL CO., LTD. (A #300666)"
77672,"HUNAN GOKE MICROELECTRONICS CO., LTD. (A #300672)"
77673,"PETPAL PET NUTRITION TECHNOLOGY CO., LTD. (A #300673)"
77674,"YUSYS TECHNOLOGIES CO., LTD. (A #300674)"
77676,"BGI GENOMICS CO., LTD. (A #300676)"
77677,"INTCO MEDICAL TECHNOLOGY CO., LTD. (A #300677)"
77679,"ELECTRIC CONNECTOR TECHNOLOGY CO., LTD. (A #300679)"
77682,"LONGSHINE TECHNOLOGY GROUP CO., LTD. (A #300682)"
77684,JONES TECH PLC (A #300684)
77685,"AMOY DIAGNOSTICS CO.,LTD. (A #300685)"
77696,CHENGDU ALD AVIATION MANUFACTURING CORPORATION. (A #300696)
77699,"WEIHAI GUANGWEI COMPOSITES CO., LTD. (A #300699)"
77702,"ZHEJIANG TIANYU PHARMACEUTICAL CO., LTD. (A #300702)"
77706,"FUJIAN ACETRON NEW MATERIALS CO., LTD. (A #300706)"
77708,"FOCUS LIGHTINGS TECH CO.,LTD. (A #300708)"
77709,"JIANGSU GIAN TECHNOLOGY CO., LTD. (A #300709)"
77715,"JIANGSU CANLON BUILDING MATERIALS CO., LTD. (A #300715)"
77722,"JIANGXI XINYU GUOKE TECHNOLOGY CO., LTD. (A #300722)"
77723,"YIPINHONG PHARMACEUTICAL CO., LTD. (A #300723)"
77724,SHENZHEN S.C NEW ENERGY TECHNOLOGY CORPORATION (A #300724)
77725,"PHARMABLOCK SCIENCES (NANJING), INC. (A #300725)"
77726,"ZHUZHOU HONGDA ELECTRONICS CORP., LTD. (A #300726)"
77735,"DBG TECHNOLOGY CO., LTD. (A #300735)"
77737,"KESHUN WATERPROOF TECHNOLGIES CO., LTD. (A #300737)"
77738,"GUANGDONG AOFEI DATA TECHNOLOGY CO., LTD. (A #300738)"
77739,"SUNSHINE GLOBAL CIRCUITS CO., LTD. (A #300739)"
77740,"SYOUNG GROUP CO., LTD. (A #300740)"
77741,"HUABAO FLAVOURS & FRAGRANCES CO., LTD (A #300741)"
77745,"SHINRY TECHNOLOGIES CO.,LTD. (A #300745)"
77747,"WUHAN RAYCUS FIBER LASER TECHNOLOGIES CO., LTD. (A #300747)"
77748,"JL MAG RARE-EARTH CO., LTD. (A #300748)"
77750,"CONTEMPORARY AMPEREX TECHNOLOGY CO., LIMITED (A #300750)"
77751,"SUZHOU MAXWELL TECHNOLOGIES CO., LTD. (A #300751)"
77755,"VATS LIQUOR CHAIN STORE MANAGEMENT JOINT STOCK CO.,LTD. (A #300755)"
77759,"PHARMARON BEIJING CO., LTD. (A #300759)"
77760,"SHENZHEN MINDRAY BIO-MEDICAL ELECTRONICS CO., LTD. (A #300760)"
77761,"JIANGSU LIHUA ANIMAL HUSBANDRY CO., LTD. (A #300761)"
77762,"JUSHRI TECHNOLOGIES, INC. (A #300762)"
77763,"GINLONG TECHNOLOGIES CO., LTD. (A #300763)"
77765,"CSPC INNOVATION PHARMACEUTICAL CO.,LTD. (A #300765)"
77766,"MERIT INTERACTIVE CO.,LTD. (A #300766)"
77767,"QUAKESAFE TECHNOLOGIES CO.,LTD. (A #300767)"
77768,"HANGZHOU DPTECH TECHNOLOGIES CO.,LTD. (A #300768)"
77770,"GUANGDONG SOUTH NEW MEDIA CO.,LTD (A #300770)"
77771,"SHENZHEN ZHILAI SCI AND TECH CO., LTD. (A #300771)"
77773,"LAKALA PAYMENT CO., LTD. (A #300773)"
77775,"XI'AN TRIANGLE DEFENSE CO.,LTD. (A #300775)"
77776,"WUHAN DR LASER TECHNOLOGY CORP.,LTD (A #300776)"
77777,"SINOFIBERS TECHNOLOGY CO.,LTD. (A #300777)"
77782,MAXSCEND MICROELECTRONICS COMPANY LIMITED (A #300782)
77783,THREE SQUIRRELS INC. (A #300783)
77785,"BEIJING ZHIDEMAI TECHNOLOGY CO., LTD. (A #300785)"
77788,CITIC PRESS CORPORATION (A #300788)
77791,"SIRIO PHARMA CO., LTD. (A #300791)"
77792,HANGZHOU ONECHANCE TECH CORP. (A #300792)
77793,"COSONIC INTELLIGENT TECHNOLOGIES CO., LTD. (A #300793)"
77799,"BEIJING ZUOJIANG TECHNOLOGY CO., LTD. (A #300799)"
77803,"BEIJING COMPASS TECHNOLOGY DEVELOPMENT CO., LTD. (A #300803)"
77805,"GUANGDONG BRANDMAX MARKETING CO.,LTD. (A #300805)"
77815,"EIT ENVIRONMENTAL DEVELOPMENT GROUP CO.,LTD (A #300815)"
77821,"SHANDONG DONGYUE ORGANOSILICON MATERIALS CO., LTD. (A #300821)"
77829,"HENAN JINDAN LACTIC ACID TECHNOLOGY CO., LTD (A #300829)"
77832,"SHENZHEN NEW INDUSTRIES BIOMEDICAL ENGINEERING CO., LTD. (A #300832)"
77841,"CHENGDU KANGHUA BIOLOGICAL PRODUCTS CO., LTD. (A #300841)"
77846,"CAPITALONLINE DATA SERVICE CO.,LTD. (A #300846)"
77850,"LUOYANG XINQIANGLIAN SLEWING BEARING CO.,LTD. (A #300850)"
77855,"JIANGSU TOLAND ALLOY CO.,LTD (A #300855)"
77860,"BEIJING FENGSHANGSHIJI CULTURE MEDIA CO., LTD. (A #300860)"
77861,"YANGLING METRON NEW MATERIAL CO., LTD. (A #300861)"
77866,"ANKER INNOVATIONS TECHNOLOGY CO., LTD (A #300866)"
77867,"SHENGYUAN ENVIRONMENTAL PROTECTION CO.,LTD. (A #300867)"
77869,"CONTEC MEDICAL SYSTEMS CO., LTD. (A #300869)"
77872,"TANSUN TECHNOLOGY CO.,LTD. (A #300872)"
77888,"WINNER MEDICAL CO., LTD. (A #300888)"
77891,"GUANGDONG HUIYUN TITANIUM INDUSTRY CO., LTD. (A #300891)"
77896,"IMEIK TECHNOLOGY DEVELOPMENT CO.,LTD. (A #300896)"
77900,"GUANGLIAN AVIATION INDUSTRY CO., LTD. (A #300900)"
77999,"YIHAI KERRY ARAWANA HOLDINGS CO., LTD (A #300999)"
78039,"CIMC VEHICLES (GROUP) CO., LTD. (A #301039)"
80737,SZ INVESTMENT HLDGS BAY AREA DEV CO LTD -RMB TRADED SHARES
82805,VANGUARD FTSE ASIA EX JAPAN INDEX ETF -RMB TRADED UNITS
82811,HAITONG CSI300 INDEX ETF -RMB TRADED UNITS
82813,CHINAAMC BLOOMBERG BARCLAYS CHI TREASURY +POLICY BK BD IND ETF-RMB TRADED UNITS
82817,PREMIA CHINA TREASURY AND POLICY BANK BOND LONG DURATION ETF-RMB TRADED UNITS
82822,CSOP FTSE CHINA A50 ETF-RMB TRADED UNITS
82823,ISHARES FTSE CHINA A50 ETF -RMB COUNTER
82828,HANG SENG CHINA ENTERPRISES INDEX ETF -RMB TRADED UNITS
82832,BOSERA STAR 50 INDEX ETF -RMB TRADED UNITS
82833,HANG SENG INDEX ETF -RMB TRADED UNITS
82834,ISHARES NASDAQ 100 ETF - RMB TRADED UNITS
82836,ISHARES CORE S&P BSE SENSEX INDIA ETF -RMB COUNTER
82843,AMUNDI FTSE CHINA A50 INDEX ETF -RMB TRADED UNITS
82846,ISHARES CORE CSI 300 ETF -RMB COUNTER
83001,PREMIA CHINA USD PROPERTY BOND ETF -RMB TRADED UNITS
83005,CSOP CSI 500 ETF-RMB TRADED UNITS
83010,ISHARES CORE MSCI ASIA EX JAPAN ETF -RMB COUNTER
83012,AMUNDI HANG SENG HK 35 INDEX ETF -RMB TRADED UNITS
83031,HAITONG MSCI CHINA A ESG ETF - RMB TRADED UNITS
83053,CSOP HONG KONG DOLLAR MONEY MARKET ETF - RMB TRADED UNITS
83074,ISHARES CORE MSCI TAIWAN ETF - RMB TRADED UNITS
83079,CICC BLOOMBERG BARCLAYS CHINA TREASURY 1-10 YEARS ETF-RMB TRADED UNITS
83081,VALUE GOLD ETF -RMB TRADED UNITS
83085,VANGUARD FTSE ASIA EX JAPAN HIGH DIV YIELD INDEX ETF-RMB TRADED UNITS
83093,CICC CSI SELECT 100 ETF-RMB TRADED UNITS
83100,E FUND (HK) CSI 300 A-SHARE INDEX ETF -RMB TRADED UNITS
83101,VANGUARD FTSE DEVELOPED EUROPE INDEX ETF -RMB TRADED UNITS
83108,HARVEST CSI 300 ESG LEADERS INDEX ETF -RMB TRADED UNITS
83115,ISHARES CORE HANG SENG INDEX ETF -RMB TRADED UNITS
83118,HARVEST MSCI CHINA A INDEX ETF -RMB TRADED UNITS
83122,CSOP RMB MONEY MARKET ETF - RMB TRADED UNITS
83126,VANGUARD FTSE JAPAN INDEX ETF -RMB TRADED UNITS
83127,GLOBAL X CSI 300 ETF-RMB TRADED UNITS
83128,HANG SENG CHINA A INDUSTRY TOP INDEX ETF -RMB TRADED UNITS
83130,HANG SENG HARVEST CSI 300 INDEX ETF -RMB TRADED UNITS
83140,VANGUARD S&P 500 INDEX ETF -RMB TRADED UNITS
83147,CSOP SZSE CHINEXT ETF -RMB TRADED UNITS
83149,CSOP MSCI CHINA A INCLUSION INDEX ETF -RMB TRADED UNITS
83167,ICBC CSOP S&P NEW CHINA SECTORS ETF -RMB TRADED UNITS
83168,HANG SENG RMB GOLD ETF
83169,VANGUARD TOTAL CHINA INDEX ETF -RMB TRADED UNITS
83170,ISHARES CORE KOSPI 200 ETF - RMB TRADED UNITS
83186,CICC KRANESHARES CSI CHINA INTERNET INDEX ETF-RMB TRADED UNITS
83188,CHINAAMC CSI 300 INDEX ETF -RMB TRADED UNITS
83197,CHINAAMC MSCI CHINA A INCLUSION INDEX ETF-RMB TRADED UNITS
83199,CSOP BLOOMBERG BARCLAYS CHINA TREASURY + POLICY BANK BOND IDX ETF-RMB TRADEDUNIT
87001,HUI XIAN REAL ESTATE INVESTMENT TRUST
90000,"SHANGHAI PUDONG DEVELOPMENT BANK CO., LTD. (A #600000)"
90004,"GUANGZHOU BAIYUN INTERNATIONAL AIRPORT CO.,LTD. (A #600004)"
90006,"DONGFENG AUTOMOBILE CO.,LTD (A #600006)"
90007,CHINA WORLD TRADE CENTER COMPANY LTD. (A #600007)
90008,"BEIJING CAPITAL ECO-ENVIRONMENT PROTECTION GROUP CO.,LTD (A #600008)"
90009,"SHANGHAI INTERNATIONAL AIRPORT CO., LTD. (A #600009)"
90010,"INNER MONGOLIA BAOTOU STEEL UNION CO.,LTD. (A #600010)"
90011,"HUANENG POWER INTERNATIONAL, INC. (A #600011)"
90012,ANHUI EXPRESSWAY COMPANY LIMITED (A #600012)
90015,"HUA XIA BANK CO., LIMITED (A #600015)"
90016,"CHINA MINSHENG BANKING CORP., LTD. (A #600016)"
90017,"RIZHAO PORT CO.,LTD. (A #600017)"
90018,"SHANGHAI INTERNATIONAL PORT (GROUP) CO., LTD (A #600018)"
90019,"BAOSHAN IRON & STEEL CO., LTD. (A #600019)"
90020,HENAN ZHONGYUAN EXPRESSWAY COMPANY LIMITED (A #600020)
90021,SHANGHAI ELECTRIC POWER COMPANY LIMITED (A #600021)
90023,"ZHEJIANG ZHENENG ELECTRIC POWER CO.,LTD (A #600023)"
90025,HUANENG LANCANG RIVER HYDROPOWER INC. (A #600025)
90026,"COSCO SHIPPING ENERGY TRANSPORTATION CO., LTD. (A #600026)"
90027,HUADIAN POWER INTERNATIONAL CORPORATION LIMITED (A #600027)
90028,CHINA PETROLEUM AND CHEMICAL CORPORATION (A #600028)
90029,CHINA SOUTHERN AIRLINES COMPANY LIMITED (A #600029)
90030,CITIC SECURITIES COMPANY LIMITED (A #600030)
90031,"SANY HEAVY INDUSTRY CO.,LTD (A #600031)"
90033,FUJIAN EXPRESSWAY DEVELOPMENT COMPANY LIMITED (A #600033)
90036,"CHINA MERCHANTS BANK CO.,LIMITED (A #600036)"
90037,"BEIJING GEHUA CATV NETWORK CO., LTD. (A #600037)"
90038,AVICOPTER PLC (A #600038)
90039,"SICHUAN ROAD & BRIDGE CO.,LTD (A #600039)"
90048,"POLY DEVELOPMENTS AND HOLDINGS GROUP CO., LTD. (A #600048)"
90050,CHINA UNITED NETWORK COMMUNICATIONS LIMITED (A #600050)
90053,"KUNWU JIUDING INVESTMENT HOLDINGS CO., LTD (A #600053)"
90054,"HUANGSHAN TOURISM DEVELOPMENT CO.,LTD. (A #600054)"
90056,"CHINA MEHECO CO., LTD. (A #600056)"
90057,"XIAMEN XIANGYU CO., LTD. (A #600057)"
90058,"MINMETALS DEVELOPMENT CO., LTD. (A #600058)"
90059,ZHEJIANG GUYUELONGSHAN SHAOXING WINE CO.LTD (A #600059)
90060,"HISENSE VISUAL TECHNOLOGY CO., LTD. (A #600060)"
90061,"SDIC CAPITAL CO.,LTD (A #600061)"
90062,"CHINA RESOURCES DOUBLE-CRANE PHARMACEUTICAL CO.,LTD. (A #600062)"
90063,ANHUI WANWEI UPDATED HIGH-TECH MATERIAL INDUSTRY COMPANY LIMITED (A #600063)
90064,NANJING GAOKE COMPANY LIMITED (A #600064)
90066,"YUTONG BUS CO.,LTD. (A #600066)"
90067,"CITYCHAMP DARTONG CO.,LTD. (A #600067)"
90068,CHINA GEZHOUBA GROUP COMPANY LIMITED (A #600068)
90070,"ZHEJIANG FURUN DIGITAL TECHNOLOGY CO., LTD. (A #600070)"
90072,"CSSC SCIENCE & TECHNOLOGY CO., LTD (A #600072)"
90073,SHANGHAI MALING AQUARIUS CO.LTD (A #600073)
90075,"XINJIANG TIANYE CO.,LTD. (A #600075)"
90077,"SUNDY LAND INVESTMENT CO.,LTD. (A #600077)"
90078,"JIANGSU CHENGXING PHOSPH-CHEMICAL CO.,LTD (A #600078)"
90079,"HUMANWELL HEALTHCARE (GROUP) CO.,LTD. (A #600079)"
90080,GINWA ENTERPRISE(GROUP) INC. (A #600080)
90081,"DONG FENG ELECTRONIC TECHNOLOGY CO.,LITD. (A #600081)"
90082,"TIANJIN HI-TECH DEVELOPMENT CO., LTD. (A #600082)"
90085,"BEIJING TONGRENTANG CO.,LTD (A #600085)"
90088,"CHINA TELEVISION MEDIA,LTD. (A #600088)"
90089,"TBEA CO.,LTD. (A #600089)"
90093,"EASY VISIBLE SUPPLY CHAIN MANAGEMENT CO.,LTD. (A #600093)"
90094,GREATTOWN HOLDINGS LTD. (A #600094)
90095,"XIANGCAI CO.,LTD (A #600095)"
90096,"YUNNAN YUNTIANHUA CO.,LTD (A #600096)"
90097,"SHANGHAI KAICHUANG MARINE INTERNATIONAL CO.,LTD. (A #600097)"
90098,GUANGZHOU DEVELOPMENT GROUP INCORPORATED (A #600098)
90100,"TSINGHUA TONGFANG CO., LTD (A #600100)"
90101,"SICHUAN MINGXING ELECTRIC POWER CO.,LTD (A #600101)"
90104,SAIC MOTOR CORPORATION LIMITED (A #600104)
90105,"JIANGSU ETERN CO., LTD. (A #600105)"
90106,"CHONGQING ROAD & BRIDGE CO.,LTD (A #600106)"
90108,"GANSU YASHENG INDUSTRIAL (GROUP) CO.,LTD (A #600108)"
90109,"SINOLINK SECURITIES CO., LTD. (A #600109)"
90110,"NUODE INVESTMENT CO., LTD. (A #600110)"
90111,"CHINA NORTHERN RARE EARTH (GROUP) HIGH-TECH CO., LTD (A #600111)"
90112,"GUIZHOU CHANGZHENG TIANCHENG HOLDING CO.,LTD. (A #600112)"
90113,"ZHEJIANG DONG RI CO., LTD (A #600113)"
90114,"NBTM NEW MATERIALS GROUP CO., LTD. (A #600114)"
90115,CHINA EASTERN AIRLINES CORPORATION LIMITED (A #600115)
90116,CHONGQING THREE GORGES WATERCONSERVANCY & ELECTRIC POWER CO LTD (A #600116)
90118,"CHINA SPACESAT CO.,LTD. (A #600118)"
90119,"Y.U.D YANGTZE RIVER INVESTMENT INDUSTRY CO.,LTD. (A #600119)"
90120,"ZHEJIANG ORIENT FINANCIAL HOLDINGS GROUP CO., LTD. (A #600120)"
90121,"ZHENGZHOU COAL INDUSTRY & ELECTRIC POWER CO.,LTD. (A #600121)"
90122,"JIANGSU HONGTU HIGH TECHNOLOGY CO.,LTD. (A #600122)"
90123,"SHANXI LANHUA SCI-TECH VENTURE CO.,LTD (A #600123)"
90125,"CHINA RAILWAY TIELONG CONTAINER LOGISTICS CO., LTD (A #600125)"
90131,"STATE GRID INFORMATION&COMMUNICATION CO.,LTD. (A #600131)"
90132,CHONG QING BREWERY CO.LTD (A #600132)
90135,"LUCKY FILM COMPANY,LIMITED (A #600135)"
90136,"WUHAN DDMC CULTURE & SPORTS CO.,LTD. (A #600136)"
90138,"CHINA CYTS TOURS HOLDING CO.,LTD. (A #600138)"
90139,"SICHUAN WESTERN RESOURCES HOLDING CO., LTD (A #600139)"
90141,"HUBEI XINGFA CHEMICALS GROUP CO.,LTD. (A #600141)"
90143,"KINGFA SCI.&TECH. CO.,LTD. (A #600143)"
90150,CHINA CSSC HOLDINGS LIMITED (A #600150)
90153,XIAMEN C&D INC. (A #600153)
90155,"POLARIS BAY GROUP CO.,LTD. (A #600155)"
90157,"WINTIME ENERGY CO.,LTD. (A #600157)"
90158,"CHINA SPORTS INDUSTRY GROUP CO., LTD. (A #600158)"
90160,"ZHEJIANG JUHUA CO.,LTD. (A #600160)"
90161,BEIJING TIANTAN BIOLOGICAL PRODUCTS CORPORATION LIMITED (A #600161)
90162,"SHENZHEN HEUNGKONG HOLDING CO., LTD (A #600162)"
90166,"BEIQI FOTON MOTOR CO.,LTD. (A #600166)"
90167,"LUENMEI QUANTUM CO.,LTD (A #600167)"
90168,"WUHAN SANZHEN INDUSTRY HOLDING CO.,LTD (A #600168)"
90169,"TAIYUAN HEAVY INDUSTRY CO.,LTD. (A #600169)"
90170,"SHANGHAI CONSTRUCTION GROUP CO., LTD (A #600170)"
90171,"SHANGHAI BELLING CO.,LTD. (A #600171)"
90172,"HENAN HUANGHE WHIRLWIND CO.,LTD. (A #600172)"
90173,"WOLONG REAL ESTATE GROUP CO.,LTD. (A #600173)"
90176,"CHINA JUSHI CO., LTD. (A #600176)"
90177,"YOUNGOR GROUP CO.,LTD. (A #600177)"
90179,"ANTONG HOLDINGS CO., LTD. (A #600179)"
90180,"CCS SUPPLY CHAIN MANAGEMENT CO., LTD. (A #600180)"
90183,"SHENGYI TECHNOLOGY CO., LTD. (A #600183)"
90185,"GREE REAL ESTATE CO.,LTD (A #600185)"
90188,YANZHOU COAL MINING COMPANY LIMITED (A #600188)
90190,"JINZHOU PORT CO.,LTD. (A #600190)"
90193,"SHANGHAI PROSOLAR RESOURCE DEVELOPMENT CO.,LTD (A #600193)"
90195,"CHINA ANIMAL HUSBANDRY INDUSTRY CO.,LTD. (A #600195)"
90196,"SHANGHAI FOSUN PHARMACEUTICAL (GROUP) CO., LTD. (A #600196)"
90197,"XINJIANG YILITE INDUSTRY CO.,LTD (A #600197)"
90199,"ANHUI GOLDEN SEED WINERY CO.,LTD. (A #600199)"
90200,"JIANGSU WUZHONG PHARMACEUTICAL DEVELOPMENT CO., LTD.(A #600200)"
90201,"INNER MONGOLIA JINYU GROUP CO., LTD (A #600201)"
90206,"GRINM ADVANCED MATERIALS CO.,LTD. (A #600206)"
90208,"XINHU ZHONGBAO CO.,LTD (A #600208)"
90210,"SHANGHAI ZIJIANG ENTERPRISE GROUP CO.,LTD (A #600210)"
90211,TIBET RHODIOLA PHARMACEUTICAL HOLDING CO. (A #600211)
90216,"ZHEJIANG MEDICINE CO.,LTD (A #600216)"
90218,"ANHUI QUANCHAI ENGINE CO.,LTD. (A #600218)"
90219,"SHANDONG NANSHAN ALUMINIUM CO., LTD (A #600219)"
90221,"HAINAN AIRLINES HOLDING CO., LTD. (A #600221)"
90223,"LUSHANG HEALTH INDUSTRY DEVELOPMENT CO.,LTD. (A #600223)"
90226,"ZHEJIANG HUGE LEAF CO.,LTD. (A #600226)"
90227,"GUIZHOU SALVAGE PHARMACEUTICAL CO.,LTD. (A #600227)"
90230,CANGZHOU DAHUA CO.LTD (A #600230)
90231,"LINGYUAN IRON & STEEL CO.,LTD. (A #600231)"
90233,"YTO EXPRESS GROUP CO.,LTD. (A #600233)"
90236,"GUANGXI GUIGUAN ELECTRIC POWER CO.,LTD. (A #600236)"
90238,"HAINAN YEDAO (GROUP) CO.,LTD (A #600238)"
90239,"YUNNAN METROPOLITAN REAL ESTATE DEVELOPMENT CO.,LTD (A #600239)"
90246,"VANTONE NEO DEVELOPMENT GROUP CO., LTD (A #600246)"
90248,SHAANXI CONSTRUCTION ENGINEERING GROUP CORPORATION LIMITED (A #600248)
90251,"XINGJIANG GUANNONG FRUIT & ANTLER GROUP CO., LTD. (A #600251)"
90252,"GUANGXI WUZHOU ZHONGHENG GROUP CO.,LTD. (A #600252)"
90255,"ANHUI XINKE NEW MATERIALS CO., LTD. (A #600255)"
90256,"GUANGHUI ENERGY CO.,LTD. (A #600256)"
90257,"DAHU AQUACULTURE CO.,LTD. (A #600257)"
90258,"BTG HOTELS(GROUP)CO., LTD (A #600258)"
90259,"RISING NONFERROUS METALS SHARE CO., LTD. (A #600259)"
90260,"HUBEI KAILE SCIENCE AND TECHNOLOGY CO.,LTD (A #600260)"
90261,"ZHEJIANG YANKON GROUP CO.,LTD. (A #600261)"
90262,"INNER MONGOLIA NORTH HAULER JOINT STOCK CO.,LTD. (A #600262)"
90266,"BEIJING URBAN CONSTRUCTION INVESTMENT& DEVELOPMENT CO.,LTD. (A #600266)"
90267,"ZHEJIANG HISUN PHARMACEUTICAL CO.,LTD (A #600267)"
90268,"GUODIAN NANJING AUTOMATION CO.,LTD. (A #600268)"
90269,"JIANGXI GANYUE EXPRESSWAY CO.,LTD. (A #600269)"
90271,AISINO CORPORATION (A #600271)
90273,"ZHEJIANG JIAHUA ENERGY CHEMICAL INDUSTRY CO.,LTD. (A #600273)"
90276,"JIANGSU HENGRUI MEDICINE CO.,LTD. (A #600276)"
90277,ELION CLEAN ENERGY COMPANY LIMITED (A #600277)
90278,ORIENT INTERNATIONAL ENTERPRISE LTD. (A #600278)
90280,"NANJING CENTRAL EMPORIUM STOCKS CO., LTD. (A #600280)"
