stock_code,stock_name,stock_name_chi
1,CK HUTCHISON HOLDINGS LIMITED,長和
2,CLP HOLDINGS LIMITED,中電控股
3,"HONG KONG AND CHINA GAS COMPANY LIMITED, THE",香港中華煤氣
4,"WHARF (HOLDINGS) LIMITED, THE",九龍倉集團
5,HSBC HOLDINGS PLC,匯豐控股
6,POWER ASSETS HOLDINGS LIMITED,電能實業
7,WISDOM WEALTH RESOURCES INVESTMENT HOLDING GROUP LIMITED,智富資源投資
8,PCCW LIMITED,電訊盈科
9,KEYNE LTD,金奧國際
10,HANG LUNG GROUP LIMITED,恆隆集團
11,HANG SENG BANK LTD,恆生銀行
12,HENDERSON LAND DEVELOPMENT CO LTD,恆基地產
13,HUTCHMED (CHINA) LIMITED,和黃醫藥
14,HYSAN DEVELOPMENT COMPANY LIMITED,希慎興業
16,SUN HUNG KAI PROPERTIES LIMITED,新鴻基地產
17,NEW WORLD DEVELOPMENT CO LTD,新世界發展
18,ORIENTAL PRESS GROUP LTD,東方報業集團
19,SWIRE PACIFIC LTD 'A',太古股份公司Ａ
21,GREAT CHINA PROPERTIES HOLDINGS LIMITED,大中華地產控股
22,MEXAN LIMITED,茂盛控股
23,BANK OF EAST ASIA LTD,東亞銀行
24,BURWILL HOLDINGS LIMITED,寶威控股
25,CHEVALIER INTERNATIONAL HOLDINGS LIMITED,CHEVALIER INT'L
26,CHINA MOTOR BUS COMPANY LIMITED,中華汽車
27,GALAXY ENTERTAINMENT GROUP LIMITED,銀河娛樂
28,TIAN AN CHINA INVESTMENTS COMPANY LIMITED,天安
29,DYNAMIC HOLDINGS LIMITED,達力集團
30,BAN LOONG HOLDINGS LIMITED,萬隆控股集團
31,CHINA AEROSPACE INTERNATIONAL HOLDINGS LIMITED,航天控股
32,"CROSS-HARBOUR (HOLDINGS) LIMITED, THE",港通控股
33,AMBER HILL FINANCIAL HOLDINGS LIMITED -NEW,安山金控
34,KOWLOON DEVELOPMENT COMPANY LIMITED,九龍建業
35,FAR EAST CONSORTIUM INTERNATIONAL LTD,遠東發展
36,FAR EAST HOLDINGS INTERNATIONAL LIMITED,遠東控股國際
37,FAR EAST HOTELS & ENTERTAINMENT LIMITED,遠東酒店實業
38,FIRST TRACTOR COMPANY LIMITED,第一拖拉機股份
39,CHINA BEIDAHUANG INDUSTRY GROUP HOLDINGS LIMITED,中國北大荒
40,GOLD PEAK INDUSTRIES (HOLDINGS) LTD,金山工業
41,GREAT EAGLE HOLDINGS LIMITED,鷹君
42,NORTHEAST ELECTRIC DEVELOPMENT COMPANY LIMITED,東北電氣
43,C.P. POKPHAND CO LTD,卜蜂國際
45,"HONGKONG AND SHANGHAI HOTELS LTD,THE",大酒店
46,COMPUTER AND TECHNOLOGIES HOLDINGS LIMITED,科聯系統
47,HOP HING GROUP HOLDINGS LIMITED,合興集團
48,CHINA AUTOMOTIVE INTERIOR DECORATION HOLDINGS LIMITED,中國汽車內飾
50,HONG KONG FERRY (HOLDINGS) CO LTD,香港小輪(集團)
51,HARBOUR CENTRE DEVELOPMENT LTD,海港企業
52,FAIRWOOD HOLDINGS LIMITED,FAIRWOOD HOLD
53,GUOCO GROUP LIMITED,國浩集團
55,NEWAY GROUP HOLDINGS LIMITED,中星集團控股
57,CHEN HSONG HOLDINGS LTD,震雄集團
58,SUNWAY INTERNATIONAL HOLDINGS LIMITED,新威國際
59,SKYFAME REALTY (HOLDINGS) LIMITED,天譽置業
60,HONG KONG FOOD INVESTMENT HOLDINGS LIMITED,香港食品投資
61,GREEN LEADER HOLDINGS GROUP LIMITED,綠領控股
62,TRANSPORT INTERNATIONAL HOLDINGS LIMITED,載通
63,CHINA ASIA VALLEY GROUP LIMITED,中亞烯谷集團
64,GET NICE HOLDINGS LIMITED,結好控股
65,GRAND OCEAN ADVANCED RESOURCES COMPANY LIMITED,弘海高新資源
66,MTR CORPORATION LIMITED,港鐵公司
67,CHINA LUMENA NEW MATERIALS CORP.,旭光高新材料
68,LEE HING DEVELOPMENT LTD,利興發展
69,SHANGRI-LA ASIA LIMITED,香格里拉(亞洲)
70,RICH GOLDMAN HOLDINGS LIMITED,金粵控股
71,MIRAMAR HOTEL & INVESTMENT CO LTD,美麗華酒店
72,MODERN MEDIA HOLDINGS LIMITED,現代傳播
73,ASIAN CITRUS HOLDINGS LIMITED,亞洲果業
75,Y. T. REALTY GROUP LIMITED,渝太地產
76,ELATE HOLDINGS LIMITED,誼礫控股
77,AMS PUBLIC TRANSPORT HOLDINGS LIMITED,進智公共交通
78,REGAL HOTELS INTERNATIONAL HOLDINGS LIMITED,REGAL INT'L
79,CENTURY LEGEND (HOLDINGS) LIMITED,世紀建業
80,CHINA NEW ECONOMY FUND LIMITED,中國新經濟投資
81,CHINA OVERSEAS GRAND OCEANS GROUP LIMITED,中國海外宏洋集團
82,CRAZY SPORTS GROUP LIMITED,瘋狂體育
83,SINO LAND CO.LTD.,信和置業
84,STELUX HOLDINGS INTERNATIONAL LIMITED,寶光實業
85,CHINA ELECTRONICS HUADA TECHNOLOGY COMPANY LIMITED,中電華大科技
86,SUN HUNG KAI & CO.LTD,新鴻基公司
87,SWIRE PACIFIC LTD 'B',太古股份公司Ｂ
88,TAI CHEUNG HOLDINGS LTD,TAI CHEUNG HOLD
89,TAI SANG LAND DEVELOPMENT LTD,大生地產
90,PUXING ENERGY LIMITED,普星能量
91,GOLDEN CENTURY INTERNATIONAL HOLDINGS GROUP LIMITED,金禧國際控股
92,CHAMPION TECHNOLOGY HOLDINGS LIMITED,冠軍科技集團
93,TERMBRAY INDUSTRIES INTERNATIONAL (HOLDINGS) LIMITED,TERMBRAY IND
94,GREENHEART GROUP LIMITED,綠心集團
95,LVGEM (CHINA) REAL ESTATE INVESTMENT COMPANY LIMITED,綠景中國地產
96,YUSEI HOLDINGS LIMITED,YUSEI HOLDINGS LIMITED
97,HENDERSON INVESTMENT LTD,恆基發展
98,XINGFA ALUMINIUM HOLDINGS LIMITED,興發鋁業
99,WONG'S INTERNATIONAL HOLDINGS LIMITED,王氏國際
100,CLEAR MEDIA LIMITED,白馬戶外媒體
101,HANG LUNG PROPERTIES LIMITED,恆隆地產
102,SUMMIT ASCENT HOLDINGS LIMITED,凱升控股
103,SHOUGANG CONCORD CENTURY HOLDINGS LIMITED,首長寶佳
104,ASIA COMMERCIAL HOLDINGS LIMITED,ASIA COMM HOLD
105,ASSOCIATED INTERNATIONAL HOTELS LTD,凱聯國際酒店
106,"LANDSEA GREEN PROPERTIES CO., LTD.",朗詩地產
107,SICHUAN EXPRESSWAY COMPANY LIMITED,四川成渝高速公路
108,GR PROPERTIES LIMITED,國銳地產
109,GOOD RESOURCES HOLDINGS LIMITED,天成國際
110,CHINA FORTUNE HOLDINGS LIMITED,中國長遠
111,CINDA INTERNATIONAL HOLDINGS LIMITED,信達國際控股
112,LERTHAI GROUP LIMITED,勒泰集團
113,DICKSON CONCEPTS (INTERNATIONAL) LIMITED,迪生創建
114,HERALD HOLDINGS LTD,HERALD HOLD
115,GRAND FIELD GROUP HOLDINGS LIMITED,鈞濠集團
116,CHOW SANG SANG HOLDINGS INTERNATIONAL LIMITED,周生生
117,TIANLI HOLDINGS GROUP LIMITED,天利控股集團
118,COSMOS MACHINERY ENTERPRISES LIMITED,大同機械
119,"POLY PROPERTY GROUP CO., LIMITED",保利置業集團
120,COSMOPOLITAN INTERNATIONAL HOLDINGS LTD,COSMOPOL INT'L
122,CROCODILE GARMENTS LIMITED,鱷魚恤
123,YUEXIU PROPERTY COMPANY LIMITED,越秀地產
124,GUANGDONG LAND HOLDINGS LIMITED,粵海置地
125,SUN HING VISION GROUP HOLDINGS LIMITED,新興光學
126,CARRIANNA GROUP HOLDINGS COMPANY LIMITED,佳寧娜
127,CHINESE ESTATES HOLDINGS LIMITED,華人置業
128,ENM HOLDINGS LIMITED,安寧控股
129,ASIA STANDARD INTERNATIONAL GROUP LTD,泛海集團
130,MOISELLE INTERNATIONAL HOLDINGS LIMITED,慕詩國際
131,CHEUK NANG (HOLDINGS) LIMITED,卓能(集團)
132,CHINA INVESTMENTS HOLDINGS LIMITED,中國興業控股
133,CHINA MERCHANTS CHINA DIRECT INVESTMENTS LIMITED,招商局中國基金
135,KUNLUN ENERGY COMPANY LIMITED,昆侖能源
136,HENGTEN NETWORKS GROUP LIMITED,恆騰網絡
137,JINHUI HOLDINGS COMPANY LIMITED,金輝集團
138,CCT FORTIS HOLDINGS LIMITED,中建富通
139,CENTRAL WEALTH GROUP HOLDINGS LIMITED,中達集團控股
141,SKY CHINAFORTUNE HOLDINGS GROUP LIMITED,天禧海嘉控股
142,FIRST PACIFIC CO. LTD.,第一太平
143,GUOAN INTERNATIONAL LIMITED,國安國際
144,CHINA MERCHANTS PORT HOLDINGS COMPANY LIMITED,招商局港口
145,CCIAM FUTURE ENERGY LIMITED,信能低碳
146,TAI PING CARPETS INTERNATIONAL LTD,TAI PING CARPET
147,INTERNATIONAL BUSINESS SETTLEMENT HOLDINGS LIMITED,國際商業結算
148,KINGBOARD HOLDINGS LIMITED,建滔集團
149,CHINA AGRI-PRODUCTS EXCHANGE LIMITED,中國農產品交易
150,HYPEBEAST LIMITED,HYPEBEAST LIMITED
151,WANT WANT CHINA HOLDINGS LIMITED,中國旺旺
152,SHENZHEN INTERNATIONAL HOLDINGS LIMITED,深圳國際
153,CHINA SAITE GROUP COMPANY LIMITED,中國賽特
154,BEIJING ENTERPRISES ENVIRONMENT GROUP LIMITED,北京控股環境集團
155,CHINA SOLAR ENERGY HOLDINGS LIMITED,中國源暢
156,LIPPO CHINA RESOURCES LIMITED,力寶華潤
157,NATURAL BEAUTY BIO-TECHNOLOGY LIMITED,自然美
158,MELBOURNE ENTERPRISES LTD.,萬邦投資
159,BROCKMAN MINING LIMITED,布萊克萬礦業
160,"HON KWOK LAND INVESTMENT COMPANY,LIMITED",漢國置業
162,CENTURY GINWA RETAIL HOLDINGS LIMITED,世紀金花
163,EMPEROR INTERNATIONAL HOLDINGS LIMITED,英皇國際
164,CHINA BAOLI TECHNOLOGIES HOLDINGS LIMITED,中國寶力科技
165,CHINA EVERBRIGHT LIMITED,中國光大控股
166,NEW TIMES ENERGY CORPORATION LIMITED,新時代能源
167,IDT INTERNATIONAL LIMITED,IDT INT'L
168,TSINGTAO BREWERY COMPANY LIMITED,青島啤酒股份
169,WANDA HOTEL DEVELOPMENT COMPANY LIMITED,萬達酒店發展
171,SILVER GRANT INTERNATIONAL HOLDINGS GROUP LIMITED,銀建國際
172,GOLDBOND GROUP HOLDINGS LIMITED,金榜集團
173,K. WAH INTERNATIONAL HOLDINGS LIMITED,嘉華國際
174,GEMINI INVESTMENTS (HOLDINGS) LIMITED,盛洋投資
175,GEELY AUTOMOBILE HOLDINGS LIMITED,吉利汽車
176,SUPERACTIVE GROUP COMPANY LIMITED,先機企業集團
177,JIANGSU EXPRESSWAY COMPANY LIMITED,江蘇寧滬高速公路
178,SA SA INTERNATIONAL HOLDINGS LIMITED,莎莎國際
179,JOHNSON ELECTRIC HOLDINGS LIMITED,德昌電機控股
180,KADER HOLDINGS CO. LTD,開達集團
181,FUJIAN HOLDINGS LIMITED,閩港控股
182,CONCORD NEW ENERGY GROUP LIMITED,協合新能源
183,WINFULL GROUP HOLDINGS LIMITED,宏輝集團
184,KECK SENG INVESTMENTS (HONG KONG) LTD,激成投資
185,ZENSUN ENTERPRISES LIMITED,正商實業
186,NIMBLE HOLDINGS COMPANY LIMITED,敏捷控股
187,BEIJING JINGCHENG MACHINERY ELECTRIC COMPANY LIMITED,京城機電股份
188,SUNWAH KINGSWAY CAPITAL HOLDINGS LIMITED,新華匯富金融
189,DONGYUE GROUP LIMITED,東岳集團
191,LAI SUN GARMENT (INTERNATIONAL) LIMITED,麗新國際
193,CAPITAL ESTATE LIMITED,冠中地產
194,LIU CHONG HING INVESTMENT LTD,廖創興企業
195,GREENTECH TECHNOLOGY INTERNATIONAL LIMITED,綠科科技國際
196,HONGHUA GROUP LIMITED,宏華集團
197,HENG TAI CONSUMABLES GROUP LIMITED,亨泰
199,ITC PROPERTIES GROUP LIMITED,德祥地產
200,MELCO INTERNATIONAL DEVELOPMENT LIMITED,新濠國際發展
201,MAGNIFICENT HOTEL INVESTMENTS LIMITED,華大酒店
202,EVERCHINA INT'L HOLDINGS COMPANY LIMITED,潤中國際控股
204,CHINA INVESTMENT DEVELOPMENT LIMITED,中國投資開發
205,SEEC MEDIA GROUP LIMITED,財訊傳媒
206,"CMIC OCEAN EN-TECH HOLDING CO., LTD.",華商國際海洋控股
207,JOY CITY PROPERTY LIMITED,大悅城地產
209,WINSHINE SCIENCE COMPANY LIMITED,瀛晟科學
210,DAPHNE INTERNATIONAL HOLDINGS LIMITED,達芙妮國際
211,STYLAND HOLDINGS LIMITED,STYLAND HOLD
212,NANYANG HOLDINGS LIMITED,NANYANG HOLD
213,NATIONAL ELECTRONICS HOLDINGS LTD,NATIONAL ELEC H
214,ASIA ORIENT HOLDINGS LIMITED,匯漢控股
215,HUTCHISON TELECOMMUNICATIONS HONG KONG HOLDINGS LIMITED,和記電訊香港
216,CHINNEY INVESTMENTS LTD,建業實業
217,CHINA CHENGTONG DEVELOPMENT GROUP LIMITED,中國誠通發展集團
218,SHENWAN HONGYUAN (H.K.) LIMITED,申萬宏源香港
219,SHUN HO PROPERTY INVESTMENTS LIMITED,順豪物業
220,UNI-PRESIDENT CHINA HOLDINGS LTD.,統一企業中國
222,MIN XIN HOLDINGS LIMITED,閩信集團
223,ELIFE HOLDINGS LIMITED,易生活控股
224,PIONEER GLOBAL GROUP LIMITED,建生國際
225,POKFULAM DEVELOPMENT CO. LTD,博富臨置業
226,LIPPO LIMITED,力寶
227,FIRST SHANGHAI INVESTMENTS LIMITED,第一上海
228,CHINA ENERGY DEVELOPMENT HOLDINGS LTD,中能控股
229,RAYMOND INDUSTRIAL LIMITED,利民實業
230,MINMETALS LAND LIMITED,五礦地產
231,PING AN SECURITIES GROUP (HOLDINGS) LIMITED,平安證券集團控股
232,CONTINENTAL AEROSPACE TECHNOLOGIES HOLDING LIMITED,大陸航空科技控股
234,NEW CENTURY GROUP HONG KONG LIMITED,新世紀集團
235,CHINA STRATEGIC HOLDINGS LIMITED,中策集團
236,SAN MIGUEL BREWERY HONG KONG LIMITED,香港生力啤
237,SAFETY GODOWN CO. LTD,安全貨倉
238,EVERGREEN INTERNATIONAL HOLDINGS LIMITED,長興國際
239,PAK FAH YEOW INTERNATIONAL LIMITED,白花油
240,BUILD KING HOLDINGS LIMITED,利基控股
241,ALIBABA HEALTH INFORMATION TECHNOLOGY LIMITED,阿里健康
242,SHUN TAK HOLDINGS LIMITED,信德集團
243,QPL INTERNATIONAL HOLDINGS LIMITED,QPL INT'L
244,"THE SINCERE COMPANY, LIMITED",先施
245,CHINA VERED FINANCIAL HOLDING CORPORATION LIMITED,中薇金融
247,TSIM SHA TSUI PROPERTIES LTD,TST PROPERTIES
248,HKC INTERNATIONAL HOLDINGS LIMITED,香港通訊國際控股
250,SINO-I TECHNOLOGY LIMITED,中國數碼信息
251,SEA HOLDINGS LIMITED,爪哇控股
252,SOUTHEAST ASIA PROPERTIES & FINANCE LTD,華信地產財務
253,SHUN HO HOLDINGS LIMITED,順豪控股
254,NATIONAL UNITED RESOURCES HOLDINGS LIMITED,國家聯合資源
255,LUNG KEE (BERMUDA) HOLDINGS LIMITED,龍記集團
256,CITYCHAMP WATCH & JEWELLERY GROUP LIMITED,冠城鐘錶珠寶
257,CHINA EVERBRIGHT ENVIRONMENT GROUP LIMITED,光大環境
258,TOMSON GROUP LIMITED,湯臣集團
259,YEEBO (INTERNATIONAL HOLDINGS) LIMITED,億都(國際控股)
260,AVIC JOY HOLDINGS (HK) LIMITED,幸福控股
261,GBA HOLDINGS LIMITED,GBA集團
262,DESON DEVELOPMENT INTERNATIONAL HOLDINGS LIMITED,迪臣發展國際
263,GT GROUP HOLDINGS LIMITED,高富集團控股
264,CHINA INTERNATIONAL DEVELOPMENT CORPORATION LIMITED,中聯發展控股
265,ORIENT VICTORY TRAVEL GROUP COMPANY LTD,東勝旅遊
266,TIAN TECK LAND LTD,天德地產
267,CITIC LIMITED,中信股份
268,KINGDEE INTERNATIONAL SOFTWARE GROUP COMPANY LIMITED,金蝶國際
269,CHINA RESOURCES AND TRANSPORTATION GROUP LIMITED,中國資源交通
270,GUANGDONG INVESTMENT LIMITED,粵海投資
271,ASIASEC PROPERTIES LIMITED,亞證地產
272,SHUI ON LAND LIMITED,瑞安房地產
273,MASON GROUP HOLDINGS LIMITED,茂宸集團
274,CHINA BILLION RESOURCES LIMITED,中富資源
276,MONGOLIA ENERGY CORPORATION LIMITED,蒙古能源
277,TERN PROPERTIES CO. LTD,太興置業
278,WAH HA REALTY CO. LTD,華廈置業
279,FREEMAN FINTECH CORPORATION LIMITED,民眾金融科技
280,KING FOOK HOLDINGS LTD,景福集團
281,RIVERA (HOLDINGS) LIMITED,川河集團
282,NEXT DIGITAL LIMITED,壹傳媒
285,BYD ELECTRONIC (INTERNATIONAL) COMPANY LIMITED,比亞迪電子
286,AIDIGONG MATERNAL & CHILD HEALTH LIMITED,愛帝宮
287,WINFAIR INVESTMENT CO. LTD,永發置業
288,WH GROUP LIMITED,萬洲國際
289,WING ON COMPANY INTERNATIONAL LIMITED,WING ON CO
290,CHINA FORTUNE FINANCIAL GROUP LIMITED,中國富強金融
291,CHINA RESOURCES BEER (HOLDINGS) COMPANY LIMITED,華潤啤酒
292,ASIA STANDARD HOTEL GROUP LIMITED,泛海酒店
293,CATHAY PACIFIC AIRWAYS LTD,國泰航空
294,YANGTZEKIANG GARMENT LIMITED,長江製衣
295,KONG SUN HOLDINGS LIMITED,江山控股
296,EMPEROR ENTERTAINMENT HOTEL LIMITED,英皇娛樂酒店
297,SINOFERT HOLDINGS LIMITED,中化化肥
298,CHUANG'S CHINA INVESTMENTS LIMITED,莊士中國
299,GLORY SUN LAND GROUP LIMITED,寶新置地
301,SANVO FINE CHEMICALS GROUP LIMITED,三和精化
302,CMGE TECHNOLOGY GROUP LIMITED,中手游
303,VTECH HOLDINGS LIMITED,VTECH HOLDINGS
305,WULING MOTORS HOLDINGS LIMITED,五菱汽車
306,KWOON CHUNG BUS HOLDINGS LIMITED,冠忠巴士集團
307,UP ENERGY DEVELOPMENT GROUP LIMITED,優派能源發展
308,CHINA TRAVEL INTERNATIONAL INVESTMENT HONG KONG LIMITED,香港中旅
309,XINHUA NEWS MEDIA HOLDINGS LIMITED,新華通訊頻媒
310,PROSPERITY INVESTMENT HOLDINGS LIMITED,嘉進投資國際
311,LUEN THAI HOLDINGS LIMITED,聯泰控股
312,SHIRBLE DEPARTMENT STORE HOLDINGS (CHINA) LIMITED,歲寶百貨
313,RICHLY FIELD CHINA DEVLOPMENT LIMITED,裕田中國
315,SMARTONE TELECOMMUNICATIONS HOLDINGS LIMITED,數碼通電訊
316,ORIENT OVERSEAS (INTERNATIONAL) LIMITED,東方海外國際
317,CSSC OFFSHORE & MARINE ENGINEERING (GROUP) COMPANY LIMITED,中船防務
318,VONGROUP LIMITED,黃河實業
320,COMPUTIME GROUP LIMITED,金寶通
321,TEXWINCA HOLDINGS LIMITED,德永佳集團
322,TINGYI (CAYMAN ISLANDS) HOLDING CORP.,康師傅控股
323,MAANSHAN IRON & STEEL COMPANY LIMITED,馬鞍山鋼鐵股份
326,CHINA STAR ENTERTAINMENT LIMITED,中國星集團
327,PAX GLOBAL TECHNOLOGY LIMITED,百富環球
328,ALCO HOLDINGS LIMITED,ALCO HOLDINGS
329,OCI INTERNATIONAL HOLDINGS LIMITED,東建國際
330,ESPRIT HOLDINGS LIMITED,思捷環球
331,FSE LIFESTYLE SERVICES LIMITED,豐盛生活服務
332,YUAN HENG GAS HOLDINGS LIMITED,元亨燃氣
333,TOP FORM INTERNATIONAL LIMITED,黛麗斯國際
334,CHINA DISPLAY OPTOELECTRONICS TECHNOLOGY HOLDINGS LIMITED,華顯光電
335,UPBEST GROUP LIMITED,美建集團
336,HUABAO INTERNATIONAL HOLDINGS LIMITED,華寶國際
337,GREENLAND HONG KONG HOLDINGS LIMITED,綠地香港
338,SINOPEC SHANGHAI PETROCHEMICAL COMPANY LIMITED,上海石油化工股份
339,CORE ECONOMY INVESTMENT GROUP LIMITED,核心經濟投資
340,TONGGUAN GOLD GROUP LIMITED,潼關黃金
341,CAFE DE CORAL HOLDINGS LTD,大家樂集團
342,NEWOCEAN ENERGY HOLDINGS LIMITED,新海能源
343,CULTURECOM HOLDINGS LIMITED,文化傳信
345,VITASOY INTERNATIONAL HOLDINGS LTD,VITASOY INT'L
346,YANCHANG PETROLEUM INTERNATIONAL LIMITED,延長石油國際
347,ANGANG STEEL COMPANY LIMITED,鞍鋼股份
348,CHINA HEALTHWISE HOLDINGS LIMITED,中國智能健康
351,ASIA ENERGY LOGISTICS GROUP LIMITED,亞洲能源物流
352,FORTUNE SUN (CHINA) HOLDINGS LIMITED,富陽
353,ENERGY INTERNATIONAL INVESTMENTS HOLDINGS LIMITED,能源國際投資
354,CHINASOFT INTERNATIONAL LIMITED,中國軟件國際
355,CENTURY CITY INTERNATIONAL HOLDINGS LTD,世紀城市國際
356,DT CAPITAL LIMITED,鼎立資本
357,HAINAN MEILAN INTERNATIONAL AIRPORT COMPANY LIMITED,美蘭空港
358,JIANGXI COPPER COMPANY LIMITED,江西銅業股份
359,"CHINA HAISHENG JUICE HOLDINGS CO., LTD.",海升果汁
360,NEW FOCUS AUTO TECH HOLDINGS LIMITED,新焦點
361,SINO GOLF HOLDINGS LIMITED,順龍控股
362,XINYANG MAOJIAN GROUP LIMITED,信陽毛尖
363,SHANGHAI INDUSTRIAL HOLDINGS LIMITED,上海實業控股
364,BLOCKCHAIN GROUP COMPANY LIMITED,區塊鏈集團
365,SINO ICT HOLDINGS LIMITED,芯成科技
366,LUKS GROUP (VIETNAM HOLDINGS) COMPANY LIMITED,陸氏集團(越南)
367,CHUANG'S CONSORTIUM INTERNATIONAL LIMITED,莊士機構國際
368,SUPERLAND GROUP HOLDINGS LIMITED,德合集團
369,WING TAI PROPERTIES LIMITED,永泰地產
370,CHINA BEST GROUP HOLDING LIMITED,國華
371,BEIJING ENTERPRISES WATER GROUP LIMITED,北控水務集團
372,PT INTERNATIONAL DEVELOPMENT CORPORATION LIMITED,保德國際發展
373,ALLIED GROUP LIMITED,聯合集團
374,FOUR SEAS MERCANTILE HOLDINGS LIMITED,四洲集團
375,YGM TRADING LTD,YGM TRADING
376,YUNFENG FINANCIAL GROUP LIMITED,雲鋒金融
377,CHINA HUAJUN GROUP LIMITED,中國華君
378,FDG KINETIC LIMITED,五龍動力
379,"CHINA EVER GRAND FINANCIAL LEASING GROUP CO., LTD",恆嘉融資租賃
380,CHINA PIPE GROUP LIMITED,中國管業
381,KIU HUNG INTERNATIONAL HOLDINGS LIMITED,僑雄國際
382,EDVANTAGE GROUP HOLDINGS LIMITED,中匯集團
383,CHINA MEDICAL & HEALTHCARE GROUP LIMITED,中國醫療網絡
384,CHINA GAS HOLDINGS LIMITED,中國燃氣
385,CHINNEY ALLIANCE GROUP LIMITED,建聯集團
386,CHINA PETROLEUM & CHEMICAL CORPORATION,中國石油化工股份
387,LEEPORT (HOLDINGS) LIMITED,力豐(集團)
388,HONG KONG EXCHANGES AND CLEARING LIMITED,香港交易所
389,CHINA TONTINE WINES GROUP LIMITED,通天酒業
390,CHINA RAILWAY GROUP LIMITED,中國中鐵
391,MEI AH ENTERTAINMENT GROUP LIMITED,美亞娛樂資訊
392,BEIJING ENTERPRISES HOLDINGS LIMITED,北京控股
393,GLORIOUS SUN ENTERPRISES LIMITED,旭日企業
395,SMARTAC INTERNATIONAL HOLDINGS LIMITED,環球智能控股
396,HING LEE (HK) HOLDINGS LIMITED,興利(香港)控股
397,POWER FINANCIAL GROUP LIMITED,權威金融
398,ORIENTAL WATCH HOLDINGS LIMITED,東方表行集團
399,INNOVATIVE PHARMACEUTICAL BIOTECH LIMITED,領航醫藥生物科技
400,COGOBUY GROUP,科通芯城
401,WANJIA GROUP HOLDINGS LIMITED,萬嘉集團
403,STARLITE HOLDINGS LIMITED,星光集團
405,YUEXIU REAL ESTATE INVESTMENT TRUST,越秀房產信託基金
406,YAU LEE HOLDINGS LIMITED,有利集團
408,YIP'S CHEMICAL HOLDINGS LIMITED,葉氏化工集團
410,SOHO CHINA LIMITED,SOHO中國
411,LAM SOON (HONG KONG) LIMITED,南順(香港)
412,CHINA SHANDONG HI-SPEED FINANCIAL GROUP LIMITED,山高金融
413,SOUTH CHINA HOLDINGS COMPANY LIMITED,南華集團控股
416,"BANK OF JINZHOU CO., LTD.",錦州銀行
417,TSE SUI LUEN JEWELLERY (INTERNATIONAL) LIMITED,謝瑞麟
418,FOUNDER HOLDINGS LIMITED,方正控股
419,HUAYI TENCENT ENTERTAINMENT COMPANY LIMITED,華誼騰訊娛樂
420,FOUNTAIN SET (HOLDINGS) LTD,福田實業
422,VIETNAM MANUFACTURING AND EXPORT PROCESSING (HOLDINGS) LIMITED,越南製造加工出口
423,HONG KONG ECONOMIC TIMES HOLDINGS LIMITED,經濟日報集團
425,MINTH GROUP LIMITED,敏實集團
426,ONE MEDIA GROUP LIMITED,萬華媒體
428,COCOON HOLDINGS LIMITED,中國天弓控股
430,ORIENTAL EXPLORER HOLDINGS LIMITED,東方興業控股
431,GREATER CHINA FINANCIAL HOLDINGS LIMITED,大中華金融
432,PACIFIC CENTURY PREMIUM DEVELOPMENTS LIMITED,盈大地產
433,NORTH MINING SHARES COMPANY LIMITED,北方礦業
434,BOYAA INTERACTIVE INTERNATIONAL LIMITED,博雅互動
435,SUNLIGHT REAL ESTATE INVESTMENT TRUST,陽光房地產基金
436,NEW UNIVERSE ENVIRONMENTAL GROUP LIMITED,新宇環保
438,IRICO GROUP NEW ENERGY COMPANY LIMITED,彩虹新能源
439,KUANGCHI SCIENCE LIMITED,光啟科學
440,DAH SING FINANCIAL HOLDINGS LTD,大新金融
442,"HIFOOD GROUP HOLDINGS CO., LIMITED",海福德集團
444,SINCERE WATCH (HONG KONG) LIMITED,SINCEREWATCH HK
449,CHIGO HOLDING LIMITED,志高控股
450,HUNG HING PRINTING GROUP LIMITED,鴻興印刷集團
451,GCL NEW ENERGY HOLDINGS LIMITED,協鑫新能源
455,TIANDA PHARMACEUTICALS LIMITED,天大藥業
456,NEW CITY DEVELOPMENT GROUP LIMITED,新城市建設發展
458,TRISTATE HOLDINGS LTD,聯亞集團
459,MIDLAND IC&I LIMITED,美聯工商舖
460,SIHUAN PHARMACEUTICAL HOLDINGS GROUP LTD.,四環醫藥
462,NATURAL DAIRY (NZ) HOLDINGS LIMITED,天然乳品
464,CHINA OVERSEAS NUOXIN INTERNATIONAL HOLDINGS LIMITED,中國海外諾信
465,FUTONG TECHNOLOGY DEVELOPMENT HOLDINGS LIMITED,富通科技
467,UNITED ENERGY GROUP LIMITED,聯合能源集團
468,GREATVIEW ASEPTIC PACKAGING COMPANY LIMITED,紛美包裝
471,CMMB VISION HOLDINGS LIMITED,中播控股
472,NEW SILKROAD CULTURALTAINMENT LIMITED,新絲路文旅
474,ACESO LIFE SCIENCE GROUP LIMITED,信銘生命科技
475,CENTRAL DEVELOPMENT HOLDINGS LIMITED,中發展控股
476,CHINA DYNAMICS (HOLDINGS) LIMITED,中國動力控股
479,CIL HOLDINGS LIMITED,華建控股
480,HKR INTERNATIONAL LTD,香港興業國際
482,SANDMARTIN INTERNATIONAL HOLDINGS LIMITED,聖馬丁國際
483,BAUHAUS INTERNATIONAL (HOLDINGS) LIMITED,包浩斯國際
484,FORGAME HOLDINGS LIMITED,雲遊控股
485,CHINA SINOSTAR GROUP COMPANY LIMITED,中國華星
486,"UNITED COMPANY RUSAL,INTERNATIONAL PUBLIC JOINT-STOCK COMPANY",俄鋁
487,SUCCESS UNIVERSE GROUP LIMITED,實德環球
488,LAI SUN DEVELOPMENT COMPANY LIMITED,麗新發展
489,DONGFENG MOTOR GROUP COMPANY LIMITED,東風集團股份
491,EMPEROR CULTURE GROUP LIMITED,英皇文化產業
493,GOME RETAIL HOLDINGS LIMITED,國美零售
495,PALADIN LTD,PALADIN
496,KASEN INTERNATIONAL HOLDINGS LIMITED,卡森國際
497,CSI PROPERTIES LIMITED,資本策略地產
498,BLUE RIVER HOLDINGS LIMITED,藍河控股
499,QINGDAO HOLDINGS INTERNATIONAL LIMITED,青島控股
500,FRONTIER SERVICES GROUP LIMITED,先豐服務集團
503,LANSEN PHARMACEUTICAL HOLDINGS LIMITED,朗生醫藥
505,XINGYE ALLOY MATERIALS GROUP LIMITED,興業合金
506,CHINA FOODS LIMITED,中國食品
508,DINGYI GROUP INVESTMENT LIMITED,鼎億集團投資
509,CENTURY SUNSHINE GROUP HOLDINGS LIMITED,世紀陽光
510,CASH FINANCIAL SERVICES GROUP LIMITED,時富金融服務集團
511,TELEVISION BROADCASTS LIMITED,電視廣播
512,CHINA GRAND PHARMACEUTICAL AND HEALTHCARE HOLDINGS LIMITED,遠大醫藥
513,CONTINENTAL HOLDINGS LIMITED,恆和集團
515,CHINA SILVER TECHNOLOGY HOLDINGS LIMITED,中華銀科技
517,"COSCO SHIPPING INTERNATIONAL (HONG KONG) CO., LTD.",中遠海運國際
518,TUNGTEX (HOLDINGS) CO. LTD,同得仕(集團)
519,APPLIED DEVELOPMENT HOLDINGS LIMITED,實力建業
520,"XIABUXIABU CATERING MANAGEMENT (CHINA) HOLDINGS CO., LTD.",呷哺呷哺
521,CWT INTERNATIONAL LIMITED,CWT INT'L
522,ASM PACIFIC TECHNOLOGY LIMITED,ASM PACIFIC
524,GREAT WALL BELT & ROAD HOLDINGS LIMITED,長城一帶一路
525,GUANGSHEN RAILWAY COMPANY LIMITED,廣深鐵路股份
526,CHINA AUTOMOBILE NEW RETAIL (HOLDINGS) LIMITED,中國汽車新零售
527,CHINA RUIFENG RENEWABLE ENERGY HOLDINGS LIMITED,瑞風新能源
528,KINGDOM HOLDINGS LIMITED,金達控股
529,SIS INTERNATIONAL HOLDINGS LIMITED,SIS INT'L
530,GOLDIN FINANCIAL HOLDINGS LIMITED,高銀金融
531,SAMSON HOLDING LTD.,順誠
532,WONG'S KONG KING INTERNATIONAL (HOLDINGS) LTD,WKK INTL (HOLD)
533,GOLDLION HOLDINGS LIMITED,金利來集團
535,GEMDALE PROPERTIES AND INVESTMENT CORPORATION LIMITED,金地商置
536,TRADELINK ELECTRONIC COMMERCE LIMITED,貿易通
538,AJISEN (CHINA) HOLDINGS LIMITED,味千(中國)
539,VICTORY CITY INTERNATIONAL HOLDINGS LIMITED,冠華國際控股
540,SPEEDY GLOBAL HOLDINGS LIMITED,迅捷環球控股
542,TFG INTERNATIONAL GROUP LIMITED,富元國際集團
543,PACIFIC ONLINE LIMITED,太平洋網絡
544,DAIDO GROUP LIMITED,大同集團
546,FUFENG GROUP LIMITED,阜豐集團
547,DIGITAL DOMAIN HOLDINGS LIMITED,數字王國
548,SHENZHEN EXPRESSWAY COMPANY LIMITED,深圳高速公路股份
550,KK CULTURE HOLDINGS LIMITED,KK文化
551,YUE YUEN INDUSTRIAL (HOLDINGS) LIMITED,裕元集團
552,CHINA COMMUNICATIONS SERVICES CORPORATION LIMITED,中國通信服務
553,NANJING PANDA ELECTRONICS COMPANY LIMITED,南京熊貓電子股份
554,HANS ENERGY COMPANY LIMITED,漢思能源
556,PAN ASIA ENVIRONMENTAL PROTECTION GROUP LIMITED,泛亞環保
557,CHINA TIAN YUAN HEALTHCARE GROUP LIMITED,天元醫療
558,L.K. TECHNOLOGY HOLDINGS LIMITED,力勁科技
559,DETAI NEW ENERGY GROUP LIMITED,德泰新能源集團
560,CHU KONG SHIPPING ENTERPRISES (GROUP) COMPANY LIMITED,珠江船務
563,SHANGHAI INDUSTRIAL URBAN DEVELOPMENT GROUP LIMITED,上實城市開發
564,ZHENGZHOU COAL MINING MACHINERY GROUP COMPANY LIMITED,鄭煤機
565,ART GROUP HOLDINGS LIMITED,錦藝集團控股
