stock_code,stock_name
8281,CHINA GOLDEN CLASSIC GROUP LIMITED
8282,GAMEONE HOLDINGS LIMITED
8283,ZHENG LI HOLDINGS LIMITED
8285,SLING GROUP HOLDINGS LIMITED
8286,SHANXI CHANGCHENG MICROLIGHT EQUIPMENT CO. LTD.
8287,ZIONCOM HOLDINGS LIMITED
8290,AHSAY BACKUP SOFTWARE DEVELOPMENT COMPANY LIMITED
8291,WAN CHENG METAL PACKAGING COMPANY LIMITED
8292,WORLDGATE GLOBAL LOGISTICS LTD
8293,SINGASIA HOLDINGS LIMITED
8295,ZHONGJIN TECHNOLOGY SERVICES GROUP COMPANY LIMITED
8296,SINO-LIFE GROUP LIMITED
8297,MY HEART BODIBRA GROUP LIMITED
8299,GRAND T G GOLD HOLDINGS LIMITED
8300,ROYAL CATERING GROUP HOLDINGS COMPANY LIMITED
8301,SHENZHEN MINGWAH AOHAN HIGH TECHNOLOGY CORPORATION LIMITED
8305,TONG KEE (HOLDING) LIMITED
8307,MEDICSKIN HOLDINGS LIMITED
8308,GUDOU HOLDINGS LIMITED
8309,MAN SHING GLOBAL HOLDINGS LIMITED
8310,DAFENG PORT HESHUN TECHNOLOGY COMPANY LIMITED
8311,PERFECT OPTRONICS LIMITED
8313,ZACD GROUP LTD.
8315,GREATWALLE INC.
8316,QUANTONG HOLDINGS LIMITED
8317,FINET GROUP LIMITED
8319,EXPERT SYSTEMS HOLDINGS LIMITED
8320,ALLIED SUSTAINABILITY AND ENVIRONMENTAL CONSULTANTS GROUP LIMITED
8321,TAI KAM HOLDINGS LIMITED
8325,CHINA SMARTPAY GROUP HOLDINGS LIMITED
8326,TONKING NEW ENERGY GROUP HOLDINGS LIMITED
8328,XINYI ELECTRIC STORAGE HOLDINGS LIMITED
8329,SHENZHEN NEPTUNUS INTERLONG BIO-TECHNIQUE COMPANY LIMITED
8331,P.B. GROUP LIMITED
8333,ASTRUM FINANCIAL HOLDINGS LIMITED
8337,DIRECTEL HOLDINGS LIMITED
8340,VINCO FINANCIAL GROUP LIMITED
8341,AESO HOLDING LIMITED
8347,F8 ENTERPRISES (HOLDINGS) GROUP LIMITED
8348,TIANJIN BINHAI TEDA LOGISTICS (GROUP) CORPORATION LIMITED
8349,MEIGU TECHNOLOGY HOLDING GROUP LIMITED
8350,EXCALIBUR GLOBAL FINANCIAL HOLDINGS LIMITED
8351,LARRY JEWELRY INTERNATIONAL COMPANY LIMITED
8353,ANACLE SYSTEMS LIMITED
8356,CNC HOLDINGS LIMITED
8357,REPUBLIC HEALTHCARE LIMITED
8360,AL GROUP LIMITED
8362,WINNING TOWER GROUP HOLDINGS LIMITED
8363,SDM GROUP HOLDINGS LIMITED
8365,VBG INTERNATIONAL HOLDINGS LIMITED
8366,ZHEJIANG UNITED INVESTMENT HOLDINGS GROUP LIMITED
8367,SIMPLICITY HOLDING LIMITED
8368,CREATIVE CHINA HOLDINGS LIMITED
8370,ZHI SHENG GROUP HOLDINGS LIMITED
8371,TASTE.GOURMET GROUP LIMITED
8372,GRAND BRILLIANCE GROUP HOLDINGS LIMITED
8373,INDIGO STAR HOLDINGS LIMITED
8375,VERTICAL INTERNATIONAL HOLDINGS LIMITED
8377,SHEN YOU HOLDINGS LIMITED
8379,PRIME INTELLIGENCE SOLUTIONS GROUP LIMITED
8383,LINOCRAFT HOLDINGS LIMITED
8385,PROSPEROUS PRINTING COMPANY LIMITED
8391,CORNERSTONE TECHNOLOGIES HOLDINGS LIMITED
8392,SATU HOLDINGS LIMITED
8395,TREE HOLDINGS LIMITED
8400,ASIA PIONEER ENTERTAINMENT HOLDINGS LIMITED
8401,STREAM IDEAS GROUP LIMITED
8402,GT STEEL CONSTRUCTION GROUP LIMITED
8403,DOWWAY HOLDINGS LIMITED
8405,HANG CHI HOLDINGS LIMITED
8406,ALPHA ERA INTERNATIONAL HOLDINGS LIMITED
8411,K W NELSON INTERIOR DESIGN AND CONTRACTING GROUP LIMITED
8412,BCI GROUP HOLDINGS LIMITED
8413,ASIA GROCERY DISTRIBUTION LIMITED
8416,HM INTERNATIONAL HOLDINGS LIMITED
8417,DADI EDUCATION HOLDINGS LIMITED
8418,OPTIMA AUTOMOBILE GROUP HOLDINGS LIMITED
8419,AV PROMOTIONS HOLDINGS LIMITED
8420,NEXION TECHNOLOGIES LIMITED
8422,WT GROUP HOLDINGS LIMITED
8423,CHI HO DEVELOPMENT HOLDINGS LIMITED
8425,HING MING HOLDINGS LIMITED
8426,MODERN LIVING INVESTMENTS HOLDINGS LIMITED
8427,SK TARGET GROUP LIMITED
8428,CBK HOLDINGS LIMITED
8429,ICICLE GROUP HOLDINGS LIMITED
8430,C&N HOLDINGS LIMITED
8431,HAO BAI INTERNATIONAL (CAYMAN) LIMITED
8432,BAR PACIFIC GROUP HOLDINGS LIMITED
8436,TAKBO GROUP HOLDINGS LIMITED
8437,RMH HOLDINGS LIMITED
8439,SOMERLEY CAPITAL HOLDINGS LIMITED
8441,IWS GROUP HOLDINGS LIMITED
8445,NOBLE ENGINEERING GROUP HOLDINGS LIMITED
8446,IN TECHNICAL PRODUCTIONS HOLDINGS LIMITED
8447,MS CONCEPT LIMITED
8448,UNIVERSE PRINTSHOP HOLDINGS LIMITED
8450,EDICO HOLDINGS LIMITED
8451,SUNLIGHT (1977) HOLDINGS LIMITED
8452,"FY FINANCIAL (SHENZHEN) CO., LTD."
8455,LAI GROUP HOLDING COMPANY LIMITED
8456,MANSION INTERNATIONAL HOLDINGS LIMITED
8460,BASETROPHY GROUP HOLDINGS LIMITED
8462,OMNIBRIDGE HOLDINGS LIMITED
8471,REACH NEW HOLDINGS LIMITED
8472,LAPCO HOLDINGS LIMITED
8473,MI MING MART HOLDINGS LIMITED
8475,K GROUP HOLDINGS LIMITED
8476,OCEAN ONE HOLDING LTD.
8479,JTF INTERNATIONAL HOLDINGS LIMITED
8480,FURNIWEB HOLDINGS LIMITED
8481,SHENGLONG SPLENDECOR INTERNATIONAL LIMITED
8482,WAN LEADER INTERNATIONAL LIMITED
8483,MAX SIGHT GROUP HOLDINGS LIMITED
8487,ISP GLOBAL LIMITED
8489,GRAND POWER LOGISTICS GROUP LIMITED
8490,NICHE-TECH GROUP LIMITED
8491,COOL LINK (HOLDINGS) LIMITED
8493,DRAGON KING GROUP HOLDINGS LIMITED
8495,1957 & CO. (HOSPITALITY) LIMITED
8496,SINGAPORE FOOD HOLDINGS LIMITED
8500,ICON CULTURE GLOBAL COMPANY LIMITED
8501,SANBASE CORPORATION LIMITED
8502,OCEAN LINE PORT DEVELOPMENT LIMITED
8506,CHINA FUTEX HOLDINGS LIMITED
8507,I.CENTURY HOLDING LIMITED
8509,WINE'S LINK INTERNATIONAL HOLDINGS LIMITED
8510,TOP STANDARD CORPORATION
8511,ZHICHENG TECHNOLOGY GROUP LTD.
8512,HYFUSIN GROUP HOLDINGS LIMITED
8513,IAG HOLDINGS LIMITED
8516,GRAND TALENTS GROUP HOLDINGS LIMITED
8519,JIA GROUP HOLDINGS LIMITED
8521,ST INTERNATIONAL HOLDINGS COMPANY LIMITED
8523,SHEUNG MOON HOLDINGS LIMITED
8525,BAIYING HOLDINGS GROUP LIMITED
8526,WING FUNG GROUP ASIA LIMITED
8527,JLOGO HOLDINGS LIMITED
8532,POLYFAIR HOLDINGS LIMITED
8535,VISTAR HOLDINGS LIMITED
8536,TL NATURAL GAS HOLDINGS LIMITED
8537,CHONG FAI JEWELLERY GROUP HOLDINGS COMPANY LIMITED
8540,VICTORY SECURITIES (HOLDINGS) COMPANY LIMITED
8545,AMUSE GROUP HOLDING LIMITED
8547,PACIFIC LEGEND GROUP LIMITED
8558,MERDEKA FINANCIAL GROUP LIMITED -OLD
8559,MANSION INTERNATIONAL HOLDINGS LIMITED -OLD
8560,GREAT WORLD COMPANY HOLDINGS LTD -OLD
8561,FINSOFT FINANCIAL INVESTMENT HOLDINGS LIMITED-OLD
8565,CREATIVE CHINA HOLDINGS LIMITED -TEMPORARY COUNTER
8566,GURU ONLINE (HOLDINGS) LIMITED -TEMPORARY COUNTER
8567,CHINA TECHNOLOGY INDUSTRY GROUP LIMITED -TEMPORARY COUNTER
8568,COOL LINK (HOLDINGS) LIMITED -TEMPORARY COUNTER
8569,TL NATURAL GAS HOLDINGS LIMITED -TEMPORARY COUNTER
8601,BOLTEK HOLDINGS LIMITED
8603,FAMEGLOW HOLDINGS LIMITED
8606,KINETIX SYSTEMS HOLDINGS LIMITED
8607,NARNIA (HONG KONG) GROUP COMPANY LIMITED
8609,EGGRICULTURE FOODS LTD.
8611,MINDTELL TECHNOLOGY LIMITED
8612,WORLD SUPER HOLDINGS LIMITED
8613,ORIENTAL PAYMENT GROUP HOLDINGS LIMITED
8616,SUNRAY ENGINEERING GROUP LIMITED
8617,BEST LINKING GROUP HOLDINGS LIMITED
8619,WAC HOLDINGS LIMITED
8620,ASIA-EXPRESS LOGISTICS HOLDINGS LIMITED
8621,METROPOLIS CAPITAL HOLDINGS LIMITED
8622,HUAKANG BIOMEDICAL HOLDINGS COMPANY LIMITED
8623,CHINA SAFTOWER INTERNATIONAL HOLDING GROUP LIMITED
8627,ORANGE TOUR CULTURAL HOLDING LIMITED
8631,SUN KONG HOLDINGS LIMITED
8635,NOVACON TECHNOLOGY GROUP LIMITED
8645,NOMAD TECHNOLOGIES HOLDINGS LIMITED
8646,CHINA HONGGUANG HOLDINGS LIMITED
8657,TRUE PARTNER CAPITAL HOLDING LIMITED
8659,YIK WO INTERNATIONAL HOLDINGS LIMITED
8668,YING HAI GROUP HOLDINGS COMPANY LIMITED
9001,PREMIA CHINA USD PROPERTY BOND ETF -USD TRADED UNITS
9010,ISHARES CORE MSCI ASIA EX JAPAN ETF -USD COUNTER
9011,ICBC CICC USD MONEY MARKET ETF -USD TRADED UNITS
9022,ISHARES MSCI EMERGING MARKETS ETF (HK)- USD TRADED UNITS
9031,HAITONG MSCI CHINA A ESG ETF - USD TRADED UNITS
9047,SSIF DCE IRON ORE FUTURES INDEX ETF -USD TRADED UNITS
9067,ISHARES HANG SENG TECH ETF - USD TRADED UNITS
9069,CHINAAMC HANG SENG HONG KONG BIOTECH INDEX ETF-USD TRADED UNITS
9072,NIKKO AM GLOBAL INTERNET ETF-USD TRADED UNITS
9074,ISHARES CORE MSCI TAIWAN ETF - USD TRADED UNITS
9077,PREMIA US TREASURY FLOATING RATE ETF -USD TRADED UNITS
9078,PREMIA US TREASURY FLOATING RATE ETF- ACCUMULATING UNIT CLASS
9081,VALUE GOLD ETF-USD TRADED UNITS
9085,VANGUARD FTSE ASIA EX JAPAN HIGH DIV YIELD INDEX ETF-USD TRADED UNITS
9086,CHINAAMC NASDAQ 100 ETF -USD TRADED UNITS
9088,CHINAAMC HANG SENG TECH INDEX ETF -USD TRADED UNITS
9091,NIKKOAM E-GAMES ACTIVE ETF - USD TRADED UNITS
9096,CSOP US DOLLAR MONEY MARKET ETF -USD TRADED UNITS
9101,VANGUARD FTSE DEVELOPED EUROPE INDEX ETF -USD TRADED UNITS
9115,ISHARES CORE HANG SENG INDEX ETF -USD TRADED UNITS
9126,VANGUARD FTSE JAPAN INDEX ETF -USD TRADED UNITS
9140,VANGUARD S&P 500 INDEX ETF -USD TRADED UNITS
9141,CHINAAMC ASIA USD INVESTMENT GRADE BOND ETF-USD TRADED UNITS
9167,ICBC CSOP S&P NEW CHINA SECTORS ETF -USD TRADED UNITS
9169,VANGUARD TOTAL CHINA INDEX ETF -USD TRADED UNITS
9170,ISHARES CORE KOSPI 200 ETF - USD TRADED UNITS
9173,PREMIA CSI CAIXIN CHINA NEW ECONOMY ETF-USD TRADED UNITS
9181,PREMIA ASIA INNOVATIVE TECHNOLOGY ETF -USD TRADED UNITS
9186,CICC KRANESHARES CSI CHINA INTERNET INDEX ETF-USD TRADED UNITS
9187,SAMSUNG S&P HIGH DIVIDEND APAC EX NZ REITS ETF-USD TRADED UNITS
9191,GLOBAL X CHINA SEMICONDUCTOR ETF - USD TRADED SHARES
9600,NEWLINK TECHNOLOGY INC.
9608,SUNDY SERVICE GROUP CO. LTD
9616,NEUSOFT EDUCATION TECHNOLOGY CO. LIMITED
9618,"JD.COM, INC."
9626,BILIBILI INC.
9633,"NONGFU SPRING CO., LTD."
9666,"JINKE SMART SERVICES GROUP CO., LTD."
9668,"CHINA BOHAI BANK CO., LTD."
9677,"WEIHAI CITY COMMERCIAL BANK CO., LTD."
9688,ZAI LAB LIMITED
9698,GDS HOLDINGS LIMITED
9803,PREMIA CSI CAIXIN CHINA BEDROCK ECONOMY ETF-USD TRADED UNITS
9804,PREMIA MSCI VIETNAM ETF-USD TRADED UNITS
9805,VANGUARD FTSE ASIA EX JAPAN INDEX ETF -USD TRADED UNITS
9806,GLOBAL X CHINA CONSUMER BRAND ETF - USD TRADED SHARES
9807,GLOBAL X CHINA ROBOTICS AND AI ETF - USD TRADED SHARES
9809,GLOBAL X CHINA CLEAN ENERGY ETF - USD TRADED SHARES
9810,PREMIA DOW JONES EMERGING ASEAN TITANS 100 ETF-USD TRADED UNITS
9812,SAMSUNG CSI CHINA DRAGON INTERNET ETF - USD TRADED UNIT
9813,CHINAAMC BLOOMBERG BARCLAYS CHI TREASURY + POLCY BK BD IND ETF-USD TRADED UNITS
9814,SAMSUNG NYSE FANG+ETF -USD TRADED UNITS
9817,PREMIA CHINA TREASURY AND POLICY BANK BOND LONG DURATION ETF-USD TRADED UNITS
9820,GLOBAL X CHINA BIOTECH ETF -USD TRADED UNITS
9826,GLOBAL X CHINA CLOUD COMPUTING ETF -USD TRADED UNITS
9834,ISHARES NASDAQ 100 ETF - USD TRADED UNITS
9836,ISHARES CORE S&P BSE SENSEX INDIA ETF -USD COUNTER
9845,GLOBAL X CHINA ELECTRIC VEHICLE ETF- USD TRADED SHARES
9846,ISHARES CORE CSI 300 ETF -USD COUNTER
9858,CHINA YOURAN DAIRY GROUP LIMITED
9868,XPENG INC.
9888,"BAIDU, INC."
9900,GAIN PLUS HOLDINGS LIMITED
9901,NEW ORIENTAL EDUCATION & TECHNOLOGY GROUP INC.
9906,HONLIV HEALTHCARE MANAGEMENT GROUP COMPANY LIMITED
9908,"JIAXING GAS GROUP CO., LTD."
9909,POWERLONG COMMERCIAL MANAGEMENT HOLDINGS LIMITED
9911,NEWBORN TOWN INC.
9913,CHI KAN HOLDINGS LIMITED
9916,XINGYE WULIAN SERVICE GROUP CO. LTD.
9918,WISE ALLY INTERNATIONAL HOLDINGS LIMITED
9919,ACTIVATION GROUP HOLDINGS LIMITED
9922,JIUMAOJIU INTERNATIONAL HOLDINGS LIMITED
9923,YEAHKA LIMITED
9926,"AKESO, INC."
9928,TIMES NEIGHBORHOOD HOLDINGS LIMITED
9929,SEM HOLDINGS LIMITED
9933,GHW INTERNATIONAL
9936,XIMEI RESOURCES HOLDING LIMITED
9938,WAH WO HOLDINGS GROUP LIMITED
9939,KINTOR PHARMACEUTICAL LIMITED
9958,LITIAN PICTURES HOLDINGS LIMITED
9959,LINKLOGIS INC.
9960,"KINDSTAR GLOBALGENE TECHNOLOGY, INC."
9961,TRIP.COM GROUP LIMITED
9963,TRANSTECH OPTELECOM SCIENCE HOLDINGS LIMITED
9966,ALPHAMAB ONCOLOGY
9968,HUIJING HOLDINGS COMPANY LIMITED
9969,INNOCARE PHARMA LIMITED
9977,"SHANDONG FENGXIANG CO., LTD."
9978,FINELAND LIVING SERVICES GROUP LIMITED
9979,GREENTOWN MANAGEMENT HOLDINGS COMPANY LIMITED
9982,CENTRAL CHINA MANAGEMENT COMPANY LIMITED
9983,CENTRAL CHINA NEW LIFE LIMITED
9986,DASHAN EDUCATION HOLDINGS LIMITED
9987,"YUM CHINA HOLDINGS, INC."
9988,ALIBABA GROUP HOLDING LIMITED
9989,"SHENZHEN HEPALINK PHARMACEUTICAL GROUP CO., LTD."
9990,ARCHOSAUR GAMES INC.
9991,BAOZUN INC.
9992,POP MART INTERNATIONAL GROUP LIMITED
9993,RADIANCE HOLDINGS (GROUP) COMPANY LIMITED
9995,"REMEGEN CO., LTD."
9996,PEIJIA MEDICAL LIMITED
9997,KANGJI MEDICAL HOLDINGS LIMITED
9998,KWAN YONG HOLDINGS LIMITED
9999,"NETEASE, INC."
30002,"RAYTRON TECHNOLOGY CO.,LTD. (A #688002)"
30006,ZHEJIANG HANGKE TECHNOLOGY INCORPORATED COMPANY (A #688006)
30008,"MONTAGE TECHNOLOGY CO., LTD. (A #688008)"
30009,CHINA RAILWAY SIGNAL & COMMUNICATION CORPORATION LIMITED (A #688009)
30012,ADVANCED MICRO-FABRICATION EQUIPMENT INC. CHINA (A #688012)
30019,"ANJI MICROELECTRONICS TECHNOLOGY (SHANGHAI) CO., LTD. (A #688019)"
30026,"GUANGZHOU JET BIOFILTRATION CO.,LTD. (A #688026)"
30036,TRANSSION HOLDINGS LTD.CO (A #688036)
30088,ARCSOFT CORPORATION LIMITED (A #688088)
30111,BEIJING KINGSOFT OFFICE SOFTWARE.INC (A #688111)
30122,"WESTERN SUPERCONDUCTING TECHNOLOGIES CO.,LTD. (A #688122)"
30126,"NATIONAL SILICON INDUSTRY GROUP CO., LTD. (A #688126)"
30139,"QINGDAO HAIER BIOMEDICAL CO., LTD. (A #688139)"
30166,"BRIGHTGENE BIO-MEDICAL TECHNOLOGY CO.,LTD. (A #688166)"
30169,"BEIJING ROBOROCK TECHNOLOGY CO ., LTD. (A #688169)"
30180,"SHANGHAI JUNSHI BIOSCIENCES CO., LTD. (A #688180)"
30185,CANSINO BIOLOGICS INC. (A #688185)
30188,SHANGHAI FRIENDESS ELECTRONIC TECHNOLOGY CORPORATION LTD (A #688188)
30202,SHANGHAI MEDICILON INC. (A #688202)
30208,"AUTEL INTELLIGENT TECHNOLOGY CORP., LTD. (A #688208)"
30298,"ZHEJIANG ORIENT GENE BIOTECH CO., LTD (A #688298)"
30366,SHANGHAI HAOHAI BIOLOGICAL TECHNOLOGY CO. LTD. (A #688366)
30505,SHANGHAI FUDAN-ZHANGJIANG BIO-PHARMACEUTICAL CO.LTD (A #688505)
70001,"PING AN BANK CO., LTD. (A #000001)"
70002,"CHINA VANKE CO., LTD. (A #000002)"
70005,SHENZHEN FOUNTAIN CORPORATION (A #000005)
70006,"SHENZHEN ZHENYE (GROUP) CO.,LTD. (A #000006)"
70008,"CHINA HIGH-SPEED RAILWAY TECHNOLOGY CO., LTD. (A #000008)"
70009,"CHINA BAOAN GROUP CO.,LTD. (A #000009)"
70010,"SHENZHEN ECOBEAUTY CO., LTD. (A #000010)"
70011,SHENZHEN PROPERTIES & RESOURCES DEVELOPMENT (GROUP) LTD. (A #000011)
70012,"CSG HOLDING CO.,LTD. (A #000012)"
70016,"KONKA GROUP CO.,LTD (A #000016)"
70019,"SHENZHEN CEREALS HOLDINGS CO.,LTD. (A #000019)"
70021,"SHENZHEN KAIFA TECHNOLOGY CO., LTD (A #000021)"
70025,"SHENZHEN TELLUS HOLDING CO.,LTD (A #000025)"
70027,"SHENZHEN ENERGY GROUP CO., LTD. (A #000027)"
70028,CHINA NATIONAL ACCORD MEDICINES CORPORATION LTD. (A #000028)
70029,"SHENZHEN SPECIAL ECONOMIC ZONE REAL ESTATE&PROP (GROUP) CO.,LTD. (A #000029)"
70030,FAWER AUTOMOTIVE PARTS LIMITED COMPANY (A #000030)
70031,"GRANDJOY HOLDINGS GROUP CO., LTD. (A #000031)"
70032,"SHENZHEN SED INDUSTRY CO.,LTD (A #000032)"
70034,"DIGITAL CHINA GROUP CO.,LTD. (A #000034)"
70035,CHINA TIANYING INC. (A #000035)
70036,CHINA UNION HOLDINGS LTD. (A #000036)
70039,"CHINA INTERNATIONAL MARINE CONTAINERS (GROUP) CO., LTD (A #000039)"
70040,"TUNGHSU AZURE RENEWABLE ENERGY CO.,LTD. (A #000040)"
70042,"SHENZHEN CENTRALCON INVESTMENT HOLDING CO., LTD (A #000042)"
70045,"SHENZHEN TEXTILE (HOLDINGS) CO., LTD (A #000045)"
70046,"OCEANWIDE HOLDINGS CO., LTD. (A #000046)"
70048,"SHENZHEN KINGKEY SMART AGRICULTURE TIMES CO.,LTD (A #000048)"
70049,"SHENZHEN DESAY BATTERY TECHNOLOGY CO.,LTD (A #000049)"
70050,"TIANMA MICROELECTRONICS CO., LTD (A #000050)"
70055,"CHINA FANGDA GROUP CO., LTD (A #000055)"
70058,"SHENZHEN SEG CO.,LTD (A #000058)"
70059,"NORTH HUAJIN CHEMICAL INDUSTRIES CO.,LTD (A #000059)"
70060,"SHENZHEN ZHONGJIN LINGNAN NONFEMET CO.,LTD (A #000060)"
70061,"SHENZHEN AGRICULTURAL PRODUCTS GROUP CO.,LTD (A #000061)"
70062,"SHENZHEN HUAQIANG INDUSTRY CO., LTD (A #000062)"
70063,ZTE CORPORATION (A #000063)
70065,NORINCO INTERNATIONAL COOPERATION LTD. (A #000065)
70066,"CHINA GREATWALL TECHNOLOGY GROUP CO., LTD. (A #000066)"
70068,"SHENZHEN HUAKONG SEG CO.,LTD. (A #000068)"
70069,"SHENZHEN OVERSEAS CHINESE TOWN CO.,LTD (A #000069)"
70070,"SHENZHEN SDG INFORMATION CO., LTD (A #000070)"
70078,"SHENZHEN NEPTUNUS BIOENGINEERING CO.,LTD (A #000078)"
70088,"SHENZHEN YAN TIAN PORT HOLDINGS CO.,LTD (A #000088)"
70089,"SHENZHEN AIRPORT CO.,LTD (A #000089)"
70090,"SHENZHEN TAGEN GROUP CO., LTD. (A #000090)"
70096,"SHENZHEN GUANGJU ENERGY CO., LTD (A #000096)"
70099,"CITIC OFFSHORE HELICOPTER CO.,LTD (A #000099)"
70100,TCL TECHNOLOGY GROUP CORPORATION (A #000100)
70150,"YIHUA HEALTHCARE CO., LTD. (A #000150)"
70151,CHINA NATIONAL COMPLETE PLANT IMPORT & EXPORT CORPORATION LIMITED (A #000151)
70155,SICHUAN NEW ENERGY POWER COMPANY LIMITED (A #000155)
70156,"WASU MEDIA HOLDING CO.,LTD (A #000156)"
70157,"ZOOMLION HEAVY INDUSTRY SCIENCE AND TECHNOLOGY CO., LTD (A #000157)"
70158,"SHIJIAZHUANG CHANGSHAN BEIMING TECHNOLOGY CO., LTD(A #000158)"
70166,"SHENWAN HONGYUAN GROUP CO.,LTD (A #000166)"
70301,"JIANGSU EASTERN SHENGHONG CO.,LTD. (A #000301)"
70333,"MIDEA GROUP CO., LTD. (A #000333)"
70338,"WEICHAI POWER CO., LTD. (A #000338)"
70400,"XJ ELECTRIC CO.,LTD (A #000400)"
70401,"TANGSHAN JIDONG CEMENT CO.,LTD (A #000401)"
70402,"FINANCIAL STREET HOLDINGS CO., LTD. (A #000402)"
70403,"PACIFIC SHUANGLIN BIO-PHARMACY CO., LTD (A #000403)"
70407,"SHANDONG SHENGLI CO., LTD. (A #000407)"
70409,"YUNDING TECHNOLOGY CO.,LTD. (A #000409)"
70410,"SHENYANG MACHINE TOOL CO.,LTD (A #000410)"
70413,"TUNGHSU OPTOELECTRONIC TECHNOLOGY CO., LTD. (A #000413)"
70415,"BOHAI LEASING CO.,LTD. (A #000415)"
70417,"HEFEI DEPARTMENT STORE GROUP CO.,LTD (A #000417)"
70422,"HUBEI YIHUA CHEMICAL INDUSTRY CO., LTD (A #000422)"
70423,"DONG-E-E-JIAO CO., LTD. (A #000423)"
70425,"XCMG CONSTRUCTION MACHINERY CO., LTD. (A #000425)"
70426,"INNER MONGOLIA XINGYE MINING CO.,LTD (A #000426)"
70428,"HUATIAN HOTEL GROUP CO.,LTD. (A #000428)"
70429,"GUANGDONG PROVINCIAL EXPRESSWAY DEVELOPMENT CO.,LTD (A #000429)"
70488,"SHANDONG CHENMING PAPER HOLDINGS CO.,LTD (A #000488)"
70498,"SHANDONG HI-SPEED ROAD&BRIDGE GROUP CO., LTD. (A #000498)"
70501,WUHAN DEPARTMENT STORE GROUP CO.LTD (A #000501)
70503,"CHINA REFORM HEALTH MANAGEMENT AND SERVICES GROUP CO., LTD. (A #000503)"
70506,ZHONGRUN RESOURCES INVESTMENT CORPORATION (A #000506)
70507,"ZHUHAI PORT CO., LTD (A #000507)"
70510,"SICHUAN XINJINLU GROUP CO., LTD. (A# 000510)"
70513,LIVZON PHARMACEUTICAL GROUP INC. (A #000513)
70514,"CHONGQING YUKAIFA CO.,LTD (A #000514)"
70516,XI'AN INTERNATIONAL MEDICAL INVESTMENT COMPANY LIMITED (A #000516)
70517,"RONGAN PROPERTY CO.,LTD. (A #000517)"
70518,"JIANGSU SIHUAN BIOENGINEERING CO.,LTD (A #000518)"
70519,"NORTH INDUSTRIES GROUP RED ARROW CO., LTD (A #000519)"
70523,"LONKEY INDUSTRIAL CO.,LTD. GUANGZHOU (A #000523)"
70525,"NANJING RED SUN CO., LTD (A #000525)"
70528,"GUANGXI LIUGONG MACHINERY CO., LTD (A #000528)"
70531,"GUANGZHOU HENGYUN ENTERPRISES HOLDING CO.,LTD (A #000531)"
70532,"ZHUHAI HUAJIN CAPITAL CO., LTD (A #000532)"
70533,"GUANGDONG SHUNNA ELECTRIC CO.,LTD. (A #000533)"
70536,"CPT TECHNOLOGY (GROUP) CO., LTD (A #000536)"
70537,"TIANJIN GUANGYU DEVELOPMENT CO., LTD (A #000537)"
70538,"YUNNAN BAIYAO GROUP CO.,LTD. (A #000538)"
70539,"GUANGDONG ELECTRIC POWER DEVELOPMENT CO., LTD (A #000539)"
70540,ZHONGTIAN FINANCIAL GROUP COMPANY LIMITED (A #000540)
70541,"FOSHAN ELECTRICAL AND LIGHTING CO., LTD (A #000541)"
70543,"AN HUI WENERGY CO.,LTD (A #000543)"
70544,"CENTRAL PLAINS ENVIRONMENT PROTECTION CO.,LTD (A #000544)"
70546,"JINYUAN EP CO.,LTD. (A #000546)"
70547,"ADDSINO CO.,LTD (A #000547)"
70550,"JIANGLING MOTORS CO., LTD (A #000550)"
70552,"GANSU JINGYUAN COAL INDUSTRY AND ELECTRICITY POWER CO., LTD (A #000552)"
70553,ADAMA LTD. (A #000553)
70555,DIGITAL CHINA INFORMATION SERVICE COMPANY LTD. (A #000555)
70558,"LANDER SPORTS DEVELOPMENT CO.,LTD (A #000558)"
70559,"WANXIANG QIANCHAO CO.,LTD (A #000559)"
70560,"5I5J HOLDING GROUP CO., LTD. (A #000560)"
70561,"SHAANXI FENGHUO ELECTRONICS CO., LTD. (A #000561)"
70563,"SHAANXI INTERNATIONAL TRUST CO.,LTD. (A #000563)"
70564,"CCOOP GROUP CO., LTD (A #000564)"
70566,"HAINAN HAIYAO CO.,LTD (A #000566)"
70567,"HAINAN HAIDE CAPITAL MANAGEMENT CO., LTD. (A #000567)"
70568,"LUZHOU LAO JIAO CO.,LTD (A #000568)"
70571,"SUNDIRO HOLDING CO., LTD. (A #000571)"
70572,"HAIMA AUTOMOBILE CO.,LTD. (A #000572)"
70576,"GUANGDONG GANHUA SCIENCE & INDUSTRY CO., LTD. (A #000576)"
70581,"WEIFU HIGH-TECHNOLOGY GROUP CO.,LTD. (A #000581)"
70582,"BEIBU GULF PORT CO.,LTD. (A #000582)"
70584,"JIANGSU HAGONG INTELLIGENT ROBOT CO.,LTD (A #000584)"
70585,NORTHEAST ELECTRIC DEVELOPMENT COMPANY LIMITED (A #000585)
70587,"JINZHOU CIHANG GROUP CO., LTD (A #000587)"
70591,"CECEP SOLAR ENERGY CO.,LTD. (A #000591)"
70592,ZHONGFU STRAITS (PINGTAN) DEVELOPMENT COMPANY LIMITED (A #000592)
70596,"ANHUI GUJING DISTILLERY CO.,LTD (A #000596)"
70597,"NORTHEAST PHARMACEUTICAL GROUP CO.,LTD (A #000597)"
70598,"CHENGDU XINGRONG ENVIRONMENT CO., LTD. (A #000598)"
70600,"JOINTO ENERGY INVESTMENT CO.,LTD. HEBEI (A #000600)"
70601,"GUANGDONG SHAONENG GROUP CO.,LTD (A #000601)"
70603,"SHENGDA RESOURCES CO.,LTD (A #000603)"
70605,"BOHAI WATER INDUSTRY CO.,LTD (A #000605)"
70607,"ZHEJIANG HUAMEI HOLDING CO., LTD. (A #000607)"
70612,"JIAOZUO WANFANG ALUMINUM MANUFACTURING CO., LTD (A #000612)"
70615,"AOYUAN BEAUTY VALLEY TECHNOLOGY CO.,LTD. (A #000615)"
70616,"HNA INVESTMENT GROUP CO.,LTD. (A #000616)"
70617,CNPC CAPITAL COMPANY LIMITED (A #000617)
70620,"MACROLINK CULTURALTAINMENT DEVELOPMENT CO., LTD. (A #000620)"
70623,"JILIN AODONG PHARMACEUTICAL GROUP CO., LTD. (A #000623)"
70625,CHONGQING CHANGAN AUTOMOBILE COMPANY LIMITED (A #000625)
70627,"HUBEI BIOCAUSE PHARMACEUTICAL CO.,LTD (A #000627)"
70629,"PANGANG GROUP VANADIUM TITANIUM & RESOURCES CO., LTD. (A #000629)"
70630,"TONGLING NONFERROUS METALS GROUP CO.,LTD. (A #000630)"
70631,SHUNFA HENGYE CORPORATION (A #000631)
70635,"NINGXIA YINGLITE CHEMICALS CO.,LTD (A #000635)"
70636,"GUANDDONG FENGHUA ADVANCED TECHNOLOGY (HOLDING) CO., LTD (A #000636)"
70639,"XIWANG FOODSTUFFS CO.,LTD. (A #000639)"
70650,"RENHE PHARMACY CO.,LTD (A #000650)"
70651,"GREE ELECTRIC APPLIANCES,INC.OF ZHUHAI CO.,LTD (A #000651)"
70652,"TIANJIN TEDA CO., LTD. (A #000652)"
70656,"JINKE PROPERTY GROUP CO., LTD (A #000656)"
70657,"CHINA TUNGSTEN AND HIGHTECH MATERALS CO.,LTD (A #000657)"
70661,CHANGCHUN HIGH & NEW TECHNOLOGY INDUSTRY (GROUP) INC. (A #000661)
70665,"HUBEI RADIO & TELEVISION INFORMATION NETWORK CO., LTD. (A #000665)"
70666,"JINGWEI TEXTILE MACHINERY CO.,LTD. (A #000666)"
70667,"MYHOME REAL ESTATE DEVELOPMENT GROUP CO.,LTD. (A #000667)"
70669,"JINHONG HOLDING GROUP CO., LTD. (A #000669)"
70671,"YANGO GROUP CO., LTD (A #000671)"
70672,"GANSU SHANGFENG CEMENT CO., LTD (A #000672)"
70673,"LEAD EASTERN INVESTMENT CO., LTD (A #000673)"
70676,"GENIMOUS TECHNOLOGY CO.,LTD (A #000676)"
70680,"SHANTUI CONSTRUCTION MACHINERY CO.,LTD (A #000680)"
70681,"VISUAL CHINA GROUP CO.,LTD. (A #000681)"
70682,"DONGFANG ELECTRONICS CO.,LTD (A #000682)"
70683,INNER MONGOLIA YUAN XING ENERGY COMPANY LIMITED (A #000683)
70685,"ZHONGSHAN PUBLIC UTILITIES GROUP CO.,LTD. (A #000685)"
70686,"NORTHEAST SECURITIES CO.,LTD. (A #000686)"
70687,"HUAXUN FANGZHOU CO.,LTD (A #000687)"
70688,"GUOCHENG MINING CO.,LTD (A #000688)"
70690,"GUANGDONG BAOLIHUA NEW ENERGY STOCK CO., LTD. (A #000690)"
70697,"LIGEANCE AEROSPACE TECHNOLOGY CO.,LTD. (A #000697)"
70700,"JIANGNAN MOULD & PLASTIC TECHNOLOGY CO.,LTD (A #000700)"
70701,XIAMEN XINDECO LTD. (A #000701)
70703,"HENGYI PETROCHEMICAL CO., LTD (A #000703)"
70708,"CITIC PACIFIC SPECIAL STEEL GROUP CO., LTD (A #000708)"
70709,HBIS COMPANY LIMITED (A #000709)
70710,"BERRY GENOMICS CO.,LTD (A #000710)"
70712,GUANGDONG GOLDEN DRAGON DEVELOPMENT INC. (A #000712)
70717,"SGIS SONGSHAN CO., LTD. (A #000717)"
70718,"SUNING UNIVERSAL CO.,LTD. (A #000718)"
70719,"CENTRAL CHINA LAND MEDIA CO.,LTD (A #000719)"
70720,"SHANDONG XINNENG TAISHAN POWER GENERATION CO.,LTD. (A #000720)"
70722,"HUNAN DEVELOPMENT GROUP CO.,LTD (A #000722)"
70723,"SHANXI MEIJIN ENERGY CO., LTD (A #000723)"
70725,"BOE TECHNOLOGY GROUP CO., LTD (A #000725)"
70726,"LU THAI TEXTILE CO., LTD (A #000726)"
70727,"TPV TECHNOLOGY CO., LTD. (A #000727)"
70728,GUOYUAN SECURITIES COMPANY LIMITED (A #000728)
70729,"BEIJING YANJING BREWERY CO.,LTD (A #000729)"
70732,"THAIHOT GROUP CO.,LTD (A #000732)"
70733,"CHINA ZHENHUA(GROUP) SCIENCE& TECHNOLOGY CO.,LTD (A #000733)"
70735,"LUONIUSHAN CO., LTD. (A #000735)"
70738,"AECC AERO-ENGINE CONTROL CO., LTD. (A #000738)"
70739,"APELOA PHARMACEUTICAL CO.,LTD. (A #000739)"
70750,"SEALAND SECURITIES CO., LTD. (A #000750)"
70751,"HULUDAO ZINC INDUSTRY CO.,LTD (A #000751)"
70756,SHANDONG XINHUA PHARMACEUTICAL COMPANY LIMITED (A #000756)
70758,"CHINA NONFERROUS METAL IND FOREIGN ENG & CONSTRU CO., LTD. (A #000758)"
70761,"BENGANG STEEL PLATES CO.,LTD (A #000761)"
70762,"TIBET MINERAL DEVELOPMENT CO.,LTD (A #000762)"
70766,"TONGHUA GOLDEN-HORSE PHARMACEUTICAL INDUSTRY CO,LTD (A #000766)"
70767,"JINNENG HOLDING SHANXI ELECTRIC POWER CO.,LTD. (A #000767)"
70768,AVIC XI'AN AIRCRAFT INDUSTRY GROUP COMPANY LTD. (A #000768)
70776,"GF SECURITIES CO.,LTD (A #000776)"
70777,"SUFA TECHNOLOGY INDUSTRY CO.,LTD.,CNNC. (A #000777)"
70778,"XINXING DUCTILE IRON PIPES CO., LTD (A #000778)"
70782,"GUANGDONG XINHUI MEIDA NYLON CO., LTD (A #000782)"
70783,"CHANGJIANG SECURITIES CO., LTD (A #000783)"
70785,"EASYHOME NEW RETAIL GROUP CO., LTD (A #000785)"
70786,BEIJING NEW BUILDING MATERIALS PUBLIC LIMITED COMPANY (A #000786)
70789,"JIANGXI WANNIANQING CEMENT CO.,LTD (A #000789)"
70792,"QINGHAI SALT LAKE INDUSTRY CO., LTD. (A #000792)"
70793,HUAWEN MEDIA GROUP(A #000793)
70795,"INNUOVO TECHNOLOGY CO.,LTD. (A# 000795)"
70796,"CAISSA TOSUN DEVELOPMENT CO., LTD. (A #000796)"
70797,"CHINA WUYI CO.,LTD (A #000797)"
70799,"JIUGUI LIQUOR CO., LTD. (A #000799)"
70800,"FAW JIEFANG GROUP CO., LTD (A #000800)"
70801,"SICHUAN JIUZHOU ELECTRONIC CO., LTD (A #000801)"
70802,"BEIJING JINGXI CULTURE&TOURISM CO.,LTD (A #000802)"
70806,"GALAXY BIOMEDICAL INVESTMENT CO.,LTD. (A #000806)"
70807,"YUNNAN ALUMINIUM CO.,LTD (A #000807)"
70810,"SKYWORTH DIGITAL CO.,LTD. (A #000810)"
70811,"MOON ENVIRONMENT TECHNOLOGY CO.,LTD. (A #000811)"
70815,"MCC MEILI CLOUD COMPUTING INDUSTRY INVESTMENT CO., LTD (A #000815)"
