stock_code,stock_name,stock_name_chi
9616,NEUSOFT EDUCATION TECHNOLOGY CO. LIMITED,東軟教育
9618,"JD.COM, INC.",京東集團-SW
9626,BILIBILI INC.,嗶哩嗶哩-SW
9633,"NONGFU SPRING CO., LTD.",農夫山泉
9666,"JINKE SMART SERVICES GROUP CO., LTD.",金科服務
9668,"CHINA BOHAI BANK CO., LTD.",渤海銀行
9677,"WEIHAI CITY COMMERCIAL BANK CO., LTD.",威海銀行
9688,ZAI LAB LIMITED,再鼎醫藥-SB
9698,GDS HOLDINGS LIMITED,萬國數據-SW
9803,PREMIA CSI CAIXIN CHINA BEDROCK ECONOMY ETF-USD TRADED UNITS,PP中國基石-U
9804,PREMIA MSCI VIETNAM ETF-USD TRADED UNITS,PP越南-U
9805,VANGUARD FTSE ASIA EX JAPAN INDEX ETF -USD TRADED UNITS,領航亞洲-U
9806,GLOBAL X CHINA CONSUMER BRAND ETF - USD TRADED SHARES,GX中國消費-U
9807,GLOBAL X CHINA ROBOTICS AND AI ETF - USD TRADED SHARES,GX中國機智-U
9809,GLOBAL X CHINA CLEAN ENERGY ETF - USD TRADED SHARES,GX中國潔能-U
9810,PREMIA DOW JONES EMERGING ASEAN TITANS 100 ETF-USD TRADED UNITS,ＰＰ新興東盟-Ｕ
9812,SAMSUNG CSI CHINA DRAGON INTERNET ETF - USD TRADED UNIT,三星中國龍網-U
9813,CHINAAMC BLOOMBERG BARCLAYS CHI TREASURY + POLCY BK BD IND ETF-USD TRADED UNITS,華夏政銀國債-U
9814,SAMSUNG NYSE FANG+ETF -USD TRADED UNITS,三星FANG-U
9817,PREMIA CHINA TREASURY AND POLICY BANK BOND LONG DURATION ETF-USD TRADED UNITS,PP長期國債-U
9820,GLOBAL X CHINA BIOTECH ETF -USD TRADED UNITS,GX中國生科-U
9826,GLOBAL X CHINA CLOUD COMPUTING ETF -USD TRADED UNITS,GX中國雲算-U
9834,ISHARES NASDAQ 100 ETF - USD TRADED UNITS,安碩納指一百－Ｕ
9836,ISHARES CORE S&P BSE SENSEX INDIA ETF -USD COUNTER,安碩印度-U
9845,GLOBAL X CHINA ELECTRIC VEHICLE ETF- USD TRADED SHARES,GX中國電車-U
9846,ISHARES CORE CSI 300 ETF -USD COUNTER,安碩滬深三百-U
9858,CHINA YOURAN DAIRY GROUP LIMITED,優然牧業
9868,XPENG INC.,小鵬汽車-W
9888,"BAIDU, INC.",百度集團-SW
9900,GAIN PLUS HOLDINGS LIMITED,德益控股
9901,NEW ORIENTAL EDUCATION & TECHNOLOGY GROUP INC.,新東方-S
9906,HONLIV HEALTHCARE MANAGEMENT GROUP COMPANY LIMITED,宏力醫療管理
9908,"JIAXING GAS GROUP CO., LTD.",嘉興燃氣
9909,POWERLONG COMMERCIAL MANAGEMENT HOLDINGS LIMITED,寶龍商業
9911,NEWBORN TOWN INC.,赤子城科技
9913,CHI KAN HOLDINGS LIMITED,智勤控股
9916,XINGYE WULIAN SERVICE GROUP CO. LTD.,興業物聯
9918,WISE ALLY INTERNATIONAL HOLDINGS LIMITED,麗年國際
9919,ACTIVATION GROUP HOLDINGS LIMITED,艾德韋宣集團
9922,JIUMAOJIU INTERNATIONAL HOLDINGS LIMITED,九毛九
9923,YEAHKA LIMITED,移卡
9926,"AKESO, INC.",康方生物-B
9928,TIMES NEIGHBORHOOD HOLDINGS LIMITED,時代鄰里
9929,SEM HOLDINGS LIMITED,澳達控股
9933,GHW INTERNATIONAL,GHW INTERNATIONAL
9936,XIMEI RESOURCES HOLDING LIMITED,稀美資源
9938,WAH WO HOLDINGS GROUP LIMITED,華和控股
9939,KINTOR PHARMACEUTICAL LIMITED,開拓藥業-B
9958,LITIAN PICTURES HOLDINGS LIMITED,力天影業
9959,LINKLOGIS INC.,聯易融科技-W
9960,"KINDSTAR GLOBALGENE TECHNOLOGY, INC.",康聖環球
9961,TRIP.COM GROUP LIMITED,攜程集團-S
9963,TRANSTECH OPTELECOM SCIENCE HOLDINGS LIMITED,高科橋
9966,ALPHAMAB ONCOLOGY,康寧傑瑞製藥-B
9968,HUIJING HOLDINGS COMPANY LIMITED,匯景控股
9969,INNOCARE PHARMA LIMITED,諾誠健華-Ｂ
9977,"SHANDONG FENGXIANG CO., LTD.",鳳祥股份
9978,FINELAND LIVING SERVICES GROUP LIMITED,方圓生活服務
9979,GREENTOWN MANAGEMENT HOLDINGS COMPANY LIMITED,綠城管理控股
9982,CENTRAL CHINA MANAGEMENT COMPANY LIMITED,中原建業
9983,CENTRAL CHINA NEW LIFE LIMITED,建業新生活
9986,DASHAN EDUCATION HOLDINGS LIMITED,大山教育
9987,"YUM CHINA HOLDINGS, INC.",百勝中國-S
9988,ALIBABA GROUP HOLDING LIMITED,阿里巴巴-SW
9989,"SHENZHEN HEPALINK PHARMACEUTICAL GROUP CO., LTD.",海普瑞
9990,ARCHOSAUR GAMES INC.,祖龍娛樂
9991,BAOZUN INC.,寶尊電商-SW
9992,POP MART INTERNATIONAL GROUP LIMITED,泡泡瑪特
9993,RADIANCE HOLDINGS (GROUP) COMPANY LIMITED,金輝控股
9995,"REMEGEN CO., LTD.",榮昌生物－Ｂ
9996,PEIJIA MEDICAL LIMITED,沛嘉醫療-B
9997,KANGJI MEDICAL HOLDINGS LIMITED,康基醫療
9998,KWAN YONG HOLDINGS LIMITED,光榮控股
9999,"NETEASE, INC.",網易-S
30002,"RAYTRON TECHNOLOGY CO.,LTD. (A #688002)",睿創微納
30006,ZHEJIANG HANGKE TECHNOLOGY INCORPORATED COMPANY (A #688006),杭可科技
30008,"MONTAGE TECHNOLOGY CO., LTD. (A #688008)",瀾起科技
30009,CHINA RAILWAY SIGNAL & COMMUNICATION CORPORATION LIMITED (A #688009),中國通號
30012,ADVANCED MICRO-FABRICATION EQUIPMENT INC. CHINA (A #688012),中微公司
30019,"ANJI MICROELECTRONICS TECHNOLOGY (SHANGHAI) CO., LTD. (A #688019)",安集科技
30026,"GUANGZHOU JET BIOFILTRATION CO.,LTD. (A #688026)",潔特生物
30036,TRANSSION HOLDINGS LTD.CO (A #688036),傳音控股
30088,ARCSOFT CORPORATION LIMITED (A #688088),虹軟科技
30111,BEIJING KINGSOFT OFFICE SOFTWARE.INC (A #688111),金山辦公
30122,"WESTERN SUPERCONDUCTING TECHNOLOGIES CO.,LTD. (A #688122)",西部超導
30126,"NATIONAL SILICON INDUSTRY GROUP CO., LTD. (A #688126)",滬矽產業-U
30139,"QINGDAO HAIER BIOMEDICAL CO., LTD. (A #688139)",海爾生物
30166,"BRIGHTGENE BIO-MEDICAL TECHNOLOGY CO.,LTD. (A #688166)",博瑞醫藥
30169,"BEIJING ROBOROCK TECHNOLOGY CO ., LTD. (A #688169)",石頭科技
30180,"SHANGHAI JUNSHI BIOSCIENCES CO., LTD. (A #688180)",君實生物
30185,CANSINO BIOLOGICS INC. (A #688185),康希諾-U
30188,SHANGHAI FRIENDESS ELECTRONIC TECHNOLOGY CORPORATION LTD (A #688188),柏楚電子
30202,SHANGHAI MEDICILON INC. (A #688202),美迪西
30208,"AUTEL INTELLIGENT TECHNOLOGY CORP., LTD. (A #688208)",道通科技
30298,"ZHEJIANG ORIENT GENE BIOTECH CO., LTD (A #688298)",東方生物
30366,SHANGHAI HAOHAI BIOLOGICAL TECHNOLOGY CO. LTD. (A #688366),昊海生科
30505,SHANGHAI FUDAN-ZHANGJIANG BIO-PHARMACEUTICAL CO.LTD (A #688505),復旦張江
70001,"PING AN BANK CO., LTD. (A #000001)",平安銀行
70002,"CHINA VANKE CO., LTD. (A #000002)",萬 科Ａ
70005,SHENZHEN FOUNTAIN CORPORATION (A #000005),ST星源
70006,"SHENZHEN ZHENYE (GROUP) CO.,LTD. (A #000006)",深振業Ａ
70008,"CHINA HIGH-SPEED RAILWAY TECHNOLOGY CO., LTD. (A #000008)",神州高鐵
70009,"CHINA BAOAN GROUP CO.,LTD. (A #000009)",中國寶安
70010,"SHENZHEN ECOBEAUTY CO., LTD. (A #000010)",美麗生態
70011,SHENZHEN PROPERTIES & RESOURCES DEVELOPMENT (GROUP) LTD. (A #000011),深物業A
70012,"CSG HOLDING CO.,LTD. (A #000012)",南 玻Ａ
70016,"KONKA GROUP CO.,LTD (A #000016)",深康佳Ａ
70019,"SHENZHEN CEREALS HOLDINGS CO.,LTD. (A #000019)",深糧控股
70021,"SHENZHEN KAIFA TECHNOLOGY CO., LTD (A #000021)",深科技
70025,"SHENZHEN TELLUS HOLDING CO.,LTD (A #000025)",特力Ａ
70027,"SHENZHEN ENERGY GROUP CO., LTD. (A #000027)",深圳能源
70028,CHINA NATIONAL ACCORD MEDICINES CORPORATION LTD. (A #000028),國藥一致
70029,"SHENZHEN SPECIAL ECONOMIC ZONE REAL ESTATE&PROP (GROUP) CO.,LTD. (A #000029)",深深房Ａ
70030,FAWER AUTOMOTIVE PARTS LIMITED COMPANY (A #000030),富奧股份
70031,"GRANDJOY HOLDINGS GROUP CO., LTD. (A #000031)",大悅城
70032,"SHENZHEN SED INDUSTRY CO.,LTD (A #000032)",深桑達A
70034,"DIGITAL CHINA GROUP CO.,LTD. (A #000034)",神州數碼
70035,CHINA TIANYING INC. (A #000035),中國天楹
70036,CHINA UNION HOLDINGS LTD. (A #000036),華聯控股
70039,"CHINA INTERNATIONAL MARINE CONTAINERS (GROUP) CO., LTD (A #000039)",中集集團
70040,"TUNGHSU AZURE RENEWABLE ENERGY CO.,LTD. (A #000040)",東旭藍天
70042,"SHENZHEN CENTRALCON INVESTMENT HOLDING CO., LTD (A #000042)",中洲控股
70045,"SHENZHEN TEXTILE (HOLDINGS) CO., LTD (A #000045)",深紡織Ａ
70046,"OCEANWIDE HOLDINGS CO., LTD. (A #000046)",泛海控股
70048,"SHENZHEN KINGKEY SMART AGRICULTURE TIMES CO.,LTD (A #000048)",京基智農
70049,"SHENZHEN DESAY BATTERY TECHNOLOGY CO.,LTD (A #000049)",德賽電池
70050,"TIANMA MICROELECTRONICS CO., LTD (A #000050)",深天馬Ａ
70055,"CHINA FANGDA GROUP CO., LTD (A #000055)",方大集團
70058,"SHENZHEN SEG CO.,LTD (A #000058)",深 賽 格
70059,"NORTH HUAJIN CHEMICAL INDUSTRIES CO.,LTD (A #000059)",華錦股份
70060,"SHENZHEN ZHONGJIN LINGNAN NONFEMET CO.,LTD (A #000060)",中金嶺南
70061,"SHENZHEN AGRICULTURAL PRODUCTS GROUP CO.,LTD (A #000061)",農 產 品
70062,"SHENZHEN HUAQIANG INDUSTRY CO., LTD (A #000062)",深圳華強
70063,ZTE CORPORATION (A #000063),中興通訊
70065,NORINCO INTERNATIONAL COOPERATION LTD. (A #000065),北方國際
70066,"CHINA GREATWALL TECHNOLOGY GROUP CO., LTD. (A #000066)",中國長城
70068,"SHENZHEN HUAKONG SEG CO.,LTD. (A #000068)",華控賽格
70069,"SHENZHEN OVERSEAS CHINESE TOWN CO.,LTD (A #000069)",華僑城Ａ
70070,"SHENZHEN SDG INFORMATION CO., LTD (A #000070)",特發信息
70078,"SHENZHEN NEPTUNUS BIOENGINEERING CO.,LTD (A #000078)",海王生物
70088,"SHENZHEN YAN TIAN PORT HOLDINGS CO.,LTD (A #000088)",鹽 田 港
70089,"SHENZHEN AIRPORT CO.,LTD (A #000089)",深圳機場
70090,"SHENZHEN TAGEN GROUP CO., LTD. (A #000090)",天健集團
70096,"SHENZHEN GUANGJU ENERGY CO., LTD (A #000096)",廣聚能源
70099,"CITIC OFFSHORE HELICOPTER CO.,LTD (A #000099)",中信海直
70100,TCL TECHNOLOGY GROUP CORPORATION (A #000100),TCL科技
70150,"YIHUA HEALTHCARE CO., LTD. (A #000150)",宜華健康
70151,CHINA NATIONAL COMPLETE PLANT IMPORT & EXPORT CORPORATION LIMITED (A #000151),中成股份
70155,SICHUAN NEW ENERGY POWER COMPANY LIMITED (A #000155),川能動力
70156,"WASU MEDIA HOLDING CO.,LTD (A #000156)",華數傳媒
70157,"ZOOMLION HEAVY INDUSTRY SCIENCE AND TECHNOLOGY CO., LTD (A #000157)",中聯重科
70158,"SHIJIAZHUANG CHANGSHAN BEIMING TECHNOLOGY CO., LTD(A #000158)",常山北明
70166,"SHENWAN HONGYUAN GROUP CO.,LTD (A #000166)",申萬宏源
70301,"JIANGSU EASTERN SHENGHONG CO.,LTD. (A #000301)",東方盛虹
70333,"MIDEA GROUP CO., LTD. (A #000333)",美的集團
70338,"WEICHAI POWER CO., LTD. (A #000338)",濰柴動力
70400,"XJ ELECTRIC CO.,LTD (A #000400)",許繼電氣
70401,"TANGSHAN JIDONG CEMENT CO.,LTD (A #000401)",冀東水泥
70402,"FINANCIAL STREET HOLDINGS CO., LTD. (A #000402)",金 融 街
70403,"PACIFIC SHUANGLIN BIO-PHARMACY CO., LTD (A #000403)",派林生物
70407,"SHANDONG SHENGLI CO., LTD. (A #000407)",勝利股份
70409,"YUNDING TECHNOLOGY CO.,LTD. (A #000409)",雲鼎科技
70410,"SHENYANG MACHINE TOOL CO.,LTD (A #000410)",ST瀋機
70413,"TUNGHSU OPTOELECTRONIC TECHNOLOGY CO., LTD. (A #000413)",東旭光電
70415,"BOHAI LEASING CO.,LTD. (A #000415)",渤海租賃
70417,"HEFEI DEPARTMENT STORE GROUP CO.,LTD (A #000417)",合肥百貨
70422,"HUBEI YIHUA CHEMICAL INDUSTRY CO., LTD (A #000422)",湖北宜化
70423,"DONG-E-E-JIAO CO., LTD. (A #000423)",東阿阿膠
70425,"XCMG CONSTRUCTION MACHINERY CO., LTD. (A #000425)",徐工機械
70426,"INNER MONGOLIA XINGYE MINING CO.,LTD (A #000426)",興業礦業
70428,"HUATIAN HOTEL GROUP CO.,LTD. (A #000428)",華天酒店
70429,"GUANGDONG PROVINCIAL EXPRESSWAY DEVELOPMENT CO.,LTD (A #000429)",粵高速Ａ
70488,"SHANDONG CHENMING PAPER HOLDINGS CO.,LTD (A #000488)",晨鳴紙業
70498,"SHANDONG HI-SPEED ROAD&BRIDGE GROUP CO., LTD. (A #000498)",山東路橋
70501,WUHAN DEPARTMENT STORE GROUP CO.LTD (A #000501),鄂武商Ａ
70503,"CHINA REFORM HEALTH MANAGEMENT AND SERVICES GROUP CO., LTD. (A #000503)",國新健康
70506,ZHONGRUN RESOURCES INVESTMENT CORPORATION (A #000506),中潤資源
70507,"ZHUHAI PORT CO., LTD (A #000507)",珠海港
70510,"SICHUAN XINJINLU GROUP CO., LTD. (A# 000510)",新金路
70513,LIVZON PHARMACEUTICAL GROUP INC. (A #000513),麗珠集團
70514,"CHONGQING YUKAIFA CO.,LTD (A #000514)",渝 開 發
70516,XI'AN INTERNATIONAL MEDICAL INVESTMENT COMPANY LIMITED (A #000516),國際醫學
70517,"RONGAN PROPERTY CO.,LTD. (A #000517)",榮安地產
70518,"JIANGSU SIHUAN BIOENGINEERING CO.,LTD (A #000518)",四環生物
70519,"NORTH INDUSTRIES GROUP RED ARROW CO., LTD (A #000519)",中兵紅箭
70523,"LONKEY INDUSTRIAL CO.,LTD. GUANGZHOU (A #000523)",*ST浪奇
70525,"NANJING RED SUN CO., LTD (A #000525)",ST紅太陽
70528,"GUANGXI LIUGONG MACHINERY CO., LTD (A #000528)",柳 工
70531,"GUANGZHOU HENGYUN ENTERPRISES HOLDING CO.,LTD (A #000531)",穗恆運Ａ
70532,"ZHUHAI HUAJIN CAPITAL CO., LTD (A #000532)",華金資本
70533,"GUANGDONG SHUNNA ELECTRIC CO.,LTD. (A #000533)",順鈉股份
70536,"CPT TECHNOLOGY (GROUP) CO., LTD (A #000536)",華映科技
70537,"TIANJIN GUANGYU DEVELOPMENT CO., LTD (A #000537)",廣宇發展
70538,"YUNNAN BAIYAO GROUP CO.,LTD. (A #000538)",雲南白藥
70539,"GUANGDONG ELECTRIC POWER DEVELOPMENT CO., LTD (A #000539)",粵電力Ａ
70540,ZHONGTIAN FINANCIAL GROUP COMPANY LIMITED (A #000540),中天金融
70541,"FOSHAN ELECTRICAL AND LIGHTING CO., LTD (A #000541)",佛山照明
70543,"AN HUI WENERGY CO.,LTD (A #000543)",皖能電力
70544,"CENTRAL PLAINS ENVIRONMENT PROTECTION CO.,LTD (A #000544)",中原環保
70546,"JINYUAN EP CO.,LTD. (A #000546)",金圓股份
70547,"ADDSINO CO.,LTD (A #000547)",航天發展
70550,"JIANGLING MOTORS CO., LTD (A #000550)",江鈴汽車
70552,"GANSU JINGYUAN COAL INDUSTRY AND ELECTRICITY POWER CO., LTD (A #000552)",靖遠煤電
70553,ADAMA LTD. (A #000553),安道麥A
70555,DIGITAL CHINA INFORMATION SERVICE COMPANY LTD. (A #000555),神州信息
70558,"LANDER SPORTS DEVELOPMENT CO.,LTD (A #000558)",萊茵體育
70559,"WANXIANG QIANCHAO CO.,LTD (A #000559)",萬向錢潮
70560,"5I5J HOLDING GROUP CO., LTD. (A #000560)",我愛我家
70561,"SHAANXI FENGHUO ELECTRONICS CO., LTD. (A #000561)",烽火電子
70563,"SHAANXI INTERNATIONAL TRUST CO.,LTD. (A #000563)",陝國投Ａ
70564,"CCOOP GROUP CO., LTD (A #000564)",*ST大集
70566,"HAINAN HAIYAO CO.,LTD (A #000566)",海南海藥
70567,"HAINAN HAIDE CAPITAL MANAGEMENT CO., LTD. (A #000567)",海德股份
70568,"LUZHOU LAO JIAO CO.,LTD (A #000568)",瀘州老窖
70571,"SUNDIRO HOLDING CO., LTD. (A #000571)",ST大洲
70572,"HAIMA AUTOMOBILE CO.,LTD. (A #000572)",海馬汽車
70576,"GUANGDONG GANHUA SCIENCE & INDUSTRY CO., LTD. (A #000576)",甘化科工
70581,"WEIFU HIGH-TECHNOLOGY GROUP CO.,LTD. (A #000581)",威孚高科
70582,"BEIBU GULF PORT CO.,LTD. (A #000582)",北部灣港
70584,"JIANGSU HAGONG INTELLIGENT ROBOT CO.,LTD (A #000584)",哈工智能
70585,NORTHEAST ELECTRIC DEVELOPMENT COMPANY LIMITED (A #000585),*ST東電
70587,"JINZHOU CIHANG GROUP CO., LTD (A #000587)",*ST金洲
70591,"CECEP SOLAR ENERGY CO.,LTD. (A #000591)",太陽能
70592,ZHONGFU STRAITS (PINGTAN) DEVELOPMENT COMPANY LIMITED (A #000592),平潭發展
70596,"ANHUI GUJING DISTILLERY CO.,LTD (A #000596)",古井貢酒
70597,"NORTHEAST PHARMACEUTICAL GROUP CO.,LTD (A #000597)",東北製藥
70598,"CHENGDU XINGRONG ENVIRONMENT CO., LTD. (A #000598)",興蓉環境
70600,"JOINTO ENERGY INVESTMENT CO.,LTD. HEBEI (A #000600)",建投能源
70601,"GUANGDONG SHAONENG GROUP CO.,LTD (A #000601)",韶能股份
70603,"SHENGDA RESOURCES CO.,LTD (A #000603)",盛達資源
70605,"BOHAI WATER INDUSTRY CO.,LTD (A #000605)",渤海股份
70607,"ZHEJIANG HUAMEI HOLDING CO., LTD. (A #000607)",華媒控股
70612,"JIAOZUO WANFANG ALUMINUM MANUFACTURING CO., LTD (A #000612)",焦作萬方
70615,"AOYUAN BEAUTY VALLEY TECHNOLOGY CO.,LTD. (A #000615)",奧園美谷
70616,"HNA INVESTMENT GROUP CO.,LTD. (A #000616)",ST海投
70617,CNPC CAPITAL COMPANY LIMITED (A #000617),中油資本
70620,"MACROLINK CULTURALTAINMENT DEVELOPMENT CO., LTD. (A #000620)",新華聯
70623,"JILIN AODONG PHARMACEUTICAL GROUP CO., LTD. (A #000623)",吉林敖東
70625,CHONGQING CHANGAN AUTOMOBILE COMPANY LIMITED (A #000625),長安汽車
70627,"HUBEI BIOCAUSE PHARMACEUTICAL CO.,LTD (A #000627)",天茂集團
70629,"PANGANG GROUP VANADIUM TITANIUM & RESOURCES CO., LTD. (A #000629)",攀鋼釩鈦
70630,"TONGLING NONFERROUS METALS GROUP CO.,LTD. (A #000630)",銅陵有色
70631,SHUNFA HENGYE CORPORATION (A #000631),順發恆業
70635,"NINGXIA YINGLITE CHEMICALS CO.,LTD (A #000635)",英 力 特
70636,"GUANDDONG FENGHUA ADVANCED TECHNOLOGY (HOLDING) CO., LTD (A #000636)",風華高科
70639,"XIWANG FOODSTUFFS CO.,LTD. (A #000639)",西王食品
70650,"RENHE PHARMACY CO.,LTD (A #000650)",仁和藥業
70651,"GREE ELECTRIC APPLIANCES,INC.OF ZHUHAI CO.,LTD (A #000651)",格力電器
70652,"TIANJIN TEDA CO., LTD. (A #000652)",泰達股份
70656,"JINKE PROPERTY GROUP CO., LTD (A #000656)",金科股份
70657,"CHINA TUNGSTEN AND HIGHTECH MATERALS CO.,LTD (A #000657)",中鎢高新
70661,CHANGCHUN HIGH & NEW TECHNOLOGY INDUSTRY (GROUP) INC. (A #000661),長春高新
70665,"HUBEI RADIO & TELEVISION INFORMATION NETWORK CO., LTD. (A #000665)",湖北廣電
70666,"JINGWEI TEXTILE MACHINERY CO.,LTD. (A #000666)",經緯紡機
70667,"MYHOME REAL ESTATE DEVELOPMENT GROUP CO.,LTD. (A #000667)",美好置業
70669,"JINHONG HOLDING GROUP CO., LTD. (A #000669)",*ST金鴻
70671,"YANGO GROUP CO., LTD (A #000671)",陽 光 城
70672,"GANSU SHANGFENG CEMENT CO., LTD (A #000672)",上峰水泥
70673,"LEAD EASTERN INVESTMENT CO., LTD (A #000673)",*ST當代
70676,"GENIMOUS TECHNOLOGY CO.,LTD (A #000676)",智度股份
70680,"SHANTUI CONSTRUCTION MACHINERY CO.,LTD (A #000680)",山推股份
70681,"VISUAL CHINA GROUP CO.,LTD. (A #000681)",視覺中國
70682,"DONGFANG ELECTRONICS CO.,LTD (A #000682)",東方電子
70683,INNER MONGOLIA YUAN XING ENERGY COMPANY LIMITED (A #000683),遠興能源
70685,"ZHONGSHAN PUBLIC UTILITIES GROUP CO.,LTD. (A #000685)",中山公用
70686,"NORTHEAST SECURITIES CO.,LTD. (A #000686)",東北證券
70687,"HUAXUN FANGZHOU CO.,LTD (A #000687)",*ST 華訊
70688,"GUOCHENG MINING CO.,LTD (A #000688)",國城礦業
70690,"GUANGDONG BAOLIHUA NEW ENERGY STOCK CO., LTD. (A #000690)",寶新能源
70697,"LIGEANCE AEROSPACE TECHNOLOGY CO.,LTD. (A #000697)",煉石航空
70700,"JIANGNAN MOULD & PLASTIC TECHNOLOGY CO.,LTD (A #000700)",模塑科技
70701,XIAMEN XINDECO LTD. (A #000701),廈門信達
70703,"HENGYI PETROCHEMICAL CO., LTD (A #000703)",恆逸石化
70708,"CITIC PACIFIC SPECIAL STEEL GROUP CO., LTD (A #000708)",中信特鋼
70709,HBIS COMPANY LIMITED (A #000709),河鋼股份
70710,"BERRY GENOMICS CO.,LTD (A #000710)",貝瑞基因
70712,GUANGDONG GOLDEN DRAGON DEVELOPMENT INC. (A #000712),錦龍股份
70717,"SGIS SONGSHAN CO., LTD. (A #000717)",韶鋼松山
70718,"SUNING UNIVERSAL CO.,LTD. (A #000718)",蘇寧環球
70719,"CENTRAL CHINA LAND MEDIA CO.,LTD (A #000719)",中原傳媒
70720,"SHANDONG XINNENG TAISHAN POWER GENERATION CO.,LTD. (A #000720)",新能泰山
70722,"HUNAN DEVELOPMENT GROUP CO.,LTD (A #000722)",湖南發展
70723,"SHANXI MEIJIN ENERGY CO., LTD (A #000723)",美錦能源
70725,"BOE TECHNOLOGY GROUP CO., LTD (A #000725)",京東方Ａ
70726,"LU THAI TEXTILE CO., LTD (A #000726)",魯 泰Ａ
70727,"TPV TECHNOLOGY CO., LTD. (A #000727)",冠捷科技
70728,GUOYUAN SECURITIES COMPANY LIMITED (A #000728),國元證券
70729,"BEIJING YANJING BREWERY CO.,LTD (A #000729)",燕京啤酒
70732,"THAIHOT GROUP CO.,LTD (A #000732)",泰禾集團
70733,"CHINA ZHENHUA(GROUP) SCIENCE& TECHNOLOGY CO.,LTD (A #000733)",振華科技
70735,"LUONIUSHAN CO., LTD. (A #000735)",羅 牛 山
70738,"AECC AERO-ENGINE CONTROL CO., LTD. (A #000738)",航發控制
70739,"APELOA PHARMACEUTICAL CO.,LTD. (A #000739)",普洛藥業
70750,"SEALAND SECURITIES CO., LTD. (A #000750)",國海證券
70751,"HULUDAO ZINC INDUSTRY CO.,LTD (A #000751)",鋅業股份
70756,SHANDONG XINHUA PHARMACEUTICAL COMPANY LIMITED (A #000756),新華製藥
70758,"CHINA NONFERROUS METAL IND FOREIGN ENG & CONSTRU CO., LTD. (A #000758)",中色股份
70761,"BENGANG STEEL PLATES CO.,LTD (A #000761)",本鋼板材
70762,"TIBET MINERAL DEVELOPMENT CO.,LTD (A #000762)",西藏礦業
70766,"TONGHUA GOLDEN-HORSE PHARMACEUTICAL INDUSTRY CO,LTD (A #000766)",通化金馬
70767,"JINNENG HOLDING SHANXI ELECTRIC POWER CO.,LTD. (A #000767)",晉控電力
70768,AVIC XI'AN AIRCRAFT INDUSTRY GROUP COMPANY LTD. (A #000768),中航西飛
70776,"GF SECURITIES CO.,LTD (A #000776)",廣發證券
70777,"SUFA TECHNOLOGY INDUSTRY CO.,LTD.,CNNC. (A #000777)",中核科技
70778,"XINXING DUCTILE IRON PIPES CO., LTD (A #000778)",新興鑄管
70782,"GUANGDONG XINHUI MEIDA NYLON CO., LTD (A #000782)",美達股份
70783,"CHANGJIANG SECURITIES CO., LTD (A #000783)",長江證券
70785,"EASYHOME NEW RETAIL GROUP CO., LTD (A #000785)",居然之家
70786,BEIJING NEW BUILDING MATERIALS PUBLIC LIMITED COMPANY (A #000786),北新建材
70789,"JIANGXI WANNIANQING CEMENT CO.,LTD (A #000789)",萬年青
70792,"QINGHAI SALT LAKE INDUSTRY CO., LTD. (A #000792)",*ST鹽湖
70793,HUAWEN MEDIA GROUP(A #000793),華聞集團
70795,"INNUOVO TECHNOLOGY CO.,LTD. (A# 000795)",英洛華
70796,"CAISSA TOSUN DEVELOPMENT CO., LTD. (A #000796)",凱撒旅業
70797,"CHINA WUYI CO.,LTD (A #000797)",中國武夷
70799,"JIUGUI LIQUOR CO., LTD. (A #000799)",酒鬼酒
70800,"FAW JIEFANG GROUP CO., LTD (A #000800)",一汽解放
70801,"SICHUAN JIUZHOU ELECTRONIC CO., LTD (A #000801)",四川九洲
70802,"BEIJING JINGXI CULTURE&TOURISM CO.,LTD (A #000802)",ST北文
70806,"GALAXY BIOMEDICAL INVESTMENT CO.,LTD. (A #000806)",ST銀河
70807,"YUNNAN ALUMINIUM CO.,LTD (A #000807)",雲鋁股份
70810,"SKYWORTH DIGITAL CO.,LTD. (A #000810)",創維數字
70811,"MOON ENVIRONMENT TECHNOLOGY CO.,LTD. (A #000811)",冰輪環境
70815,"MCC MEILI CLOUD COMPUTING INDUSTRY INVESTMENT CO., LTD (A #000815)",美利雲
70816,"JIANGSU NONGHUA INTELLIGENT AGRICULTURE TECH CO.,LTD. (A #000816)",智慧農業
70818,"HANGJIN TECHNOLOGY CO., LTD. (A #000818)",航錦科技
70819,"YUEYANG XINGCHANG PETRO-CHEMICAL CO.,LTD. (A #000819)",岳陽興長
70821,"J.S. CORRUGATING MACHINERY CO., LTD (A #000821)",京山輕機
70822,"SHANDONG HAIHUA CO.,LTD (A #000822)",山東海化
70823,"GUANGDONG GOWORLD CO., LTD (A #000823)",超聲電子
70825,SHANXI TAIGANG STAINLESS STEEL CO.LTD (A #000825),太鋼不鏽
70826,"TUS ENVIRONMENTAL SCIENCE AND TECHNOLOGY DEVELOPMENT CO., LTD. (A #000826)",啟迪環境
70828,"DONGGUAN DEVELOPMENT (HOLDINGS) CO., LTD (A #000828)",東莞控股
70829,"TELLING TELECOMMUNICATION HOLDING CO.,LTD. (A #000829)",天音控股
70830,"LUXI CHEMICAL GROUP CO.,LTD. (A #000830)",魯西化工
70831,"CHINA MINMETALS RARE EARTH CO.,LTD. (A #000831)",五礦稀土
70836,"TIANJIN FUTONG INFORMATION SCIENCE & TECHNOLOGY CO.,LTD. (A #000836)",富通信息
70837,"QINCHUAN MACHINE TOOL & TOOL GROUP SHARE CO., LTD (A #000837)",秦川機床
70838,"CASIN REAL ESTATE DEVELOPMENT GROUP CO.,LTD. (A #000838)",財信發展
70839,"CITIC GUOAN INFORMATION INDUSTRY CO., LTD (A #000839)",中信國安
70848,"HEBEI CHENGDE LOLO CO.,LTD (A #000848)",承德露露
70850,"ANHUI HUAMAO TEXTILE CO.,LTD (A #000850)",華茂股份
70851,"GOHIGH DATA NETWORKS TECHNOLOGY C0.,LTD (A #000851)",高鴻股份
70852,SINOPEC OILFIELD EQUIPMENT CORPORATION (A #000852),石化機械
70856,"TANGSHAN JIDONG EQUIPMENT ENGINEERING CO.,LTD (A #000856)",冀東裝備
70858,"WULIANGYE YIBIN CO.,LTD. (A #000858)",五 糧 液
70860,"BEIJING SHUNXIN AGRICULTURE CO.,LTD (A #000860)",順鑫農業
70861,"GUANGDONG HIGHSUN GROUP CO.,LTD. (A #000861)",海印股份
70863,"SANXIANG IMPRESSION CO.,LTD (A #000863)",三湘印象
70869,YANTAI CHANGYU PIONEER WINE COMPANY LIMITED (A #000869),張 裕Ａ
70875,"JILIN ELECTRIC POWER CO.,LTD. (A #000875)",吉電股份
70876,"NEW HOPE LIUHE CO.,LTD. (A #000876)",新 希 望
70877,"XINJIANG TIANSHAN CEMENT CO.,LTD (A #000877)",天山股份
70878,"YUNNAN COPPER CO.,LTD. (A #000878)",雲南銅業
70881,"CGN NUCLEAR TECHNOLOGY DEVELOPMENT CO., LTD. (A #000881)",中廣核技
70882,"BEIJING HUALIAN DEPARTMENT STORE CO.,LTD (A #000882)",華聯股份
70883,"HUBEI ENERGY GROUP CO., LTD (A #000883)",湖北能源
70885,"CITY DEVELOPMENT ENVIRONMENT CO.,LTD. (A #000885)",城發環境
70887,"ANHUI ZHONGDING SEALING PARTS CO.,LTD (A #000887)",中鼎股份
70888,"EMEI SHAN TOURISM CO.,LTD (A #000888)",峨眉山Ａ
70889,"ZJBC INFORMATION TECHNOLOGY CO.,LTD (A #000889)",中嘉博創
70893,"ASIA-POTASH INTERNATIONAL INVESTMENT (GUANGZHOU) CO., LTD. (A #000893)",亞鉀國際
70895,"HENAN SHUANGHUI INVESTMENT & DEVELOPMENT CO.,LTD (A #000895)",雙匯發展
70897,"TIANJIN JINBIN DEVELOPMENT CO., LTD (A #000897)",津濱發展
70898,"ANGANG STEEL CO.,LTD (A #000898)",鞍鋼股份
70900,"XIANDAI INVESTMENT CO., LTD (A #000900)",現代投資
70901,"AEROSPACE HI-TECH HOLDING GROUP CO., LTD. (A #000901)",航天科技
70902,"XINYANGFENG AGRICULTURAL TECHNOLOGY CO., LTD. (A #000902)",新洋豐
70903,"KUNMING YUNNEI POWER CO., LTD. (A #000903)",雲內動力
70905,"XIAMEN PORT DEVELOPMENT CO., LTD. (A #000905)",廈門港務
70908,"HUNAN JINGFENG PHARMACEUTICAL CO.,LTD. (A #000908)",景峰醫藥
70910,"DARE POWER DEKOR HOME CO.,LTD. (A #000910)",大亞聖象
70912,"SICHUAN LUTIANHUA CO.,LTD (A #000912)",瀘天化
70913,"ZHEJIANG QIANJIANG MOTORCYCLE CO.,LTD. (A #000913)",錢江摩托
70915,"SHANDONG WIT DYNE HEALTH CO.,LTD (A #000915)",華特達因
70917,"HUNAN TV&BROADCAST INTERMEDIARY CO., LTD. (A #000917)",電廣傳媒
70918,"CHINA CALXON GROUP CO., LTD. (A #000918)",嘉凱城
70919,"JINLING PHARMACEUTICAL CO.,LTD (A #000919)",金陵藥業
70920,"SOUTH HUITON CO.,LTD (A #000920)",南方匯通
70921,"HISENSE HOME APPLIANCES GROUP CO.,LTD. (A #000921)",海信家電
70922,"HARBIN ELECTRIC CORPORATION JIAMUSI ELECTRIC MACHINE CO.,LTD (A #000922)",佳電股份
70923,"HBIS RESOURCES CO., LTD. (A#000923)",河鋼資源
70925,"UNITTEC CO., LTD. (A #000925)",眾合科技
70926,"HUBEI FUXING SCIENCE AND TECHNOLOGY CO.,LTD (A #000926)",福星股份
70927,CHINA RAILWAY MATERIALS COMPANY LIMITED (A #000927),中國鐵物
70928,"SINOSTEEL ENGINEERING & TECHNOLOGY CO., LTD. (A #000928)",中鋼國際
70930,"COFCO BIOTECHNOLOGY CO., LTD. (A #000930)",中糧科技
70931,"BEIJING CENTERGATE TECHNOLOGIES (HOLDING) CO., LTD (A #000931)",中 關 村
70932,"HUNAN VALIN STEEL CO.,LTD (A #000932)",華菱鋼鐵
